mytophub/20191227/googlenet_bs_1.log
{"i": ["cuda -model=unknown", "topi_nn_conv2d", [["TENSOR", [1, 832, 6, 6], "float32"], ["TENSOR", [48, 832, 1, 1], "float32"], [1, 1], [0, 0], [1, 1], "NCHW", "float32"], {}, ["conv2d", [1, 832, 6, 6, "float32"], [48, 832, 1, 1, "float32"], [1, 1], [0, 0], [1, 1], "NCHW", "float32"], {"i": 2913153, "t": "direct", "c": null, "e": [["tile_f", "sp", [-1, 1, 8, 1]], ["tile_y", "sp", [-1, 1, 6, 1]], ["tile_x", "sp", [-1, 1, 2, 1]], ["tile_rc", "sp", [-1, 208]], ["tile_ry", "sp", [-1, 1]], ["tile_rx", "sp", [-1, 1]], ["auto_unroll_max_step", "ot", 1500], ["unroll_explicit", "ot", 1]]}], "r": [[1.1872329442015942e-05, 1.1872627564926716e-05, 1.1872665003857032e-05, 1.1872678889174595e-05, 1.1873090408845462e-05, 1.1873180869118026e-05, 1.1873339933144768e-05, 1.1873424685009e-05], 0, 10.731344223022461, 1576758189.9715924], "v": 0.1}
{"i": ["cuda -model=unknown", "topi_nn_conv2d", [["TENSOR", [1, 48, 6, 6], "float32"], ["TENSOR", [128, 48, 3, 3], "float32"], [1, 1], [1, 1], [1, 1], "NCHW", "float32"], {}, ["conv2d", [1, 48, 6, 6, "float32"], [128, 48, 3, 3, "float32"], [1, 1], [1, 1], [1, 1], "NCHW", "float32"], {"i": 6129142, "t": "direct", "c": null, "e": [["tile_f", "sp", [-1, 2, 8, 1]], ["tile_y", "sp", [-1, 1, 2, 1]], ["tile_x", "sp", [-1, 1, 6, 1]], ["tile_rc", "sp", [-1, 48]], ["tile_ry", "sp", [-1, 3]], ["tile_rx", "sp", [-1, 3]], ["auto_unroll_max_step", "ot", 512], ["unroll_explicit", "ot", 1]]}], "r": [[6.456541666666667e-06, 6.4567708478513354e-06, 6.456802526132405e-06, 6.4569219512195125e-06, 6.457119163763066e-06, 6.4571523228803716e-06, 6.457242334494773e-06, 6.457353135888501e-06], 0, 14.427008390426636, 1576760187.3471005], "v": 0.1}
{"i": ["cuda -model=unknown", "topi_nn_conv2d", [["TENSOR", [1, 832, 6, 6], "float32"], ["TENSOR", [192, 832, 1, 1], "float32"], [1, 1], [0, 0], [1, 1], "NCHW", "float32"], {}, ["conv2d", [1, 832, 6, 6, "float32"], [192, 832, 1, 1, "float32"], [1, 1], [0, 0], [1, 1], "NCHW", "float32"], {"i": 7011706, "t": "direct", "c": null, "e": [["tile_f", "sp", [-1, 2, 12, 1]], ["tile_y", "sp", [-1, 1, 2, 1]], ["tile_x", "sp", [-1, 1, 6, 1]], ["tile_rc", "sp", [-1, 208]], ["tile_ry", "sp", [-1, 1]], ["tile_rx", "sp", [-1, 1]], ["auto_unroll_max_step", "ot", 1500], ["unroll_explicit", "ot", 1]]}], "r": [[1.6566891766361717e-05, 1.656711660802252e-05, 1.656714102744546e-05, 1.65674524278677e-05, 1.6567628993666433e-05, 1.656796446164673e-05, 1.65681554539057e-05, 1.6568592892329346e-05], 0, 7.237250089645386, 1576761474.6892588], "v": 0.1}
{"i": ["cuda -model=unknown", "topi_nn_conv2d", [["TENSOR", [1, 192, 6, 6], "float32"], ["TENSOR", [384, 192, 3, 3], "float32"], [1, 1], [1, 1], [1, 1], "NCHW", "float32"], {}, ["conv2d", [1, 192, 6, 6, "float32"], [384, 192, 3, 3, "float32"], [1, 1], [1, 1], [1, 1], "NCHW", "float32"], {"i": 362016, "t": "winograd", "c": null, "e": [["tile_b", "sp", [-1, 1, 1, 1]], ["tile_y", "sp", [-1, 1, 64, 1]], ["tile_x", "sp", [-1, 3, 3, 1]], ["tile_rc", "sp", [-1, 8]], ["auto_unroll_max_step", "ot", 1500], ["unroll_explicit", "ot", 1]]}], "r": [[3.197459335485607e-05, 3.1974767150928167e-05, 3.1976089588377725e-05, 3.197627898843153e-05, 3.197650309389293e-05, 3.197706981436643e-05, 3.19822660747915e-05, 3.198256160882432e-05], 0, 10.097133874893188, 1576763567.5900764], "v": 0.1}
{"i": ["cuda -model=unknown", "topi_nn_conv2d", [["TENSOR", [1, 832, 6, 6], "float32"], ["TENSOR", [128, 832, 1, 1], "float32"], [1, 1], [0, 0], [1, 1], "NCHW", "float32"], {}, ["conv2d", [1, 832, 6, 6, "float32"], [128, 832, 1, 1, "float32"], [1, 1], [0, 0], [1, 1], "NCHW", "float32"], {"i": 2074106, "t": "direct", "c": null, "e": [["tile_f", "sp", [-1, 1, 16, 1]], ["tile_y", "sp", [-1, 1, 2, 1]], ["tile_x", "sp", [-1, 1, 6, 1]], ["tile_rc", "sp", [-1, 208]], ["tile_ry", "sp", [-1, 1]], ["tile_rx", "sp", [-1, 1]], ["auto_unroll_max_step", "ot", 512], ["unroll_explicit", "ot", 1]]}], "r": [[1.4650467673489765e-05, 1.4650734211183225e-05, 1.4650751872191713e-05, 1.4651115639041438e-05, 1.4651253681977035e-05, 1.4651471043434848e-05, 1.4652131240639041e-05, 1.4652497940589116e-05], 0, 12.26369595527649, 1576764860.828038], "v": 0.1}
{"i": ["cuda -model=unknown", "topi_nn_conv2d", [["TENSOR", [1, 832, 6, 6], "float32"], ["TENSOR", [32, 832, 1, 1], "float32"], [1, 1], [0, 0], [1, 1], "NCHW", "float32"], {}, ["conv2d", [1, 832, 6, 6, "float32"], [32, 832, 1, 1, "float32"], [1, 1], [0, 0], [1, 1], "NCHW", "float32"], {"i": 1165263, "t": "direct", "c": null, "e": [["tile_f", "sp", [-1, 1, 8, 1]], ["tile_y", "sp", [-1, 1, 6, 1]], ["tile_x", "sp", [-1, 1, 2, 1]], ["tile_rc", "sp", [-1, 208]], ["tile_ry", "sp", [-1, 1]], ["tile_rx", "sp", [-1, 1]], ["auto_unroll_max_step", "ot", 1500], ["unroll_explicit", "ot", 1]]}], "r": [[1.1547664366337212e-05, 1.1549317036083981e-05, 1.1550507865957073e-05, 1.1550721679630387e-05, 1.1551680741563834e-05, 1.1552353120065502e-05, 1.1552659863149892e-05, 1.1556081759167203e-05], 0, 5.500328540802002, 1576767047.9245954], "v": 0.1}
{"i": ["cuda -model=unknown", "topi_nn_conv2d", [["TENSOR", [1, 32, 6, 6], "float32"], ["TENSOR", [128, 32, 3, 3], "float32"], [1, 1], [1, 1], [1, 1], "NCHW", "float32"], {}, ["conv2d", [1, 32, 6, 6, "float32"], [128, 32, 3, 3, "float32"], [1, 1], [1, 1], [1, 1], "NCHW", "float32"], {"i": 3272186, "t": "direct", "c": null, "e": [["tile_f", "sp", [-1, 1, 16, 1]], ["tile_y", "sp", [-1, 1, 2, 1]], ["tile_x", "sp", [-1, 1, 6, 1]], ["tile_rc", "sp", [-1, 16]], ["tile_ry", "sp", [-1, 3]], ["tile_rx", "sp", [-1, 1]], ["auto_unroll_max_step", "ot", 512], ["unroll_explicit", "ot", 1]]}], "r": [[5.718877864356385e-06, 5.718893474137489e-06, 5.71892436048598e-06, 5.718940969908238e-06, 5.7189694724970525e-06, 5.7191310042548835e-06, 5.7192511662480135e-06, 5.719493950889424e-06], 0, 36.01722049713135, 1576768340.3127944], "v": 0.1}
{"i": ["cuda -model=unknown", "topi_nn_conv2d", [["TENSOR", [1, 832, 6, 6], "float32"], ["TENSOR", [160, 832, 1, 1], "float32"], [1, 1], [0, 0], [1, 1], "NCHW", "float32"], {}, ["conv2d", [1, 832, 6, 6, "float32"], [160, 832, 1, 1, "float32"], [1, 1], [0, 0], [1, 1], "NCHW", "float32"], {"i": 3814323, "t": "direct", "c": null, "e": [["tile_f", "sp", [-1, 1, 20, 1]], ["tile_y", "sp", [-1, 1, 2, 1]], ["tile_x", "sp", [-1, 1, 6, 1]], ["tile_rc", "sp", [-1, 104]], ["tile_ry", "sp", [-1, 1]], ["tile_rx", "sp", [-1, 1]], ["auto_unroll_max_step", "ot", 512], ["unroll_explicit", "ot", 1]]}], "r": [[1.4773239847431006e-05, 1.4773560017949291e-05, 1.477361296836437e-05, 1.477368685962157e-05, 1.4776443796275522e-05, 1.4776747288908832e-05, 1.4778350983471692e-05, 1.4939257721935532e-05], 0, 3.1697402000427246, 1576769603.1886666], "v": 0.1}
{"i": ["cuda -model=unknown", "topi_nn_conv2d", [["TENSOR", [1, 160, 6, 6], "float32"], ["TENSOR", [320, 160, 3, 3], "float32"], [1, 1], [1, 1], [1, 1], "NCHW", "float32"], {}, ["conv2d", [1, 160, 6, 6, "float32"], [320, 160, 3, 3, "float32"], [1, 1], [1, 1], [1, 1], "NCHW", "float32"], {"i": 96844, "t": "winograd", "c": null, "e": [["tile_b", "sp", [-1, 1, 1, 1]], ["tile_y", "sp", [-1, 1, 64, 1]], ["tile_x", "sp", [-1, 1, 3, 3]], ["tile_rc", "sp", [-1, 8]], ["auto_unroll_max_step", "ot", 1500], ["unroll_explicit", "ot", 0]]}], "r": [[2.2990467630114246e-05, 2.2990913582657945e-05, 2.299130475539498e-05, 2.2991787032516355e-05, 2.2991858021677573e-05, 2.299273684210526e-05, 2.2993227712137488e-05, 2.2997972854213455e-05], 0, 18.59406852722168, 1576771000.5159054], "v": 0.1}
{"i": ["cuda -model=unknown", "topi_nn_conv2d", [["TENSOR", [1, 528, 13, 13], "float32"], ["TENSOR", [128, 528, 1, 1], "float32"], [1, 1], [0, 0], [1, 1], "NCHW", "float32"], {}, ["conv2d", [1, 528, 13, 13, "float32"], [128, 528, 1, 1, "float32"], [1, 1], [0, 0], [1, 1], "NCHW", "float32"], {"i": 62422, "t": "direct", "c": null, "e": [["tile_f", "sp", [-1, 2, 8, 1]], ["tile_y", "sp", [-1, 1, 1, 1]], ["tile_x", "sp", [-1, 1, 13, 1]], ["tile_rc", "sp", [-1, 44]], ["tile_ry", "sp", [-1, 1]], ["tile_rx", "sp", [-1, 1]], ["auto_unroll_max_step", "ot", 512], ["unroll_explicit", "ot", 0]]}], "r": [[2.3269899372302862e-05, 2.3269998528834836e-05, 2.3271797665751276e-05, 2.3272197136131814e-05, 2.327262053746567e-05, 2.3274816300510003e-05, 2.3275345233424872e-05, 2.327613171832091e-05], 0, 10.860044956207275, 1576772175.985325], "v": 0.1}
{"i": ["cuda -model=unknown", "topi_nn_conv2d", [["TENSOR", [1, 528, 13, 13], "float32"], ["TENSOR", [32, 528, 1, 1], "float32"], [1, 1], [0, 0], [1, 1], "NCHW", "float32"], {}, ["conv2d", [1, 528, 13, 13, "float32"], [32, 528, 1, 1, "float32"], [1, 1], [0, 0], [1, 1], "NCHW", "float32"], {"i": 87378, "t": "direct", "c": null, "e": [["tile_f", "sp", [-1, 1, 16, 1]], ["tile_y", "sp", [-1, 1, 1, 1]], ["tile_x", "sp", [-1, 1, 13, 1]], ["tile_rc", "sp", [-1, 176]], ["tile_ry", "sp", [-1, 1]], ["tile_rx", "sp", [-1, 1]], ["auto_unroll_max_step", "ot", 512], ["unroll_explicit", "ot", 1]]}], "r": [[1.1409296406140963e-05, 1.140936793440335e-05, 1.1409755059316119e-05, 1.1410030414049779e-05, 1.1410053268201908e-05, 1.1410077459874389e-05, 1.1410251395673412e-05, 1.153763410095371e-05], 0, 3.5042829513549805, 1576773160.2856555], "v": 0.1}
{"i": ["cuda -model=unknown", "topi_nn_conv2d", [["TENSOR", [1, 32, 13, 13], "float32"], ["TENSOR", [128, 32, 3, 3], "float32"], [1, 1], [1, 1], [1, 1], "NCHW", "float32"], {}, ["conv2d", [1, 32, 13, 13, "float32"], [128, 32, 3, 3, "float32"], [1, 1], [1, 1], [1, 1], "NCHW", "float32"], {"i": 202614, "t": "direct", "c": null, "e": [["tile_f", "sp", [-1, 1, 8, 2]], ["tile_y", "sp", [-1, 1, 1, 1]], ["tile_x", "sp", [-1, 1, 13, 1]], ["tile_rc", "sp", [-1, 8]], ["tile_ry", "sp", [-1, 3]], ["tile_rx", "sp", [-1, 1]], ["auto_unroll_max_step", "ot", 512], ["unroll_explicit", "ot", 1]]}], "r": [[1.4310643802734944e-05, 1.4311861870817572e-05, 1.4312523858015712e-05, 1.43127630928135e-05, 1.4313903040442247e-05, 1.431600916496945e-05, 1.4349812118126273e-05, 1.4415300916496946e-05], 0, 4.3855156898498535, 1576774368.674527], "v": 0.1}
{"i": ["cuda -model=unknown", "topi_nn_conv2d", [["TENSOR", [1, 528, 13, 13], "float32"], ["TENSOR", [160, 528, 1, 1], "float32"], [1, 1], [0, 0], [1, 1], "NCHW", "float32"], {}, ["conv2d", [1, 528, 13, 13, "float32"], [160, 528, 1, 1, "float32"], [1, 1], [0, 0], [1, 1], "NCHW", "float32"], {"i": 267104, "t": "direct", "c": null, "e": [["tile_f", "sp", [-1, 1, 10, 2]], ["tile_y", "sp", [-1, 1, 1, 1]], ["tile_x", "sp", [-1, 1, 13, 1]], ["tile_rc", "sp", [-1, 66]], ["tile_ry", "sp", [-1, 1]], ["tile_rx", "sp", [-1, 1]], ["auto_unroll_max_step", "ot", 0], ["unroll_explicit", "ot", 1]]}], "r": [[2.634831336969832e-05, 2.635013280641211e-05, 2.6350440944005342e-05, 2.6354502282088387e-05, 2.636022364466214e-05, 2.6361213403094733e-05, 2.636505376822888e-05, 2.636827930535456e-05], 0, 9.234436988830566, 1576775352.8245146], "v": 0.1}
{"i": ["cuda -model=unknown", "topi_nn_conv2d", [["TENSOR", [1, 160, 13, 13], "float32"], ["TENSOR", [320, 160, 3, 3], "float32"], [1, 1], [1, 1], [1, 1], "NCHW", "float32"], {}, ["conv2d", [1, 160, 13, 13, "float32"], [320, 160, 3, 3, "float32"], [1, 1], [1, 1], [1, 1], "NCHW", "float32"], {"i": 21688, "t": "winograd", "c": null, "e": [["tile_b", "sp", [-1, 1, 1, 1]], ["tile_y", "sp", [-1, 1, 16, 4]], ["tile_x", "sp", [-1, 7, 7, 1]], ["tile_rc", "sp", [-1, 16]], ["auto_unroll_max_step", "ot", 0], ["unroll_explicit", "ot", 0]]}], "r": [[3.852124437611264e-05, 3.852188914063764e-05, 3.852800809192426e-05, 3.8530782650914386e-05, 3.853108949668231e-05, 3.8533494416572264e-05, 3.853616151480822e-05, 3.853708674542807e-05], 0, 18.03268313407898, 1576776624.9870846], "v": 0.1}
{"i": ["cuda -model=unknown", "topi_nn_conv2d", [["TENSOR", [1, 512, 13, 13], "float32"], ["TENSOR", [32, 512, 1, 1], "float32"], [1, 1], [0, 0], [1, 1], "NCHW", "float32"], {}, ["conv2d", [1, 512, 13, 13, "float32"], [32, 512, 1, 1, "float32"], [1, 1], [0, 0], [1, 1], "NCHW", "float32"], {"i": 24658, "t": "direct", "c": null, "e": [["tile_f", "sp", [-1, 1, 16, 1]], ["tile_y", "sp", [-1, 1, 1, 1]], ["tile_x", "sp", [-1, 1, 13, 1]], ["tile_rc", "sp", [-1, 128]], ["tile_ry", "sp", [-1, 1]], ["tile_rx", "sp", [-1, 1]], ["auto_unroll_max_step", "ot", 1500], ["unroll_explicit", "ot", 0]]}], "r": [[1.2058107592925977e-05, 1.2059049772318119e-05, 1.205929418616965e-05, 1.2059365826538176e-05, 1.2059412792544742e-05, 1.2060038335274808e-05, 1.2060095096897172e-05, 1.2060900931907233e-05], 0, 11.510312795639038, 1576777741.217042], "v": 0.1}
{"i": ["cuda -model=unknown", "topi_nn_conv2d", [["TENSOR", [1, 32, 13, 13], "float32"], ["TENSOR", [64, 32, 3, 3], "float32"], [1, 1], [1, 1], [1, 1], "NCHW", "float32"], {}, ["conv2d", [1, 32, 13, 13, "float32"], [64, 32, 3, 3, "float32"], [1, 1], [1, 1], [1, 1], "NCHW", "float32"], {"i": 12786, "t": "direct", "c": null, "e": [["tile_f", "sp", [-1, 1, 8, 1]], ["tile_y", "sp", [-1, 1, 1, 1]], ["tile_x", "sp", [-1, 1, 13, 1]], ["tile_rc", "sp", [-1, 8]], ["tile_ry", "sp", [-1, 3]], ["tile_rx", "sp", [-1, 1]], ["auto_unroll_max_step", "ot", 0], ["unroll_explicit", "ot", 0]]}], "r": [[1.0232896851296524e-05, 1.0234342256129829e-05, 1.0234656376786029e-05, 1.023519981478215e-05, 1.0272014244134768e-05, 1.0291717278179574e-05, 1.029380759393191e-05, 1.0296984300582114e-05], 0, 11.681969165802002, 1576778560.375867], "v": 0.1}
{"i": ["cuda -model=unknown", "topi_nn_conv2d", [["TENSOR", [1, 512, 13, 13], "float32"], ["TENSOR", [144, 512, 1, 1], "float32"], [1, 1], [0, 0], [1, 1], "NCHW", "float32"], {}, ["conv2d", [1, 512, 13, 13, "float32"], [144, 512, 1, 1, "float32"], [1, 1], [0, 0], [1, 1], "NCHW", "float32"], {"i": 137255, "t": "direct", "c": null, "e": [["tile_f", "sp", [-1, 2, 8, 1]], ["tile_y", "sp", [-1, 1, 1, 1]], ["tile_x", "sp", [-1, 1, 13, 1]], ["tile_rc", "sp", [-1, 16]], ["tile_ry", "sp", [-1, 1]], ["tile_rx", "sp", [-1, 1]], ["auto_unroll_max_step", "ot", 1500], ["unroll_explicit", "ot", 0]]}], "r": [[2.327942979099205e-05, 2.3279700520066727e-05, 2.3280294671769208e-05, 2.3280954862133255e-05, 2.3281140516141694e-05, 2.3281452752428613e-05, 2.3281905112354037e-05, 2.3282828476106367e-05], 0, 12.179371356964111, 1576779566.24222], "v": 0.1}
{"i": ["cuda -model=unknown", "topi_nn_conv2d", [["TENSOR", [1, 144, 13, 13], "float32"], ["TENSOR", [288, 144, 3, 3], "float32"], [1, 1], [1, 1], [1, 1], "NCHW", "float32"], {}, ["conv2d", [1, 144, 13, 13, "float32"], [288, 144, 3, 3, "float32"], [1, 1], [1, 1], [1, 1], "NCHW", "float32"], {"i": 310421, "t": "winograd", "c": null, "e": [["tile_b", "sp", [-1, 1, 1, 1]], ["tile_y", "sp", [-1, 2, 8, 2]], ["tile_x", "sp", [-1, 7, 7, 1]], ["tile_rc", "sp", [-1, 24]], ["auto_unroll_max_step", "ot", 0], ["unroll_explicit", "ot", 1]]}], "r": [[3.4032700543167525e-05, 3.4034612778730705e-05, 3.403656875357347e-05, 3.403661892510006e-05, 3.403685720411664e-05, 3.404164708404803e-05, 3.4042017867352777e-05, 3.4043931675242996e-05], 0, 6.442766904830933, 1576781422.6840065], "v": 0.1}
{"i": ["cuda -model=unknown", "topi_nn_conv2d", [["TENSOR", [1, 128, 13, 13], "float32"], ["TENSOR", [256, 128, 3, 3], "float32"], [1, 1], [1, 1], [1, 1], "NCHW", "float32"], {}, ["conv2d", [1, 128, 13, 13, "float32"], [256, 128, 3, 3, "float32"], [1, 1], [1, 1], [1, 1], "NCHW", "float32"], {"i": 7359, "t": "winograd", "c": null, "e": [["tile_b", "sp", [-1, 1, 1, 1]], ["tile_y", "sp", [-1, 1, 8, 4]], ["tile_x", "sp", [-1, 7, 7, 1]], ["tile_rc", "sp", [-1, 16]], ["auto_unroll_max_step", "ot", 0], ["unroll_explicit", "ot", 0]]}], "r": [[2.8883391792867613e-05, 2.8884040669272105e-05, 2.8887446507083538e-05, 2.8887469101123597e-05, 2.8889406692721055e-05, 2.8890751343429407e-05, 2.8895682828529556e-05, 2.890194320957499e-05], 0, 14.634223937988281, 1576783113.5541387], "v": 0.1}
{"i": ["cuda -model=unknown", "topi_nn_conv2d", [["TENSOR", [1, 512, 13, 13], "float32"], ["TENSOR", [64, 512, 1, 1], "float32"], [1, 1], [0, 0], [1, 1], "NCHW", "float32"], {}, ["conv2d", [1, 512, 13, 13, "float32"], [64, 512, 1, 1, "float32"], [1, 1], [0, 0], [1, 1], "NCHW", "float32"], {"i": 34311, "t": "direct", "c": null, "e": [["tile_f", "sp", [-1, 1, 4, 2]], ["tile_y", "sp", [-1, 1, 1, 1]], ["tile_x", "sp", [-1, 1, 13, 1]], ["tile_rc", "sp", [-1, 32]], ["tile_ry", "sp", [-1, 1]], ["tile_rx", "sp", [-1, 1]], ["auto_unroll_max_step", "ot", 1500], ["unroll_explicit", "ot", 0]]}], "r": [[1.6216137375536306e-05, 1.621709301384279e-05, 1.621712749939286e-05, 1.6217827815105643e-05, 1.6218289241479803e-05, 1.6218338541245042e-05, 1.621854804500931e-05, 1.6229207722820366e-05], 0, 3.766406536102295, 1576784487.0476046], "v": 0.1}
{"i": ["cuda -model=unknown", "topi_nn_conv2d", [["TENSOR", [1, 512, 13, 13], "float32"], ["TENSOR", [24, 512, 1, 1], "float32"], [1, 1], [0, 0], [1, 1], "NCHW", "float32"], {}, ["conv2d", [1, 512, 13, 13, "float32"], [24, 512, 1, 1, "float32"], [1, 1], [0, 0], [1, 1], "NCHW", "float32"], {"i": 22427, "t": "direct", "c": null, "e": [["tile_f", "sp", [-1, 1, 12, 1]], ["tile_y", "sp", [-1, 1, 1, 1]], ["tile_x", "sp", [-1, 1, 13, 1]], ["tile_rc", "sp", [-1, 128]], ["tile_ry", "sp", [-1, 1]], ["tile_rx", "sp", [-1, 1]], ["auto_unroll_max_step", "ot", 512], ["unroll_explicit", "ot", 0]]}], "r": [[1.1077483459427385e-05, 1.10787793601345e-05, 1.1080198239628146e-05, 1.1082063788755379e-05, 1.1083102259803195e-05, 1.1086153933639915e-05, 1.108662636601889e-05, 1.1088706769519853e-05], 0, 4.5273168087005615, 1576785582.7820268], "v": 0.1}
{"i": ["cuda -model=unknown", "topi_nn_conv2d", [["TENSOR", [1, 24, 13, 13], "float32"], ["TENSOR", [64, 24, 3, 3], "float32"], [1, 1], [1, 1], [1, 1], "NCHW", "float32"], {}, ["conv2d", [1, 24, 13, 13, "float32"], [64, 24, 3, 3, "float32"], [1, 1], [1, 1], [1, 1], "NCHW", "float32"], {"i": 18162, "t": "direct", "c": null, "e": [["tile_f", "sp", [-1, 1, 8, 1]], ["tile_y", "sp", [-1, 1, 1, 1]], ["tile_x", "sp", [-1, 1, 13, 1]], ["tile_rc", "sp", [-1, 8]], ["tile_ry", "sp", [-1, 3]], ["tile_rx", "sp", [-1, 1]], ["auto_unroll_max_step", "ot", 0], ["unroll_explicit", "ot", 0]]}], "r": [[8.282443093438493e-06, 8.28245952459196e-06, 8.282686785701244e-06, 8.282782122905028e-06, 8.283144119472743e-06, 8.283479972249606e-06, 8.283965129440974e-06, 8.284025340490013e-06], 0, 5.870972633361816, 1576787121.7438543], "v": 0.1}
{"i": ["cuda -model=unknown", "topi_nn_conv2d", [["TENSOR", [1, 112, 13, 13], "float32"], ["TENSOR", [224, 112, 3, 3], "float32"], [1, 1], [1, 1], [1, 1], "NCHW", "float32"], {}, ["conv2d", [1, 112, 13, 13, "float32"], [224, 112, 3, 3, "float32"], [1, 1], [1, 1], [1, 1], "NCHW", "float32"], {"i": 106269, "t": "winograd", "c": null, "e": [["tile_b", "sp", [-1, 1, 1, 1]], ["tile_y", "sp", [-1, 2, 8, 2]], ["tile_x", "sp", [-1, 7, 7, 1]], ["tile_rc", "sp", [-1, 28]], ["auto_unroll_max_step", "ot", 128], ["unroll_explicit", "ot", 1]]}], "r": [[2.231343959284627e-05, 2.2329890696347033e-05, 2.2340451769406393e-05, 2.236916657153729e-05, 2.2376659912480974e-05, 2.2378232020547945e-05, 2.2405521974885847e-05, 2.244568378995434e-05], 0, 7.935789108276367, 1576788025.9476511], "v": 0.1}
{"i": ["cuda -model=unknown", "topi_nn_conv2d", [["TENSOR", [1, 480, 13, 13], "float32"], ["TENSOR", [64, 480, 1, 1], "float32"], [1, 1], [0, 0], [1, 1], "NCHW", "float32"], {}, ["conv2d", [1, 480, 13, 13, "float32"], [64, 480, 1, 1, "float32"], [1, 1], [0, 0], [1, 1], "NCHW", "float32"], {"i": 87553, "t": "direct", "c": null, "e": [["tile_f", "sp", [-1, 1, 32, 1]], ["tile_y", "sp", [-1, 1, 13, 1]], ["tile_x", "sp", [-1, 1, 1, 1]], ["tile_rc", "sp", [-1, 60]], ["tile_ry", "sp", [-1, 1]], ["tile_rx", "sp", [-1, 1]], ["auto_unroll_max_step", "ot", 1500], ["unroll_explicit", "ot", 0]]}], "r": [[1.469426406044678e-05, 1.4694763666228646e-05, 1.469489159001314e-05, 1.4695354336399475e-05, 1.4695971090670171e-05, 1.469738653088042e-05, 1.470082023653088e-05, 1.4701147109067018e-05], 0, 30.543410062789917, 1576790062.7246916], "v": 0.1}
{"i": ["cuda -model=unknown", "topi_nn_conv2d", [["TENSOR", [1, 480, 13, 13], "float32"], ["TENSOR", [16, 480, 1, 1], "float32"], [1, 1], [0, 0], [1, 1], "NCHW", "float32"], {}, ["conv2d", [1, 480, 13, 13, "float32"], [16, 480, 1, 1, "float32"], [1, 1], [0, 0], [1, 1], "NCHW", "float32"], {"i": 33892, "t": "direct", "c": null, "e": [["tile_f", "sp", [-1, 1, 8, 1]], ["tile_y", "sp", [-1, 1, 1, 1]], ["tile_x", "sp", [-1, 1, 13, 1]], ["tile_rc", "sp", [-1, 24]], ["tile_ry", "sp", [-1, 1]], ["tile_rx", "sp", [-1, 1]], ["auto_unroll_max_step", "ot", 1500], ["unroll_explicit", "ot", 0]]}], "r": [[9.367558776563076e-06, 9.371065471072349e-06, 9.377260737829096e-06, 9.38214875322442e-06, 9.382526593784548e-06, 9.386255537812718e-06, 9.389445891168161e-06, 9.389809564754534e-06], 0, 17.32835102081299, 1576791226.8830817], "v": 0.1}
{"i": ["cuda -model=unknown", "topi_nn_conv2d", [["TENSOR", [1, 16, 13, 13], "float32"], ["TENSOR", [48, 16, 3, 3], "float32"], [1, 1], [1, 1], [1, 1], "NCHW", "float32"], {}, ["conv2d", [1, 16, 13, 13, "float32"], [48, 16, 3, 3, "float32"], [1, 1], [1, 1], [1, 1], "NCHW", "float32"], {"i": 153473, "t": "direct", "c": null, "e": [["tile_f", "sp", [-1, 1, 8, 1]], ["tile_y", "sp", [-1, 1, 1, 1]], ["tile_x", "sp", [-1, 1, 13, 1]], ["tile_rc", "sp", [-1, 8]], ["tile_ry", "sp", [-1, 3]], ["tile_rx", "sp", [-1, 1]], ["auto_unroll_max_step", "ot", 0], ["unroll_explicit", "ot", 1]]}], "r": [[5.643549931979645e-06, 5.643844157807225e-06, 5.643902504156799e-06, 5.643985917267093e-06, 5.643987252481484e-06, 5.644267899430644e-06, 5.644333879175694e-06, 5.644527308913186e-06], 0, 16.66493511199951, 1576792071.135983], "v": 0.1}
{"i": ["cuda -model=unknown", "topi_nn_conv2d", [["TENSOR", [1, 480, 13, 13], "float32"], ["TENSOR", [96, 480, 1, 1], "float32"], [1, 1], [0, 0], [1, 1], "NCHW", "float32"], {}, ["conv2d", [1, 480, 13, 13, "float32"], [96, 480, 1, 1, "float32"], [1, 1], [0, 0], [1, 1], "NCHW", "float32"], {"i": 55594, "t": "direct", "c": null, "e": [["tile_f", "sp", [-1, 2, 8, 1]], ["tile_y", "sp", [-1, 1, 1, 1]], ["tile_x", "sp", [-1, 1, 13, 1]], ["tile_rc", "sp", [-1, 40]], ["tile_ry", "sp", [-1, 1]], ["tile_rx", "sp", [-1, 1]], ["auto_unroll_max_step", "ot", 0], ["unroll_explicit", "ot", 0]]}], "r": [[1.810635435595938e-05, 1.8107592960219897e-05, 1.8108351530884937e-05, 1.8108399328090404e-05, 1.8109022066122013e-05, 1.811054966786287e-05, 1.8120176910742917e-05, 1.8152237000839887e-05], 0, 9.082460641860962, 1576793225.438782], "v": 0.1}
{"i": ["cuda -model=unknown", "topi_nn_conv2d", [["TENSOR", [1, 96, 13, 13], "float32"], ["TENSOR", [208, 96, 3, 3], "float32"], [1, 1], [1, 1], [1, 1], "NCHW", "float32"], {}, ["conv2d", [1, 96, 13, 13, "float32"], [208, 96, 3, 3, "float32"], [1, 1], [1, 1], [1, 1], "NCHW", "float32"], {"i": 79045, "t": "winograd", "c": null, "e": [["tile_b", "sp", [-1, 1, 1, 1]], ["tile_y", "sp", [-1, 1, 4, 4]], ["tile_x", "sp", [-1, 7, 7, 1]], ["tile_rc", "sp", [-1, 24]], ["auto_unroll_max_step", "ot", 128], ["unroll_explicit", "ot", 1]]}], "r": [[2.0801267502706604e-05, 2.0814042764345e-05, 2.0898569830386143e-05, 2.0902132082280765e-05, 2.0951981955972572e-05, 2.0959660140743414e-05, 2.0995275712739082e-05, 2.1165013442800433e-05], 0, 16.739063024520874, 1576794536.8501596], "v": 0.1}
{"i": ["cuda -model=unknown", "topi_nn_conv2d", [["TENSOR", [1, 256, 27, 27], "float32"], ["TENSOR", [64, 256, 1, 1], "float32"], [1, 1], [0, 0], [1, 1], "NCHW", "float32"], {}, ["conv2d", [1, 256, 27, 27, "float32"], [64, 256, 1, 1, "float32"], [1, 1], [0, 0], [1, 1], "NCHW", "float32"], {"i": 754335, "t": "direct", "c": null, "e": [["tile_f", "sp", [-1, 4, 4, 1]], ["tile_y", "sp", [-1, 1, 1, 1]], ["tile_x", "sp", [-1, 1, 27, 1]], ["tile_rc", "sp", [-1, 16]], ["tile_ry", "sp", [-1, 1]], ["tile_rx", "sp", [-1, 1]], ["auto_unroll_max_step", "ot", 1500], ["unroll_explicit", "ot", 0]]}], "r": [[1.6117869736569177e-05, 1.6118017285487105e-05, 1.612080882251262e-05, 1.6121599737260597e-05, 1.6121978496854042e-05, 1.6122243448800387e-05, 1.612274763188827e-05, 1.612396895526516e-05], 0, 7.549954891204834, 1576795780.2679145], "v": 0.1}
{"i": ["cuda -model=unknown", "topi_nn_conv2d", [["TENSOR", [1, 256, 27, 27], "float32"], ["TENSOR", [32, 256, 1, 1], "float32"], [1, 1], [0, 0], [1, 1], "NCHW", "float32"], {}, ["conv2d", [1, 256, 27, 27, "float32"], [32, 256, 1, 1, "float32"], [1, 1], [0, 0], [1, 1], "NCHW", "float32"], {"i": 1107697, "t": "direct", "c": null, "e": [["tile_f", "sp", [-1, 4, 8, 1]], ["tile_y", "sp", [-1, 1, 1, 1]], ["tile_x", "sp", [-1, 1, 27, 1]], ["tile_rc", "sp", [-1, 16]], ["tile_ry", "sp", [-1, 1]], ["tile_rx", "sp", [-1, 1]], ["auto_unroll_max_step", "ot", 1500], ["unroll_explicit", "ot", 1]]}], "r": [[1.1621118295483541e-05, 1.1624190865016586e-05, 1.1624261903546824e-05, 1.1624756723653993e-05, 1.1626147588670579e-05, 1.1627656647103853e-05, 1.1627775401888237e-05, 1.1628938096453177e-05], 0, 13.400905132293701, 1576797245.24305], "v": 0.1}
{"i": ["cuda -model=unknown", "topi_nn_conv2d", [["TENSOR", [1, 32, 27, 27], "float32"], ["TENSOR", [96, 32, 3, 3], "float32"], [1, 1], [1, 1], [1, 1], "NCHW", "float32"], {}, ["conv2d", [1, 32, 27, 27, "float32"], [96, 32, 3, 3, "float32"], [1, 1], [1, 1], [1, 1], "NCHW", "float32"], {"i": 10523847, "t": "direct", "c": null, "e": [["tile_f", "sp", [-1, 1, 16, 2]], ["tile_y", "sp", [-1, 3, 1, 1]], ["tile_x", "sp", [-1, 1, 27, 1]], ["tile_rc", "sp", [-1, 8]], ["tile_ry", "sp", [-1, 3]], ["tile_rx", "sp", [-1, 3]], ["auto_unroll_max_step", "ot", 512], ["unroll_explicit", "ot", 1]]}], "r": [[1.7618824729575234e-05, 1.7619708205083104e-05, 1.7620214932723594e-05, 1.7620283088558614e-05, 1.762102647084689e-05, 1.7621404801688507e-05, 1.7624679008002815e-05, 1.7660505320552282e-05], 0, 3.4815430641174316, 1576800554.2050233], "v": 0.1}
{"i": ["cuda -model=unknown", "topi_nn_conv2d", [["TENSOR", [1, 128, 27, 27], "float32"], ["TENSOR", [192, 128, 3, 3], "float32"], [1, 1], [1, 1], [1, 1], "NCHW", "float32"], {}, ["conv2d", [1, 128, 27, 27, "float32"], [192, 128, 3, 3, "float32"], [1, 1], [1, 1], [1, 1], "NCHW", "float32"], {"i": 1219470, "t": "winograd", "c": null, "e": [["tile_b", "sp", [-1, 1, 1, 1]], ["tile_y", "sp", [-1, 2, 8, 2]], ["tile_x", "sp", [-1, 7, 28, 1]], ["tile_rc", "sp", [-1, 16]], ["auto_unroll_max_step", "ot", 128], ["unroll_explicit", "ot", 1]]}], "r": [[5.0857584434968015e-05, 5.086351748400853e-05, 5.086693880597015e-05, 5.086910127931769e-05, 5.087070852878465e-05, 5.087121918976546e-05, 5.0871541151385924e-05, 5.088070106609808e-05], 0, 21.26660990715027, 1576804978.8819096], "v": 0.1}
{"i": ["cuda -model=unknown", "topi_nn_conv2d", [["TENSOR", [1, 192, 27, 27], "float32"], ["TENSOR", [32, 192, 1, 1], "float32"], [1, 1], [0, 0], [1, 1], "NCHW", "float32"], {}, ["conv2d", [1, 192, 27, 27, "float32"], [32, 192, 1, 1, "float32"], [1, 1], [0, 0], [1, 1], "NCHW", "float32"], {"i": 792419, "t": "direct", "c": null, "e": [["tile_f", "sp", [-1, 2, 16, 1]], ["tile_y", "sp", [-1, 1, 1, 3]], ["tile_x", "sp", [-1, 1, 9, 1]], ["tile_rc", "sp", [-1, 16]], ["tile_ry", "sp", [-1, 1]], ["tile_rx", "sp", [-1, 1]], ["auto_unroll_max_step", "ot", 1500], ["unroll_explicit", "ot", 0]]}], "r": [[8.691305632889669e-06, 8.692549483238626e-06, 8.694897257923039e-06, 8.697231303153961e-06, 8.69880927500858e-06, 8.698862095267153e-06, 8.698920559856603e-06, 8.707413409099576e-06], 0, 11.964082956314087, 1576807662.8535523], "v": 0.1}
{"i": ["cuda -model=unknown", "topi_nn_conv2d", [["TENSOR", [1, 192, 27, 27], "float32"], ["TENSOR", [16, 192, 1, 1], "float32"], [1, 1], [0, 0], [1, 1], "NCHW", "float32"], {}, ["conv2d", [1, 192, 27, 27, "float32"], [16, 192, 1, 1, "float32"], [1, 1], [0, 0], [1, 1], "NCHW", "float32"], {"i": 1125054, "t": "direct", "c": null, "e": [["tile_f", "sp", [-1, 1, 16, 1]], ["tile_y", "sp", [-1, 1, 3, 1]], ["tile_x", "sp", [-1, 1, 9, 1]], ["tile_rc", "sp", [-1, 48]], ["tile_ry", "sp", [-1, 1]], ["tile_rx", "sp", [-1, 1]], ["auto_unroll_max_step", "ot", 1500], ["unroll_explicit", "ot", 1]]}], "r": [[6.73828660931083e-06, 6.738367726850326e-06, 6.7384191372643065e-06, 6.738431457777512e-06, 6.738507329356396e-06, 6.738694085554123e-06, 6.738787973260589e-06, 6.738797715758866e-06], 0, 9.245310306549072, 1576809328.37905], "v": 0.1}
{"i": ["cuda -model=unknown", "topi_nn_conv2d", [["TENSOR", [1, 16, 27, 27], "float32"], ["TENSOR", [32, 16, 3, 3], "float32"], [1, 1], [1, 1], [1, 1], "NCHW", "float32"], {}, ["conv2d", [1, 16, 27, 27, "float32"], [32, 16, 3, 3, "float32"], [1, 1], [1, 1], [1, 1], "NCHW", "float32"], {"i": 1981856, "t": "direct", "c": null, "e": [["tile_f", "sp", [-1, 2, 8, 1]], ["tile_y", "sp", [-1, 1, 1, 3]], ["tile_x", "sp", [-1, 1, 27, 1]], ["tile_rc", "sp", [-1, 8]], ["tile_ry", "sp", [-1, 3]], ["tile_rx", "sp", [-1, 1]], ["auto_unroll_max_step", "ot", 512], ["unroll_explicit", "ot", 1]]}], "r": [[6.902312694158494e-06, 6.90247724919291e-06, 6.90252725832978e-06, 6.90283916062618e-06, 6.902917250411159e-06, 6.902934244989949e-06, 6.902962021075715e-06, 6.903000395931046e-06], 0, 6.2755842208862305, 1576811199.6626918], "v": 0.1}
{"i": ["cuda -model=unknown", "topi_nn_conv2d", [["TENSOR", [1, 192, 27, 27], "float32"], ["TENSOR", [96, 192, 1, 1], "float32"], [1, 1], [0, 0], [1, 1], "NCHW", "float32"], {}, ["conv2d", [1, 192, 27, 27, "float32"], [96, 192, 1, 1, "float32"], [1, 1], [0, 0], [1, 1], "NCHW", "float32"], {"i": 2002884, "t": "direct", "c": null, "e": [["tile_f", "sp", [-1, 1, 12, 2]], ["tile_y", "sp", [-1, 3, 1, 1]], ["tile_x", "sp", [-1, 1, 9, 1]], ["tile_rc", "sp", [-1, 24]], ["tile_ry", "sp", [-1, 1]], ["tile_rx", "sp", [-1, 1]], ["auto_unroll_max_step", "ot", 512], ["unroll_explicit", "ot", 0]]}], "r": [[1.5437760865073354e-05, 1.544352600041325e-05, 1.5449962876231148e-05, 1.5452227495006544e-05, 1.5453305392933397e-05, 1.545368069426269e-05, 1.5453758867690613e-05, 1.5458852951305187e-05], 0, 11.910250186920166, 1576813293.3606062], "v": 0.1}
{"i": ["cuda -model=unknown", "topi_nn_conv2d", [["TENSOR", [1, 96, 27, 27], "float32"], ["TENSOR", [128, 96, 3, 3], "float32"], [1, 1], [1, 1], [1, 1], "NCHW", "float32"], {}, ["conv2d", [1, 96, 27, 27, "float32"], [128, 96, 3, 3, "float32"], [1, 1], [1, 1], [1, 1], "NCHW", "float32"], {"i": 675559, "t": "winograd", "c": null, "e": [["tile_b", "sp", [-1, 1, 1, 1]], ["tile_y", "sp", [-1, 1, 8, 4]], ["tile_x", "sp", [-1, 7, 28, 1]], ["tile_rc", "sp", [-1, 24]], ["auto_unroll_max_step", "ot", 128], ["unroll_explicit", "ot", 1]]}], "r": [[3.2871686805555554e-05, 3.287509666666667e-05, 3.288158291666666e-05, 3.2883195694444444e-05, 3.2883525555555554e-05, 3.2884237916666666e-05, 3.289006041666667e-05, 3.289165361111111e-05], 0, 12.079108238220215, 1576814699.2166793], "v": 0.1}
{"i": ["cuda -model=unknown", "topi_nn_conv2d", [["TENSOR", [1, 3, 224, 224], "float32"], ["TENSOR", [64, 3, 7, 7], "float32"], [2, 2], [3, 3], [1, 1], "NCHW", "float32"], {}, ["conv2d", [1, 3, 224, 224, "float32"], [64, 3, 7, 7, "float32"], [2, 2], [3, 3], [1, 1], "NCHW", "float32"], {"i": 62969402, "t": "direct", "c": null, "e": [["tile_f", "sp", [-1, 2, 8, 4]], ["tile_y", "sp", [-1, 1, 1, 4]], ["tile_x", "sp", [-1, 2, 14, 1]], ["tile_rc", "sp", [-1, 1]], ["tile_ry", "sp", [-1, 7]], ["tile_rx", "sp", [-1, 7]], ["auto_unroll_max_step", "ot", 512], ["unroll_explicit", "ot", 1]]}], "r": [[4.988009459137479e-05, 4.9901655944722416e-05, 4.9921522992613774e-05, 4.993208267810341e-05, 4.9935734334048134e-05, 4.995938479866571e-05, 4.9987788896831075e-05, 5.0032818203478675e-05], 0, 3.755824089050293, 1576818019.3871648], "v": 0.1}
{"i": ["cuda -model=unknown", "topi_nn_conv2d", [["TENSOR", [1, 64, 55, 55], "float32"], ["TENSOR", [64, 64, 1, 1], "float32"], [1, 1], [0, 0], [1, 1], "NCHW", "float32"], {}, ["conv2d", [1, 64, 55, 55, "float32"], [64, 64, 1, 1, "float32"], [1, 1], [0, 0], [1, 1], "NCHW", "float32"], {"i": 376357, "t": "direct", "c": null, "e": [["tile_f", "sp", [-1, 8, 2, 2]], ["tile_y", "sp", [-1, 1, 1, 1]], ["tile_x", "sp", [-1, 1, 55, 1]], ["tile_rc", "sp", [-1, 8]], ["tile_ry", "sp", [-1, 1]], ["tile_rx", "sp", [-1, 1]], ["auto_unroll_max_step", "ot", 1500], ["unroll_explicit", "ot", 0]]}], "r": [[1.1700492752872969e-05, 1.1700570763018947e-05, 1.1701093280877938e-05, 1.1701260896573145e-05, 1.1701411999171757e-05, 1.1701931255823585e-05, 1.1702454394864894e-05, 1.1702652086137282e-05], 0, 15.025424718856812, 1576820138.7409408], "v": 0.1}
{"i": ["cuda -model=unknown", "topi_nn_conv2d", [["TENSOR", [1, 64, 55, 55], "float32"], ["TENSOR", [192, 64, 3, 3], "float32"], [1, 1], [1, 1], [1, 1], "NCHW", "float32"], {}, ["conv2d", [1, 64, 55, 55, "float32"], [192, 64, 3, 3, "float32"], [1, 1], [1, 1], [1, 1], "NCHW", "float32"], {"i": 373531, "t": "winograd", "c": null, "e": [["tile_b", "sp", [-1, 1, 1, 1]], ["tile_y", "sp", [-1, 1, 8, 6]], ["tile_x", "sp", [-1, 7, 16, 1]], ["tile_rc", "sp", [-1, 8]], ["auto_unroll_max_step", "ot", 0], ["unroll_explicit", "ot", 0]]}], "r": [[0.00013333561169332598, 0.00013334268174296747, 0.00013334374462217318, 0.00013335188030888032, 0.00013335678709321567, 0.0001333668554881412, 0.0001333673309431881, 0.00013338610976282406], 0, 7.501006603240967, 1576827482.6559253], "v": 0.1}
{"i": ["cuda -model=unknown", "topi_nn_conv2d", [["TENSOR", [1, 192, 27, 27], "float32"], ["TENSOR", [64, 192, 1, 1], "float32"], [1, 1], [0, 0], [1, 1], "NCHW", "float32"], {}, ["conv2d", [1, 192, 27, 27, "float32"], [64, 192, 1, 1, "float32"], [1, 1], [0, 0], [1, 1], "NCHW", "float32"], {"i": 1191135, "t": "direct", "c": null, "e": [["tile_f", "sp", [-1, 4, 4, 1]], ["tile_y", "sp", [-1, 1, 1, 1]], ["tile_x", "sp", [-1, 1, 27, 1]], ["tile_rc", "sp", [-1, 16]], ["tile_ry", "sp", [-1, 1]], ["tile_rx", "sp", [-1, 1]], ["auto_unroll_max_step", "ot", 1500], ["unroll_explicit", "ot", 0]]}], "r": [[1.2471984052732298e-05, 1.2472189294067617e-05, 1.2473364288751861e-05, 1.2473474962789709e-05, 1.2473555815436955e-05, 1.2473912555815436e-05, 1.2474235169041036e-05, 1.2475362428237295e-05], 0, 17.897379875183105, 1576830359.0574014], "v": 0.1}
{"i": ["cuda -model=unknown", "topi_nn_conv2d", [["TENSOR", [1, 256, 27, 27], "float32"], ["TENSOR", [128, 256, 1, 1], "float32"], [1, 1], [0, 0], [1, 1], "NCHW", "float32"], {}, ["conv2d", [1, 256, 27, 27, "float32"], [128, 256, 1, 1, "float32"], [1, 1], [0, 0], [1, 1], "NCHW", "float32"], {"i": 1942816, "t": "direct", "c": null, "e": [["tile_f", "sp", [-1, 2, 4, 1]], ["tile_y", "sp", [-1, 1, 1, 3]], ["tile_x", "sp", [-1, 1, 27, 1]], ["tile_rc", "sp", [-1, 16]], ["tile_ry", "sp", [-1, 1]], ["tile_rx", "sp", [-1, 1]], ["auto_unroll_max_step", "ot", 512], ["unroll_explicit", "ot", 1]]}], "r": [[2.33432596745386e-05, 2.334472167096646e-05, 2.3345088608850964e-05, 2.334585929747966e-05, 2.3347680492161144e-05, 2.3347909108950187e-05, 2.3350108751736456e-05, 2.335137824965271e-05], 0, 15.225267171859741, 1576832973.919429], "v": 0.1}
{"i": ["cuda -model=unknown", "topi_nn_conv2d", [["TENSOR", [1, 480, 13, 13], "float32"], ["TENSOR", [192, 480, 1, 1], "float32"], [1, 1], [0, 0], [1, 1], "NCHW", "float32"], {}, ["conv2d", [1, 480, 13, 13, "float32"], [192, 480, 1, 1, "float32"], [1, 1], [0, 0], [1, 1], "NCHW", "float32"], {"i": 588803, "t": "direct", "c": null, "e": [["tile_f", "sp", [-1, 1, 12, 2]], ["tile_y", "sp", [-1, 1, 1, 1]], ["tile_x", "sp", [-1, 1, 13, 1]], ["tile_rc", "sp", [-1, 30]], ["tile_ry", "sp", [-1, 1]], ["tile_rx", "sp", [-1, 1]], ["auto_unroll_max_step", "ot", 512], ["unroll_explicit", "ot", 1]]}], "r": [[2.5155601732991016e-05, 2.5161608472400512e-05, 2.5169931215233206e-05, 2.5171055626872056e-05, 2.517139997860505e-05, 2.5177970367993152e-05, 2.5179115853658536e-05, 2.5179963628583653e-05], 0, 20.17060875892639, 1576835187.48126], "v": 0.1}
{"i": ["cuda -model=unknown", "topi_nn_conv2d", [["TENSOR", [1, 512, 13, 13], "float32"], ["TENSOR", [160, 512, 1, 1], "float32"], [1, 1], [0, 0], [1, 1], "NCHW", "float32"], {}, ["conv2d", [1, 512, 13, 13, "float32"], [160, 512, 1, 1, "float32"], [1, 1], [0, 0], [1, 1], "NCHW", "float32"], {"i": 87845, "t": "direct", "c": null, "e": [["tile_f", "sp", [-1, 2, 8, 1]], ["tile_y", "sp", [-1, 1, 1, 1]], ["tile_x", "sp", [-1, 1, 13, 1]], ["tile_rc", "sp", [-1, 16]], ["tile_ry", "sp", [-1, 1]], ["tile_rx", "sp", [-1, 1]], ["auto_unroll_max_step", "ot", 1500], ["unroll_explicit", "ot", 0]]}], "r": [[2.7080358339984037e-05, 2.7081460836848706e-05, 2.7081828525823738e-05, 2.7082178656937635e-05, 2.7082233496750654e-05, 2.7084930224603807e-05, 2.708540918937407e-05, 2.70855600273629e-05], 0, 20.848962545394897, 1576836681.9418607], "v": 0.1}
{"i": ["cuda -model=unknown", "topi_nn_conv2d", [["TENSOR", [1, 512, 13, 13], "float32"], ["TENSOR", [128, 512, 1, 1], "float32"], [1, 1], [0, 0], [1, 1], "NCHW", "float32"], {}, ["conv2d", [1, 512, 13, 13, "float32"], [128, 512, 1, 1, "float32"], [1, 1], [0, 0], [1, 1], "NCHW", "float32"], {"i": 47062, "t": "direct", "c": null, "e": [["tile_f", "sp", [-1, 2, 8, 1]], ["tile_y", "sp", [-1, 1, 1, 1]], ["tile_x", "sp", [-1, 1, 13, 1]], ["tile_rc", "sp", [-1, 16]], ["tile_ry", "sp", [-1, 1]], ["tile_rx", "sp", [-1, 1]], ["auto_unroll_max_step", "ot", 1500], ["unroll_explicit", "ot", 0]]}], "r": [[2.3254223237597913e-05, 2.325430116489255e-05, 2.3254531934123317e-05, 2.325481401887929e-05, 2.325538983731673e-05, 2.3255946977304678e-05, 2.325612010443864e-05, 2.3256402088772846e-05], 0, 16.45158815383911, 1576837991.6863115], "v": 0.1}
{"i": ["cuda -model=unknown", "topi_nn_conv2d", [["TENSOR", [1, 512, 13, 13], "float32"], ["TENSOR", [112, 512, 1, 1], "float32"], [1, 1], [0, 0], [1, 1], "NCHW", "float32"], {}, ["conv2d", [1, 512, 13, 13, "float32"], [112, 512, 1, 1, "float32"], [1, 1], [0, 0], [1, 1], "NCHW", "float32"], {"i": 54899, "t": "direct", "c": null, "e": [["tile_f", "sp", [-1, 2, 4, 1]], ["tile_y", "sp", [-1, 1, 1, 1]], ["tile_x", "sp", [-1, 1, 13, 1]], ["tile_rc", "sp", [-1, 16]], ["tile_ry", "sp", [-1, 1]], ["tile_rx", "sp", [-1, 1]], ["auto_unroll_max_step", "ot", 1500], ["unroll_explicit", "ot", 0]]}], "r": [[2.181883091286307e-05, 2.1823925499811392e-05, 2.187237674462467e-05, 2.1874153998491135e-05, 2.1875120237646174e-05, 2.187616757827235e-05, 2.1876738494907582e-05, 2.1878198604300265e-05], 0, 9.929483652114868, 1576839931.029452], "v": 0.1}
{"i": ["cuda -model=unknown", "topi_nn_conv2d", [["TENSOR", [1, 528, 13, 13], "float32"], ["TENSOR", [256, 528, 1, 1], "float32"], [1, 1], [0, 0], [1, 1], "NCHW", "float32"], {}, ["conv2d", [1, 528, 13, 13, "float32"], [256, 528, 1, 1, "float32"], [1, 1], [0, 0], [1, 1], "NCHW", "float32"], {"i": 244267, "t": "direct", "c": null, "e": [["tile_f", "sp", [-1, 2, 8, 2]], ["tile_y", "sp", [-1, 1, 1, 1]], ["tile_x", "sp", [-1, 1, 13, 1]], ["tile_rc", "sp", [-1, 44]], ["tile_ry", "sp", [-1, 1]], ["tile_rx", "sp", [-1, 1]], ["auto_unroll_max_step", "ot", 512], ["unroll_explicit", "ot", 1]]}], "r": [[3.5076540532630965e-05, 3.507785528241147e-05, 3.507857711442786e-05, 3.508285469710272e-05, 3.508339157155399e-05, 3.508370954053263e-05, 3.5086290020485806e-05, 3.509031899326895e-05], 0, 15.63778567314148, 1576841277.4889634], "v": 0.1}
{"i": ["cuda -model=unknown", "topi_nn_conv2d", [["TENSOR", [1, 832, 6, 6], "float32"], ["TENSOR", [256, 832, 1, 1], "float32"], [1, 1], [0, 0], [1, 1], "NCHW", "float32"], {}, ["conv2d", [1, 832, 6, 6, "float32"], [256, 832, 1, 1, "float32"], [1, 1], [0, 0], [1, 1], "NCHW", "float32"], {"i": 3348875, "t": "direct", "c": null, "e": [["tile_f", "sp", [-1, 1, 32, 1]], ["tile_y", "sp", [-1, 1, 6, 1]], ["tile_x", "sp", [-1, 1, 2, 1]], ["tile_rc", "sp", [-1, 64]], ["tile_ry", "sp", [-1, 1]], ["tile_rx", "sp", [-1, 1]], ["auto_unroll_max_step", "ot", 1500], ["unroll_explicit", "ot", 1]]}], "r": [[1.9546093142526263e-05, 1.9546386218876666e-05, 1.9546509719579782e-05, 1.954705393332782e-05, 1.954706344610803e-05, 1.9547253039953677e-05, 1.9547416825213005e-05, 1.9548686160972784e-05], 0, 31.671452045440674, 1576843089.5830488], "v": 0.1}
{"i": ["cuda -model=unknown", "topi_nn_conv2d", [["TENSOR", [1, 832, 6, 6], "float32"], ["TENSOR", [384, 832, 1, 1], "float32"], [1, 1], [0, 0], [1, 1], "NCHW", "float32"], {}, ["conv2d", [1, 832, 6, 6, "float32"], [384, 832, 1, 1, "float32"], [1, 1], [0, 0], [1, 1], "NCHW", "float32"], {"i": 3013978, "t": "direct", "c": null, "e": [["tile_f", "sp", [-1, 2, 8, 1]], ["tile_y", "sp", [-1, 2, 3, 1]], ["tile_x", "sp", [-1, 1, 6, 1]], ["tile_rc", "sp", [-1, 104]], ["tile_ry", "sp", [-1, 1]], ["tile_rx", "sp", [-1, 1]], ["auto_unroll_max_step", "ot", 512], ["unroll_explicit", "ot", 0]]}], "r": [[2.2813445603864734e-05, 2.2814644927536233e-05, 2.281667458937198e-05, 2.2816691594202896e-05, 2.281674685990338e-05, 2.2817062125603864e-05, 2.2817595942028986e-05, 2.281827265700483e-05], 0, 9.224407196044922, 1576845590.5507703], "v": 0.1}
{"i": ["cuda -model=unknown", "topi_nn_dense", [["TENSOR", [1, 1024], "float32"], ["TENSOR", [1000, 1024], "float32"], null, "float32"], {}, ["dense", [1, 1024, "float32"], [1000, 1024, "float32"], 0, "float32"], {"i": 6, "t": "direct", "c": null, "e": [["tile_k", "sp", [-1, 64]]]}], "r": [[1.9267542757558563e-05, 1.926889932722704e-05, 1.9270006160330713e-05, 1.9270606387290265e-05, 1.92708315635892e-05, 1.9273175812596256e-05, 1.927433119883278e-05, 1.9274653400340438e-05], 0, 6.01471209526062, 1576846812.6392908], "v": 0.1}
