mytophub/20191227/googlenet_bs_8.log
{"i": ["cuda -model=unknown", "topi_nn_conv2d", [["TENSOR", [8, 832, 6, 6], "float32"], ["TENSOR", [48, 832, 1, 1], "float32"], [1, 1], [0, 0], [1, 1], "NCHW", "float32"], {}, ["conv2d", [8, 832, 6, 6, "float32"], [48, 832, 1, 1, "float32"], [1, 1], [0, 0], [1, 1], "NCHW", "float32"], {"i": 1381414, "t": "direct", "c": null, "e": [["tile_f", "sp", [-1, 2, 8, 1]], ["tile_y", "sp", [-1, 1, 3, 2]], ["tile_x", "sp", [-1, 1, 6, 1]], ["tile_rc", "sp", [-1, 104]], ["tile_ry", "sp", [-1, 1]], ["tile_rx", "sp", [-1, 1]], ["auto_unroll_max_step", "ot", 1500], ["unroll_explicit", "ot", 0]]}], "r": [[2.2360332143863275e-05, 2.236038360409428e-05, 2.2361786364916893e-05, 2.236181585125364e-05, 2.2362062353272607e-05, 2.23621703446333e-05, 2.23622384261433e-05, 2.236364926284158e-05], 0, 6.562099456787109, 1576731380.5117717], "v": 0.1}
{"i": ["cuda -model=unknown", "topi_nn_conv2d", [["TENSOR", [8, 48, 6, 6], "float32"], ["TENSOR", [128, 48, 3, 3], "float32"], [1, 1], [1, 1], [1, 1], "NCHW", "float32"], {}, ["conv2d", [8, 48, 6, 6, "float32"], [128, 48, 3, 3, "float32"], [1, 1], [1, 1], [1, 1], "NCHW", "float32"], {"i": 4164262, "t": "direct", "c": null, "e": [["tile_f", "sp", [-1, 2, 8, 1]], ["tile_y", "sp", [-1, 1, 2, 3]], ["tile_x", "sp", [-1, 1, 6, 1]], ["tile_rc", "sp", [-1, 8]], ["tile_ry", "sp", [-1, 3]], ["tile_rx", "sp", [-1, 1]], ["auto_unroll_max_step", "ot", 0], ["unroll_explicit", "ot", 1]]}], "r": [[1.5312398955272608e-05, 1.5312484231145936e-05, 1.5312808880182827e-05, 1.5313043225595823e-05, 1.531363388834476e-05, 1.531414064642507e-05, 1.5314615017956253e-05, 1.5339268364348678e-05], 0, 15.416324377059937, 1576733472.4602602], "v": 0.1}
{"i": ["cuda -model=unknown", "topi_nn_conv2d", [["TENSOR", [8, 832, 6, 6], "float32"], ["TENSOR", [192, 832, 1, 1], "float32"], [1, 1], [0, 0], [1, 1], "NCHW", "float32"], {}, ["conv2d", [8, 832, 6, 6, "float32"], [192, 832, 1, 1, "float32"], [1, 1], [0, 0], [1, 1], "NCHW", "float32"], {"i": 6926705, "t": "direct", "c": null, "e": [["tile_f", "sp", [-1, 4, 16, 1]], ["tile_y", "sp", [-1, 2, 3, 1]], ["tile_x", "sp", [-1, 1, 6, 1]], ["tile_rc", "sp", [-1, 104]], ["tile_ry", "sp", [-1, 1]], ["tile_rx", "sp", [-1, 1]], ["auto_unroll_max_step", "ot", 1500], ["unroll_explicit", "ot", 1]]}], "r": [[4.301014806912737e-05, 4.301020567527203e-05, 4.30105135481118e-05, 4.3011163644122035e-05, 4.301148133134201e-05, 4.3011538510774484e-05, 4.301238660123747e-05, 4.332026989545552e-05], 0, 5.151522159576416, 1576737389.2295413], "v": 0.1}
{"i": ["cuda -model=unknown", "topi_nn_conv2d", [["TENSOR", [8, 192, 6, 6], "float32"], ["TENSOR", [384, 192, 3, 3], "float32"], [1, 1], [1, 1], [1, 1], "NCHW", "float32"], {}, ["conv2d", [8, 192, 6, 6, "float32"], [384, 192, 3, 3, "float32"], [1, 1], [1, 1], [1, 1], "NCHW", "float32"], {"i": 3291137, "t": "winograd", "c": null, "e": [["tile_b", "sp", [-1, 1, 1, 1]], ["tile_y", "sp", [-1, 2, 4, 4]], ["tile_x", "sp", [-1, 3, 24, 1]], ["tile_rc", "sp", [-1, 12]], ["auto_unroll_max_step", "ot", 1500], ["unroll_explicit", "ot", 0]]}], "r": [[5.368705225547119e-05, 5.370281420276909e-05, 5.381829499776686e-05, 5.384546136668156e-05, 5.385077467619473e-05, 5.3884488610987046e-05, 5.391883876730683e-05, 5.392138700312639e-05], 0, 9.661324501037598, 1576741962.4744384], "v": 0.1}
{"i": ["cuda -model=unknown", "topi_nn_conv2d", [["TENSOR", [8, 832, 6, 6], "float32"], ["TENSOR", [128, 832, 1, 1], "float32"], [1, 1], [0, 0], [1, 1], "NCHW", "float32"], {}, ["conv2d", [8, 832, 6, 6, "float32"], [128, 832, 1, 1, "float32"], [1, 1], [0, 0], [1, 1], "NCHW", "float32"], {"i": 1920534, "t": "direct", "c": null, "e": [["tile_f", "sp", [-1, 1, 8, 2]], ["tile_y", "sp", [-1, 1, 2, 1]], ["tile_x", "sp", [-1, 1, 6, 1]], ["tile_rc", "sp", [-1, 26]], ["tile_ry", "sp", [-1, 1]], ["tile_rx", "sp", [-1, 1]], ["auto_unroll_max_step", "ot", 512], ["unroll_explicit", "ot", 1]]}], "r": [[3.733801012332045e-05, 3.733978556966685e-05, 3.734055070863243e-05, 3.7340647524387996e-05, 3.7342682495858645e-05, 3.7346088533038835e-05, 3.734650285293576e-05, 3.737012939444138e-05], 0, 3.29666805267334, 1576744478.986665], "v": 0.1}
{"i": ["cuda -model=unknown", "topi_nn_conv2d", [["TENSOR", [8, 832, 6, 6], "float32"], ["TENSOR", [32, 832, 1, 1], "float32"], [1, 1], [0, 0], [1, 1], "NCHW", "float32"], {}, ["conv2d", [8, 832, 6, 6, "float32"], [32, 832, 1, 1, "float32"], [1, 1], [0, 0], [1, 1], "NCHW", "float32"], {"i": 1136596, "t": "direct", "c": null, "e": [["tile_f", "sp", [-1, 1, 32, 1]], ["tile_y", "sp", [-1, 1, 6, 1]], ["tile_x", "sp", [-1, 1, 2, 1]], ["tile_rc", "sp", [-1, 64]], ["tile_ry", "sp", [-1, 1]], ["tile_rx", "sp", [-1, 1]], ["auto_unroll_max_step", "ot", 1500], ["unroll_explicit", "ot", 1]]}], "r": [[1.974544483228333e-05, 1.97457945683637e-05, 1.974613153413928e-05, 1.9746427124127364e-05, 1.9746636642261194e-05, 1.9747143367955046e-05, 1.9747205176230205e-05, 1.9747220756002043e-05], 0, 19.58287262916565, 1576745864.2599368], "v": 0.1}
{"i": ["cuda -model=unknown", "topi_nn_conv2d", [["TENSOR", [8, 32, 6, 6], "float32"], ["TENSOR", [128, 32, 3, 3], "float32"], [1, 1], [1, 1], [1, 1], "NCHW", "float32"], {}, ["conv2d", [8, 32, 6, 6, "float32"], [128, 32, 3, 3, "float32"], [1, 1], [1, 1], [1, 1], "NCHW", "float32"], {"i": 293542, "t": "direct", "c": null, "e": [["tile_f", "sp", [-1, 2, 8, 1]], ["tile_y", "sp", [-1, 1, 2, 3]], ["tile_x", "sp", [-1, 1, 6, 1]], ["tile_rc", "sp", [-1, 8]], ["tile_ry", "sp", [-1, 3]], ["tile_rx", "sp", [-1, 1]], ["auto_unroll_max_step", "ot", 0], ["unroll_explicit", "ot", 0]]}], "r": [[1.09929442689039e-05, 1.0997348060579646e-05, 1.0998491392460231e-05, 1.1001225757245587e-05, 1.1002365983874482e-05, 1.1005043419045544e-05, 1.100589131619089e-05, 1.1009327304423621e-05], 0, 3.283224582672119, 1576747264.004162], "v": 0.1}
{"i": ["cuda -model=unknown", "topi_nn_conv2d", [["TENSOR", [8, 832, 6, 6], "float32"], ["TENSOR", [160, 832, 1, 1], "float32"], [1, 1], [0, 0], [1, 1], "NCHW", "float32"], {}, ["conv2d", [8, 832, 6, 6, "float32"], [160, 832, 1, 1, "float32"], [1, 1], [0, 0], [1, 1], "NCHW", "float32"], {"i": 3571332, "t": "direct", "c": null, "e": [["tile_f", "sp", [-1, 1, 16, 2]], ["tile_y", "sp", [-1, 2, 3, 1]], ["tile_x", "sp", [-1, 1, 2, 1]], ["tile_rc", "sp", [-1, 26]], ["tile_ry", "sp", [-1, 1]], ["tile_rx", "sp", [-1, 1]], ["auto_unroll_max_step", "ot", 512], ["unroll_explicit", "ot", 1]]}], "r": [[3.677511825470244e-05, 3.677517930928153e-05, 3.6781939099599136e-05, 3.6784339808818994e-05, 3.678643046561825e-05, 3.679163320999075e-05, 3.6793706136293554e-05, 3.67940200431699e-05], 0, 12.073673963546753, 1576749605.0048957], "v": 0.1}
{"i": ["cuda -model=unknown", "topi_nn_conv2d", [["TENSOR", [8, 160, 6, 6], "float32"], ["TENSOR", [320, 160, 3, 3], "float32"], [1, 1], [1, 1], [1, 1], "NCHW", "float32"], {}, ["conv2d", [8, 160, 6, 6, "float32"], [320, 160, 3, 3, "float32"], [1, 1], [1, 1], [1, 1], "NCHW", "float32"], {"i": 4521324, "t": "winograd", "c": null, "e": [["tile_b", "sp", [-1, 1, 1, 1]], ["tile_y", "sp", [-1, 4, 4, 2]], ["tile_x", "sp", [-1, 3, 24, 1]], ["tile_rc", "sp", [-1, 20]], ["auto_unroll_max_step", "ot", 1500], ["unroll_explicit", "ot", 1]]}], "r": [[4.066685782080486e-05, 4.0671662110858014e-05, 4.071358807896735e-05, 4.0725537965072135e-05, 4.078464483675019e-05, 4.0787066249050876e-05, 4.0789132118451025e-05, 4.086908845861807e-05], 0, 3.8958396911621094, 1576752248.6139946], "v": 0.1}
{"i": ["cuda -model=unknown", "topi_nn_conv2d", [["TENSOR", [8, 528, 13, 13], "float32"], ["TENSOR", [128, 528, 1, 1], "float32"], [1, 1], [0, 0], [1, 1], "NCHW", "float32"], {}, ["conv2d", [8, 528, 13, 13, "float32"], [128, 528, 1, 1, "float32"], [1, 1], [0, 0], [1, 1], "NCHW", "float32"], {"i": 53079, "t": "direct", "c": null, "e": [["tile_f", "sp", [-1, 8, 1, 2]], ["tile_y", "sp", [-1, 1, 13, 1]], ["tile_x", "sp", [-1, 1, 13, 1]], ["tile_rc", "sp", [-1, 12]], ["tile_ry", "sp", [-1, 1]], ["tile_rx", "sp", [-1, 1]], ["auto_unroll_max_step", "ot", 512], ["unroll_explicit", "ot", 0]]}], "r": [[7.777665726109857e-05, 7.778628480060196e-05, 7.778763431151242e-05, 7.781566779533483e-05, 7.782162528216705e-05, 7.782895974416855e-05, 7.78374288939052e-05, 7.833043077501881e-05], 0, 3.3105523586273193, 1576756212.4523659], "v": 0.1}
{"i": ["cuda -model=unknown", "topi_nn_conv2d", [["TENSOR", [8, 528, 13, 13], "float32"], ["TENSOR", [32, 528, 1, 1], "float32"], [1, 1], [0, 0], [1, 1], "NCHW", "float32"], {}, ["conv2d", [8, 528, 13, 13, "float32"], [32, 528, 1, 1, "float32"], [1, 1], [0, 0], [1, 1], "NCHW", "float32"], {"i": 82897, "t": "direct", "c": null, "e": [["tile_f", "sp", [-1, 4, 8, 1]], ["tile_y", "sp", [-1, 1, 1, 1]], ["tile_x", "sp", [-1, 1, 13, 1]], ["tile_rc", "sp", [-1, 44]], ["tile_ry", "sp", [-1, 1]], ["tile_rx", "sp", [-1, 1]], ["auto_unroll_max_step", "ot", 512], ["unroll_explicit", "ot", 1]]}], "r": [[3.5496797916666666e-05, 3.5498752430555556e-05, 3.557595121527778e-05, 3.559557638888889e-05, 3.5644819097222225e-05, 3.5662435590277774e-05, 3.5677339583333334e-05, 3.575972829861111e-05], 0, 3.4832985401153564, 1576758759.338295], "v": 0.1}
{"i": ["cuda -model=unknown", "topi_nn_conv2d", [["TENSOR", [8, 32, 13, 13], "float32"], ["TENSOR", [128, 32, 3, 3], "float32"], [1, 1], [1, 1], [1, 1], "NCHW", "float32"], {}, ["conv2d", [8, 32, 13, 13, "float32"], [128, 32, 3, 3, "float32"], [1, 1], [1, 1], [1, 1], "NCHW", "float32"], {"i": 156621, "t": "direct", "c": null, "e": [["tile_f", "sp", [-1, 1, 8, 1]], ["tile_y", "sp", [-1, 13, 1, 1]], ["tile_x", "sp", [-1, 1, 13, 1]], ["tile_rc", "sp", [-1, 8]], ["tile_ry", "sp", [-1, 3]], ["tile_rx", "sp", [-1, 1]], ["auto_unroll_max_step", "ot", 0], ["unroll_explicit", "ot", 1]]}], "r": [[3.450986861632475e-05, 3.451447766623018e-05, 3.451471642659683e-05, 3.451585086570639e-05, 3.4518913865851886e-05, 3.452104350356467e-05, 3.460537465444493e-05, 3.4620912556380034e-05], 0, 12.247331857681274, 1576761224.8856735], "v": 0.1}
{"i": ["cuda -model=unknown", "topi_nn_conv2d", [["TENSOR", [8, 528, 13, 13], "float32"], ["TENSOR", [160, 528, 1, 1], "float32"], [1, 1], [0, 0], [1, 1], "NCHW", "float32"], {}, ["conv2d", [8, 528, 13, 13, "float32"], [160, 528, 1, 1, "float32"], [1, 1], [0, 0], [1, 1], "NCHW", "float32"], {"i": 314240, "t": "direct", "c": null, "e": [["tile_f", "sp", [-1, 1, 1, 16]], ["tile_y", "sp", [-1, 1, 13, 1]], ["tile_x", "sp", [-1, 1, 13, 1]], ["tile_rc", "sp", [-1, 12]], ["tile_ry", "sp", [-1, 1]], ["tile_rx", "sp", [-1, 1]], ["auto_unroll_max_step", "ot", 512], ["unroll_explicit", "ot", 1]]}], "r": [[8.61140790879943e-05, 8.611611471321695e-05, 8.612257071606698e-05, 8.612851229070182e-05, 8.613868257926612e-05, 8.614064196651228e-05, 8.615972639828999e-05, 8.616140078375489e-05], 0, 10.373337268829346, 1576762653.464205], "v": 0.1}
{"i": ["cuda -model=unknown", "topi_nn_conv2d", [["TENSOR", [8, 160, 13, 13], "float32"], ["TENSOR", [320, 160, 3, 3], "float32"], [1, 1], [1, 1], [1, 1], "NCHW", "float32"], {}, ["conv2d", [8, 160, 13, 13, "float32"], [320, 160, 3, 3, "float32"], [1, 1], [1, 1], [1, 1], "NCHW", "float32"], {"i": 1893873, "t": "winograd", "c": null, "e": [["tile_b", "sp", [-1, 1, 1, 1]], ["tile_y", "sp", [-1, 2, 8, 4]], ["tile_x", "sp", [-1, 7, 8, 1]], ["tile_rc", "sp", [-1, 8]], ["auto_unroll_max_step", "ot", 1500], ["unroll_explicit", "ot", 0]]}], "r": [[0.00017972045386904762, 0.00017975442485119048, 0.00017978287053571428, 0.00017982568080357142, 0.00017986470833333332, 0.00017989031175595237, 0.0001799704754464286, 0.00017998425892857143], 0, 10.04591989517212, 1576766166.3788886], "v": 0.1}
{"i": ["cuda -model=unknown", "topi_nn_conv2d", [["TENSOR", [8, 512, 13, 13], "float32"], ["TENSOR", [32, 512, 1, 1], "float32"], [1, 1], [0, 0], [1, 1], "NCHW", "float32"], {}, ["conv2d", [8, 512, 13, 13, "float32"], [32, 512, 1, 1, "float32"], [1, 1], [0, 0], [1, 1], "NCHW", "float32"], {"i": 21968, "t": "direct", "c": null, "e": [["tile_f", "sp", [-1, 2, 8, 1]], ["tile_y", "sp", [-1, 1, 1, 1]], ["tile_x", "sp", [-1, 1, 13, 1]], ["tile_rc", "sp", [-1, 16]], ["tile_ry", "sp", [-1, 1]], ["tile_rx", "sp", [-1, 1]], ["auto_unroll_max_step", "ot", 1500], ["unroll_explicit", "ot", 0]]}], "r": [[3.631196007314843e-05, 3.6312322157878696e-05, 3.631259798841816e-05, 3.631288875342883e-05, 3.6313444224321854e-05, 3.631365330691862e-05, 3.631431667174642e-05, 3.631661840902164e-05], 0, 7.122187852859497, 1576768622.0158718], "v": 0.1}
{"i": ["cuda -model=unknown", "topi_nn_conv2d", [["TENSOR", [8, 32, 13, 13], "float32"], ["TENSOR", [64, 32, 3, 3], "float32"], [1, 1], [1, 1], [1, 1], "NCHW", "float32"], {}, ["conv2d", [8, 32, 13, 13, "float32"], [64, 32, 3, 3, "float32"], [1, 1], [1, 1], [1, 1], "NCHW", "float32"], {"i": 159371, "t": "direct", "c": null, "e": [["tile_f", "sp", [-1, 2, 16, 1]], ["tile_y", "sp", [-1, 13, 1, 1]], ["tile_x", "sp", [-1, 1, 13, 1]], ["tile_rc", "sp", [-1, 16]], ["tile_ry", "sp", [-1, 3]], ["tile_rx", "sp", [-1, 3]], ["auto_unroll_max_step", "ot", 512], ["unroll_explicit", "ot", 1]]}], "r": [[2.6015670614035085e-05, 2.6016495942982455e-05, 2.6017698903508772e-05, 2.6017841228070176e-05, 2.601793717105263e-05, 2.6018553289473686e-05, 2.601911524122807e-05, 2.6020722039473683e-05], 0, 24.358052492141724, 1576769945.4799871], "v": 0.1}
{"i": ["cuda -model=unknown", "topi_nn_conv2d", [["TENSOR", [8, 512, 13, 13], "float32"], ["TENSOR", [144, 512, 1, 1], "float32"], [1, 1], [0, 0], [1, 1], "NCHW", "float32"], {}, ["conv2d", [8, 512, 13, 13, "float32"], [144, 512, 1, 1, "float32"], [1, 1], [0, 0], [1, 1], "NCHW", "float32"], {"i": 132319, "t": "direct", "c": null, "e": [["tile_f", "sp", [-1, 6, 2, 1]], ["tile_y", "sp", [-1, 1, 13, 1]], ["tile_x", "sp", [-1, 1, 13, 1]], ["tile_rc", "sp", [-1, 8]], ["tile_ry", "sp", [-1, 1]], ["tile_rx", "sp", [-1, 1]], ["auto_unroll_max_step", "ot", 1500], ["unroll_explicit", "ot", 0]]}], "r": [[9.003372829763247e-05, 9.004994438181135e-05, 9.005335024426907e-05, 9.007302743329575e-05, 9.00826245772266e-05, 9.008453025178504e-05, 9.015729500187899e-05, 9.016665764750094e-05], 0, 12.603255987167358, 1576771229.4441698], "v": 0.1}
{"i": ["cuda -model=unknown", "topi_nn_conv2d", [["TENSOR", [8, 144, 13, 13], "float32"], ["TENSOR", [288, 144, 3, 3], "float32"], [1, 1], [1, 1], [1, 1], "NCHW", "float32"], {}, ["conv2d", [8, 144, 13, 13, "float32"], [288, 144, 3, 3, "float32"], [1, 1], [1, 1], [1, 1], "NCHW", "float32"], {"i": 7750724, "t": "winograd", "c": null, "e": [["tile_b", "sp", [-1, 1, 1, 1]], ["tile_y", "sp", [-1, 2, 9, 4]], ["tile_x", "sp", [-1, 4, 14, 1]], ["tile_rc", "sp", [-1, 18]], ["auto_unroll_max_step", "ot", 128], ["unroll_explicit", "ot", 1]]}], "r": [[0.0001549736420782553, 0.00015499872033354715, 0.00015504767735728033, 0.00015506694676074406, 0.00015512949775497114, 0.00015514551507376522, 0.00015551126812059012, 0.0001555155311096857], 0, 27.204151391983032, 1576772545.7779813], "v": 0.1}
{"i": ["cuda -model=unknown", "topi_nn_conv2d", [["TENSOR", [8, 128, 13, 13], "float32"], ["TENSOR", [256, 128, 3, 3], "float32"], [1, 1], [1, 1], [1, 1], "NCHW", "float32"], {}, ["conv2d", [8, 128, 13, 13, "float32"], [256, 128, 3, 3, "float32"], [1, 1], [1, 1], [1, 1], "NCHW", "float32"], {"i": 1425044, "t": "winograd", "c": null, "e": [["tile_b", "sp", [-1, 1, 1, 1]], ["tile_y", "sp", [-1, 2, 16, 4]], ["tile_x", "sp", [-1, 7, 8, 1]], ["tile_rc", "sp", [-1, 8]], ["auto_unroll_max_step", "ot", 1500], ["unroll_explicit", "ot", 1]]}], "r": [[0.00013075818191780823, 0.0001308193391780822, 0.00013084013315068494, 0.00013093226739726026, 0.0001309773791780822, 0.0001310695506849315, 0.00013115012328767124, 0.00013123333698630135], 0, 7.2738096714019775, 1576777174.888942], "v": 0.1}
{"i": ["cuda -model=unknown", "topi_nn_conv2d", [["TENSOR", [8, 512, 13, 13], "float32"], ["TENSOR", [64, 512, 1, 1], "float32"], [1, 1], [0, 0], [1, 1], "NCHW", "float32"], {}, ["conv2d", [8, 512, 13, 13, "float32"], [64, 512, 1, 1, "float32"], [1, 1], [0, 0], [1, 1], "NCHW", "float32"], {"i": 59828, "t": "direct", "c": null, "e": [["tile_f", "sp", [-1, 4, 8, 1]], ["tile_y", "sp", [-1, 1, 1, 1]], ["tile_x", "sp", [-1, 1, 13, 1]], ["tile_rc", "sp", [-1, 16]], ["tile_ry", "sp", [-1, 1]], ["tile_rx", "sp", [-1, 1]], ["auto_unroll_max_step", "ot", 512], ["unroll_explicit", "ot", 1]]}], "r": [[5.883714914772727e-05, 5.885746420454545e-05, 5.8884005397727276e-05, 5.8886619034090906e-05, 5.891282784090909e-05, 5.893853125e-05, 5.8954125284090914e-05, 5.9107864488636365e-05], 0, 3.3381495475769043, 1576780496.3943536], "v": 0.1}
{"i": ["cuda -model=unknown", "topi_nn_conv2d", [["TENSOR", [8, 512, 13, 13], "float32"], ["TENSOR", [24, 512, 1, 1], "float32"], [1, 1], [0, 0], [1, 1], "NCHW", "float32"], {}, ["conv2d", [8, 512, 13, 13, "float32"], [24, 512, 1, 1, "float32"], [1, 1], [0, 0], [1, 1], "NCHW", "float32"], {"i": 5788, "t": "direct", "c": null, "e": [["tile_f", "sp", [-1, 2, 12, 1]], ["tile_y", "sp", [-1, 1, 1, 1]], ["tile_x", "sp", [-1, 1, 13, 1]], ["tile_rc", "sp", [-1, 16]], ["tile_ry", "sp", [-1, 1]], ["tile_rx", "sp", [-1, 1]], ["auto_unroll_max_step", "ot", 0], ["unroll_explicit", "ot", 0]]}], "r": [[3.247583560337783e-05, 3.247607245982021e-05, 3.247732102969218e-05, 3.247884581857804e-05, 3.247999387087987e-05, 3.2482635249250885e-05, 3.248275183873604e-05, 3.248442672296377e-05], 0, 15.357598543167114, 1576781747.6406093], "v": 0.1}
{"i": ["cuda -model=unknown", "topi_nn_conv2d", [["TENSOR", [8, 24, 13, 13], "float32"], ["TENSOR", [64, 24, 3, 3], "float32"], [1, 1], [1, 1], [1, 1], "NCHW", "float32"], {}, ["conv2d", [8, 24, 13, 13, "float32"], [64, 24, 3, 3, "float32"], [1, 1], [1, 1], [1, 1], "NCHW", "float32"], {"i": 256330, "t": "direct", "c": null, "e": [["tile_f", "sp", [-1, 1, 16, 2]], ["tile_y", "sp", [-1, 1, 1, 13]], ["tile_x", "sp", [-1, 1, 13, 1]], ["tile_rc", "sp", [-1, 12]], ["tile_ry", "sp", [-1, 3]], ["tile_rx", "sp", [-1, 3]], ["auto_unroll_max_step", "ot", 1500], ["unroll_explicit", "ot", 1]]}], "r": [[1.9542360399300196e-05, 1.954255727076258e-05, 1.9542841617783267e-05, 1.9544021199958836e-05, 1.954445806318823e-05, 1.95444899660389e-05, 1.954569630544407e-05, 1.9570029741689825e-05], 0, 3.797703742980957, 1576782876.843084], "v": 0.1}
{"i": ["cuda -model=unknown", "topi_nn_conv2d", [["TENSOR", [8, 112, 13, 13], "float32"], ["TENSOR", [224, 112, 3, 3], "float32"], [1, 1], [1, 1], [1, 1], "NCHW", "float32"], {}, ["conv2d", [8, 112, 13, 13, "float32"], [224, 112, 3, 3, "float32"], [1, 1], [1, 1], [1, 1], "NCHW", "float32"], {"i": 2427362, "t": "winograd", "c": null, "e": [["tile_b", "sp", [-1, 1, 1, 1]], ["tile_y", "sp", [-1, 4, 14, 2]], ["tile_x", "sp", [-1, 7, 8, 1]], ["tile_rc", "sp", [-1, 8]], ["auto_unroll_max_step", "ot", 1500], ["unroll_explicit", "ot", 1]]}], "r": [[0.00011026100092250923, 0.00011030273662361625, 0.00011039947878228782, 0.00011047222370848709, 0.00011048621402214022, 0.00011076823247232472, 0.00011083321217712178, 0.00011100442896678967], 0, 12.408809661865234, 1576786528.9592266], "v": 0.1}
{"i": ["cuda -model=unknown", "topi_nn_conv2d", [["TENSOR", [8, 480, 13, 13], "float32"], ["TENSOR", [64, 480, 1, 1], "float32"], [1, 1], [0, 0], [1, 1], "NCHW", "float32"], {}, ["conv2d", [8, 480, 13, 13, "float32"], [64, 480, 1, 1, "float32"], [1, 1], [0, 0], [1, 1], "NCHW", "float32"], {"i": 82717, "t": "direct", "c": null, "e": [["tile_f", "sp", [-1, 1, 8, 4]], ["tile_y", "sp", [-1, 1, 1, 1]], ["tile_x", "sp", [-1, 1, 13, 1]], ["tile_rc", "sp", [-1, 30]], ["tile_ry", "sp", [-1, 1]], ["tile_rx", "sp", [-1, 1]], ["auto_unroll_max_step", "ot", 1500], ["unroll_explicit", "ot", 0]]}], "r": [[5.193933195921024e-05, 5.1940293339119116e-05, 5.1940758949880664e-05, 5.194176263831634e-05, 5.194325428509438e-05, 5.1943784334996745e-05, 5.19457498372749e-05, 5.194983727489694e-05], 0, 6.553488254547119, 1576789068.9014025], "v": 0.1}
{"i": ["cuda -model=unknown", "topi_nn_conv2d", [["TENSOR", [8, 480, 13, 13], "float32"], ["TENSOR", [16, 480, 1, 1], "float32"], [1, 1], [0, 0], [1, 1], "NCHW", "float32"], {}, ["conv2d", [8, 480, 13, 13, "float32"], [16, 480, 1, 1, "float32"], [1, 1], [0, 0], [1, 1], "NCHW", "float32"], {"i": 8693, "t": "direct", "c": null, "e": [["tile_f", "sp", [-1, 2, 8, 1]], ["tile_y", "sp", [-1, 1, 1, 1]], ["tile_x", "sp", [-1, 1, 13, 1]], ["tile_rc", "sp", [-1, 40]], ["tile_ry", "sp", [-1, 1]], ["tile_rx", "sp", [-1, 1]], ["auto_unroll_max_step", "ot", 0], ["unroll_explicit", "ot", 0]]}], "r": [[2.0581725786819684e-05, 2.0581985741610155e-05, 2.0581991479742652e-05, 2.058315240827682e-05, 2.0583719092331768e-05, 2.05839245348635e-05, 2.0585134759172317e-05, 2.0586641192836028e-05], 0, 9.39771842956543, 1576790573.9082732], "v": 0.1}
{"i": ["cuda -model=unknown", "topi_nn_conv2d", [["TENSOR", [8, 16, 13, 13], "float32"], ["TENSOR", [48, 16, 3, 3], "float32"], [1, 1], [1, 1], [1, 1], "NCHW", "float32"], {}, ["conv2d", [8, 16, 13, 13, "float32"], [48, 16, 3, 3, "float32"], [1, 1], [1, 1], [1, 1], "NCHW", "float32"], {"i": 111340, "t": "direct", "c": null, "e": [["tile_f", "sp", [-1, 1, 16, 1]], ["tile_y", "sp", [-1, 1, 1, 13]], ["tile_x", "sp", [-1, 1, 13, 1]], ["tile_rc", "sp", [-1, 16]], ["tile_ry", "sp", [-1, 3]], ["tile_rx", "sp", [-1, 1]], ["auto_unroll_max_step", "ot", 1500], ["unroll_explicit", "ot", 0]]}], "r": [[1.0923176660430308e-05, 1.0925023292797007e-05, 1.0925405332086063e-05, 1.0925545603367632e-05, 1.0927678531337698e-05, 1.092796515434986e-05, 1.0930363657623948e-05, 1.0931305378858747e-05], 0, 22.238034963607788, 1576791942.7505648], "v": 0.1}
{"i": ["cuda -model=unknown", "topi_nn_conv2d", [["TENSOR", [8, 480, 13, 13], "float32"], ["TENSOR", [96, 480, 1, 1], "float32"], [1, 1], [0, 0], [1, 1], "NCHW", "float32"], {}, ["conv2d", [8, 480, 13, 13, "float32"], [96, 480, 1, 1, "float32"], [1, 1], [0, 0], [1, 1], "NCHW", "float32"], {"i": 400097, "t": "direct", "c": null, "e": [["tile_f", "sp", [-1, 8, 4, 1]], ["tile_y", "sp", [-1, 1, 13, 1]], ["tile_x", "sp", [-1, 1, 13, 1]], ["tile_rc", "sp", [-1, 40]], ["tile_ry", "sp", [-1, 1]], ["tile_rx", "sp", [-1, 1]], ["auto_unroll_max_step", "ot", 512], ["unroll_explicit", "ot", 1]]}], "r": [[6.0777518853695324e-05, 6.097648139768728e-05, 6.100883836098542e-05, 6.1026092257415786e-05, 6.102613901458019e-05, 6.104240221216692e-05, 6.105040849673203e-05, 6.110435746606334e-05], 0, 19.48387885093689, 1576793394.577804], "v": 0.1}
{"i": ["cuda -model=unknown", "topi_nn_conv2d", [["TENSOR", [8, 96, 13, 13], "float32"], ["TENSOR", [208, 96, 3, 3], "float32"], [1, 1], [1, 1], [1, 1], "NCHW", "float32"], {}, ["conv2d", [8, 96, 13, 13, "float32"], [208, 96, 3, 3, "float32"], [1, 1], [1, 1], [1, 1], "NCHW", "float32"], {"i": 1797156, "t": "winograd", "c": null, "e": [["tile_b", "sp", [-1, 1, 1, 1]], ["tile_y", "sp", [-1, 1, 16, 13]], ["tile_x", "sp", [-1, 7, 8, 1]], ["tile_rc", "sp", [-1, 6]], ["auto_unroll_max_step", "ot", 1500], ["unroll_explicit", "ot", 1]]}], "r": [[9.648114958117271e-05, 9.653937654567213e-05, 9.660900837654567e-05, 9.661351615476665e-05, 9.673807339449542e-05, 9.680732110091743e-05, 9.717496848823294e-05, 9.721979018747507e-05], 0, 10.708266258239746, 1576798119.1276264], "v": 0.1}
{"i": ["cuda -model=unknown", "topi_nn_conv2d", [["TENSOR", [8, 256, 27, 27], "float32"], ["TENSOR", [64, 256, 1, 1], "float32"], [1, 1], [0, 0], [1, 1], "NCHW", "float32"], {}, ["conv2d", [8, 256, 27, 27, "float32"], [64, 256, 1, 1, "float32"], [1, 1], [0, 0], [1, 1], "NCHW", "float32"], {"i": 1325951, "t": "direct", "c": null, "e": [["tile_f", "sp", [-1, 16, 2, 1]], ["tile_y", "sp", [-1, 3, 3, 1]], ["tile_x", "sp", [-1, 1, 27, 1]], ["tile_rc", "sp", [-1, 8]], ["tile_ry", "sp", [-1, 1]], ["tile_rx", "sp", [-1, 1]], ["auto_unroll_max_step", "ot", 512], ["unroll_explicit", "ot", 1]]}], "r": [[6.650122344827587e-05, 6.655073462068966e-05, 6.65647652413793e-05, 6.657225434482759e-05, 6.659438675862069e-05, 6.661166344827587e-05, 6.661771365517242e-05, 6.662463393103447e-05], 0, 10.11082410812378, 1576801622.5399704], "v": 0.1}
{"i": ["cuda -model=unknown", "topi_nn_conv2d", [["TENSOR", [8, 256, 27, 27], "float32"], ["TENSOR", [32, 256, 1, 1], "float32"], [1, 1], [0, 0], [1, 1], "NCHW", "float32"], {}, ["conv2d", [8, 256, 27, 27, "float32"], [32, 256, 1, 1, "float32"], [1, 1], [0, 0], [1, 1], "NCHW", "float32"], {"i": 99749, "t": "direct", "c": null, "e": [["tile_f", "sp", [-1, 4, 4, 1]], ["tile_y", "sp", [-1, 3, 1, 1]], ["tile_x", "sp", [-1, 1, 27, 1]], ["tile_rc", "sp", [-1, 16]], ["tile_ry", "sp", [-1, 1]], ["tile_rx", "sp", [-1, 1]], ["auto_unroll_max_step", "ot", 0], ["unroll_explicit", "ot", 0]]}], "r": [[3.8475113368811483e-05, 3.8476110788582486e-05, 3.849148427672956e-05, 3.853229495242703e-05, 3.8547820674084823e-05, 3.856346476374778e-05, 3.856453313981616e-05, 3.8600756490888564e-05], 0, 12.19346284866333, 1576803885.2171824], "v": 0.1}
{"i": ["cuda -model=unknown", "topi_nn_conv2d", [["TENSOR", [8, 32, 27, 27], "float32"], ["TENSOR", [96, 32, 3, 3], "float32"], [1, 1], [1, 1], [1, 1], "NCHW", "float32"], {}, ["conv2d", [8, 32, 27, 27, "float32"], [96, 32, 3, 3, "float32"], [1, 1], [1, 1], [1, 1], "NCHW", "float32"], {"i": 5956480, "t": "direct", "c": null, "e": [["tile_f", "sp", [-1, 1, 8, 2]], ["tile_y", "sp", [-1, 3, 1, 3]], ["tile_x", "sp", [-1, 1, 27, 1]], ["tile_rc", "sp", [-1, 1]], ["tile_ry", "sp", [-1, 3]], ["tile_rx", "sp", [-1, 3]], ["auto_unroll_max_step", "ot", 1500], ["unroll_explicit", "ot", 0]]}], "r": [[6.339387378385485e-05, 6.339479305811202e-05, 6.339579989481988e-05, 6.340109071785433e-05, 6.340128293452538e-05, 6.34085937417828e-05, 6.341083092295555e-05, 6.341184012621615e-05], 0, 24.554778814315796, 1576807328.3099985], "v": 0.1}
{"i": ["cuda -model=unknown", "topi_nn_conv2d", [["TENSOR", [8, 128, 27, 27], "float32"], ["TENSOR", [192, 128, 3, 3], "float32"], [1, 1], [1, 1], [1, 1], "NCHW", "float32"], {}, ["conv2d", [8, 128, 27, 27, "float32"], [192, 128, 3, 3, "float32"], [1, 1], [1, 1], [1, 1], "NCHW", "float32"], {"i": 3821594, "t": "winograd", "c": null, "e": [["tile_b", "sp", [-1, 1, 1, 1]], ["tile_y", "sp", [-1, 1, 8, 8]], ["tile_x", "sp", [-1, 2, 8, 2]], ["tile_rc", "sp", [-1, 16]], ["auto_unroll_max_step", "ot", 1500], ["unroll_explicit", "ot", 0]]}], "r": [[0.0003719106707692308, 0.0003720191353846154, 0.00037205839384615386, 0.00037217438, 0.00037220097384615383, 0.0003722306984615385, 0.0003723310046153846, 0.00037240019076923076], 0, 6.898967027664185, 1576810398.5625088], "v": 0.1}
{"i": ["cuda -model=unknown", "topi_nn_conv2d", [["TENSOR", [8, 192, 27, 27], "float32"], ["TENSOR", [32, 192, 1, 1], "float32"], [1, 1], [0, 0], [1, 1], "NCHW", "float32"], {}, ["conv2d", [8, 192, 27, 27, "float32"], [32, 192, 1, 1, "float32"], [1, 1], [0, 0], [1, 1], "NCHW", "float32"], {"i": 166949, "t": "direct", "c": null, "e": [["tile_f", "sp", [-1, 4, 4, 1]], ["tile_y", "sp", [-1, 3, 1, 1]], ["tile_x", "sp", [-1, 1, 27, 1]], ["tile_rc", "sp", [-1, 16]], ["tile_ry", "sp", [-1, 1]], ["tile_rx", "sp", [-1, 1]], ["auto_unroll_max_step", "ot", 0], ["unroll_explicit", "ot", 0]]}], "r": [[3.113792113523411e-05, 3.1167681532827625e-05, 3.117279466387654e-05, 3.119653112738687e-05, 3.129077308396547e-05, 3.1291286947423494e-05, 3.129941865027466e-05, 3.1337387653675126e-05], 0, 13.919028043746948, 1576813425.4374557], "v": 0.1}
{"i": ["cuda -model=unknown", "topi_nn_conv2d", [["TENSOR", [8, 192, 27, 27], "float32"], ["TENSOR", [16, 192, 1, 1], "float32"], [1, 1], [0, 0], [1, 1], "NCHW", "float32"], {}, ["conv2d", [8, 192, 27, 27, "float32"], [16, 192, 1, 1, "float32"], [1, 1], [0, 0], [1, 1], "NCHW", "float32"], {"i": 300345, "t": "direct", "c": null, "e": [["tile_f", "sp", [-1, 2, 4, 1]], ["tile_y", "sp", [-1, 3, 1, 1]], ["tile_x", "sp", [-1, 1, 27, 1]], ["tile_rc", "sp", [-1, 16]], ["tile_ry", "sp", [-1, 1]], ["tile_rx", "sp", [-1, 1]], ["auto_unroll_max_step", "ot", 512], ["unroll_explicit", "ot", 0]]}], "r": [[2.7862317642787997e-05, 2.7946974709583736e-05, 2.7974687439496614e-05, 2.7975572725072604e-05, 2.802012935624395e-05, 2.802546551306873e-05, 2.804378775411423e-05, 2.8060837003872216e-05], 0, 16.55501651763916, 1576815375.219149], "v": 0.1}
{"i": ["cuda -model=unknown", "topi_nn_conv2d", [["TENSOR", [8, 16, 27, 27], "float32"], ["TENSOR", [32, 16, 3, 3], "float32"], [1, 1], [1, 1], [1, 1], "NCHW", "float32"], {}, ["conv2d", [8, 16, 27, 27, "float32"], [32, 16, 3, 3, "float32"], [1, 1], [1, 1], [1, 1], "NCHW", "float32"], {"i": 2653912, "t": "direct", "c": null, "e": [["tile_f", "sp", [-1, 2, 8, 1]], ["tile_y", "sp", [-1, 3, 1, 3]], ["tile_x", "sp", [-1, 1, 27, 1]], ["tile_rc", "sp", [-1, 8]], ["tile_ry", "sp", [-1, 3]], ["tile_rx", "sp", [-1, 3]], ["auto_unroll_max_step", "ot", 1500], ["unroll_explicit", "ot", 1]]}], "r": [[1.5960722124253934e-05, 1.5961103160607703e-05, 1.5961724158979925e-05, 1.5962686177428107e-05, 1.5962838578404776e-05, 1.5963055344546935e-05, 1.596320001356484e-05, 1.5963406877373847e-05], 0, 8.675055503845215, 1576817593.368663], "v": 0.1}
{"i": ["cuda -model=unknown", "topi_nn_conv2d", [["TENSOR", [8, 192, 27, 27], "float32"], ["TENSOR", [96, 192, 1, 1], "float32"], [1, 1], [0, 0], [1, 1], "NCHW", "float32"], {}, ["conv2d", [8, 192, 27, 27, "float32"], [96, 192, 1, 1, "float32"], [1, 1], [0, 0], [1, 1], "NCHW", "float32"], {"i": 573820, "t": "direct", "c": null, "e": [["tile_f", "sp", [-1, 1, 12, 4]], ["tile_y", "sp", [-1, 3, 1, 1]], ["tile_x", "sp", [-1, 3, 9, 1]], ["tile_rc", "sp", [-1, 12]], ["tile_ry", "sp", [-1, 1]], ["tile_rx", "sp", [-1, 1]], ["auto_unroll_max_step", "ot", 0], ["unroll_explicit", "ot", 0]]}], "r": [[5.479834645877378e-05, 5.4810790697674414e-05, 5.482925924947146e-05, 5.4922568974630025e-05, 5.4934656183932345e-05, 5.495249762156448e-05, 5.495675317124736e-05, 5.498462447145878e-05], 0, 3.53836727142334, 1576819507.257591], "v": 0.1}
{"i": ["cuda -model=unknown", "topi_nn_conv2d", [["TENSOR", [8, 96, 27, 27], "float32"], ["TENSOR", [128, 96, 3, 3], "float32"], [1, 1], [1, 1], [1, 1], "NCHW", "float32"], {}, ["conv2d", [8, 96, 27, 27, "float32"], [128, 96, 3, 3, "float32"], [1, 1], [1, 1], [1, 1], "NCHW", "float32"], {"i": 2090360, "t": "winograd", "c": null, "e": [["tile_b", "sp", [-1, 1, 1, 1]], ["tile_y", "sp", [-1, 2, 8, 4]], ["tile_x", "sp", [-1, 4, 8, 1]], ["tile_rc", "sp", [-1, 16]], ["auto_unroll_max_step", "ot", 1500], ["unroll_explicit", "ot", 0]]}], "r": [[0.00024419363471241167, 0.00024419948435923307, 0.00024433991927346117, 0.0002443582502522704, 0.00024440177800201816, 0.0002445020484359233, 0.0002445198466195762, 0.0002446106972754793], 0, 9.911785364151001, 1576821266.3522503], "v": 0.1}
{"i": ["cuda -model=unknown", "topi_nn_conv2d", [["TENSOR", [8, 3, 224, 224], "float32"], ["TENSOR", [64, 3, 7, 7], "float32"], [2, 2], [3, 3], [1, 1], "NCHW", "float32"], {}, ["conv2d", [8, 3, 224, 224, "float32"], [64, 3, 7, 7, "float32"], [2, 2], [3, 3], [1, 1], "NCHW", "float32"], {"i": 76175977, "t": "direct", "c": null, "e": [["tile_f", "sp", [-1, 1, 8, 8]], ["tile_y", "sp", [-1, 2, 1, 4]], ["tile_x", "sp", [-1, 1, 16, 1]], ["tile_rc", "sp", [-1, 1]], ["tile_ry", "sp", [-1, 7]], ["tile_rx", "sp", [-1, 7]], ["auto_unroll_max_step", "ot", 1500], ["unroll_explicit", "ot", 1]]}], "r": [[0.00030733453816793896, 0.0003073379045801527, 0.00030737582697201016, 0.00030739820610687025, 0.0003074063358778626, 0.0003074356730279898, 0.0003074381819338422, 0.00030745297328244276], 0, 33.10146903991699, 1576824461.884993], "v": 0.1}
{"i": ["cuda -model=unknown", "topi_nn_conv2d", [["TENSOR", [8, 64, 55, 55], "float32"], ["TENSOR", [64, 64, 1, 1], "float32"], [1, 1], [0, 0], [1, 1], "NCHW", "float32"], {}, ["conv2d", [8, 64, 55, 55, "float32"], [64, 64, 1, 1, "float32"], [1, 1], [0, 0], [1, 1], "NCHW", "float32"], {"i": 806561, "t": "direct", "c": null, "e": [["tile_f", "sp", [-1, 1, 2, 16]], ["tile_y", "sp", [-1, 5, 1, 1]], ["tile_x", "sp", [-1, 1, 55, 1]], ["tile_rc", "sp", [-1, 4]], ["tile_ry", "sp", [-1, 1]], ["tile_rx", "sp", [-1, 1]], ["auto_unroll_max_step", "ot", 1500], ["unroll_explicit", "ot", 1]]}], "r": [[6.78321653543307e-05, 6.787292716535433e-05, 6.788733773903262e-05, 6.788773734533184e-05, 6.793188413948257e-05, 6.793262176602925e-05, 6.797271569178853e-05, 6.805220134983126e-05], 0, 22.674182891845703, 1576827200.4200606], "v": 0.1}
{"i": ["cuda -model=unknown", "topi_nn_conv2d", [["TENSOR", [8, 64, 55, 55], "float32"], ["TENSOR", [192, 64, 3, 3], "float32"], [1, 1], [1, 1], [1, 1], "NCHW", "float32"], {}, ["conv2d", [8, 64, 55, 55, "float32"], [192, 64, 3, 3, "float32"], [1, 1], [1, 1], [1, 1], "NCHW", "float32"], {"i": 6891645, "t": "winograd", "c": null, "e": [["tile_b", "sp", [-1, 1, 1, 1]], ["tile_y", "sp", [-1, 1, 16, 12]], ["tile_x", "sp", [-1, 4, 16, 1]], ["tile_rc", "sp", [-1, 8]], ["auto_unroll_max_step", "ot", 1500], ["unroll_explicit", "ot", 0]]}], "r": [[0.0010226980340136056, 0.001022724918367347, 0.0010227851020408163, 0.0010228845578231292, 0.0010228911836734694, 0.0010229907482993197, 0.0010231079387755101, 0.0010232581088435375], 0, 19.029752254486084, 1576829332.5715306], "v": 0.1}
{"i": ["cuda -model=unknown", "topi_nn_conv2d", [["TENSOR", [8, 192, 27, 27], "float32"], ["TENSOR", [64, 192, 1, 1], "float32"], [1, 1], [0, 0], [1, 1], "NCHW", "float32"], {}, ["conv2d", [8, 192, 27, 27, "float32"], [64, 192, 1, 1, "float32"], [1, 1], [0, 0], [1, 1], "NCHW", "float32"], {"i": 217619, "t": "direct", "c": null, "e": [["tile_f", "sp", [-1, 2, 4, 4]], ["tile_y", "sp", [-1, 1, 1, 3]], ["tile_x", "sp", [-1, 1, 27, 1]], ["tile_rc", "sp", [-1, 12]], ["tile_ry", "sp", [-1, 1]], ["tile_rx", "sp", [-1, 1]], ["auto_unroll_max_step", "ot", 0], ["unroll_explicit", "ot", 0]]}], "r": [[4.001685978968453e-05, 4.0071667334334835e-05, 4.007774528459356e-05, 4.0092172926055746e-05, 4.0093929894842263e-05, 4.013285661826073e-05, 4.014207043899182e-05, 4.0145122183274914e-05], 0, 25.227763175964355, 1576832167.0248039], "v": 0.1}
{"i": ["cuda -model=unknown", "topi_nn_conv2d", [["TENSOR", [8, 256, 27, 27], "float32"], ["TENSOR", [128, 256, 1, 1], "float32"], [1, 1], [0, 0], [1, 1], "NCHW", "float32"], {}, ["conv2d", [8, 256, 27, 27, "float32"], [128, 256, 1, 1, "float32"], [1, 1], [0, 0], [1, 1], "NCHW", "float32"], {"i": 118877, "t": "direct", "c": null, "e": [["tile_f", "sp", [-1, 4, 4, 4]], ["tile_y", "sp", [-1, 1, 1, 3]], ["tile_x", "sp", [-1, 1, 27, 1]], ["tile_rc", "sp", [-1, 4]], ["tile_ry", "sp", [-1, 1]], ["tile_rx", "sp", [-1, 1]], ["auto_unroll_max_step", "ot", 0], ["unroll_explicit", "ot", 0]]}], "r": [[8.785704389173372e-05, 8.786901499634235e-05, 8.789710716898318e-05, 8.790709619604974e-05, 8.791735918068764e-05, 8.794251389904901e-05, 8.797938844184345e-05, 8.800640197512801e-05], 0, 9.381085872650146, 1576834192.9369361], "v": 0.1}
{"i": ["cuda -model=unknown", "topi_nn_conv2d", [["TENSOR", [8, 480, 13, 13], "float32"], ["TENSOR", [192, 480, 1, 1], "float32"], [1, 1], [0, 0], [1, 1], "NCHW", "float32"], {}, ["conv2d", [8, 480, 13, 13, "float32"], [192, 480, 1, 1, "float32"], [1, 1], [0, 0], [1, 1], "NCHW", "float32"], {"i": 304594, "t": "direct", "c": null, "e": [["tile_f", "sp", [-1, 4, 1, 4]], ["tile_y", "sp", [-1, 1, 13, 1]], ["tile_x", "sp", [-1, 1, 13, 1]], ["tile_rc", "sp", [-1, 12]], ["tile_ry", "sp", [-1, 1]], ["tile_rx", "sp", [-1, 1]], ["auto_unroll_max_step", "ot", 1500], ["unroll_explicit", "ot", 0]]}], "r": [[9.173245773038843e-05, 9.173974295506474e-05, 9.17429733434882e-05, 9.17605495049505e-05, 9.177041203351105e-05, 9.177745163747144e-05, 9.177926656511806e-05, 9.179311005331303e-05], 0, 5.688918590545654, 1576836397.580802], "v": 0.1}
{"i": ["cuda -model=unknown", "topi_nn_conv2d", [["TENSOR", [8, 512, 13, 13], "float32"], ["TENSOR", [160, 512, 1, 1], "float32"], [1, 1], [0, 0], [1, 1], "NCHW", "float32"], {}, ["conv2d", [8, 512, 13, 13, "float32"], [160, 512, 1, 1, "float32"], [1, 1], [0, 0], [1, 1], "NCHW", "float32"], {"i": 48848, "t": "direct", "c": null, "e": [["tile_f", "sp", [-1, 8, 2, 1]], ["tile_y", "sp", [-1, 1, 13, 1]], ["tile_x", "sp", [-1, 1, 13, 1]], ["tile_rc", "sp", [-1, 8]], ["tile_ry", "sp", [-1, 1]], ["tile_rx", "sp", [-1, 1]], ["auto_unroll_max_step", "ot", 512], ["unroll_explicit", "ot", 0]]}], "r": [[9.14001018939394e-05, 9.143408181818182e-05, 9.145326136363636e-05, 9.148157954545454e-05, 9.148242424242425e-05, 9.148724734848485e-05, 9.150972159090909e-05, 9.153656174242425e-05], 0, 23.182202339172363, 1576838047.4731932], "v": 0.1}
{"i": ["cuda -model=unknown", "topi_nn_conv2d", [["TENSOR", [8, 512, 13, 13], "float32"], ["TENSOR", [128, 512, 1, 1], "float32"], [1, 1], [0, 0], [1, 1], "NCHW", "float32"], {}, ["conv2d", [8, 512, 13, 13, "float32"], [128, 512, 1, 1, "float32"], [1, 1], [0, 0], [1, 1], "NCHW", "float32"], {"i": 103060, "t": "direct", "c": null, "e": [["tile_f", "sp", [-1, 1, 1, 16]], ["tile_y", "sp", [-1, 1, 13, 1]], ["tile_x", "sp", [-1, 1, 13, 1]], ["tile_rc", "sp", [-1, 8]], ["tile_ry", "sp", [-1, 1]], ["tile_rx", "sp", [-1, 1]], ["auto_unroll_max_step", "ot", 1500], ["unroll_explicit", "ot", 1]]}], "r": [[8.72032863832853e-05, 8.722055043227666e-05, 8.730244668587896e-05, 8.734266390489913e-05, 8.739008537463976e-05, 8.741799927953891e-05, 8.741864373198847e-05, 8.742518623919308e-05], 0, 12.529814720153809, 1576839999.386931], "v": 0.1}
{"i": ["cuda -model=unknown", "topi_nn_conv2d", [["TENSOR", [8, 512, 13, 13], "float32"], ["TENSOR", [112, 512, 1, 1], "float32"], [1, 1], [0, 0], [1, 1], "NCHW", "float32"], {}, ["conv2d", [8, 512, 13, 13, "float32"], [112, 512, 1, 1, "float32"], [1, 1], [0, 0], [1, 1], "NCHW", "float32"], {"i": 57420, "t": "direct", "c": null, "e": [["tile_f", "sp", [-1, 4, 4, 1]], ["tile_y", "sp", [-1, 1, 13, 1]], ["tile_x", "sp", [-1, 1, 13, 1]], ["tile_rc", "sp", [-1, 32]], ["tile_ry", "sp", [-1, 1]], ["tile_rx", "sp", [-1, 1]], ["auto_unroll_max_step", "ot", 1500], ["unroll_explicit", "ot", 0]]}], "r": [[7.452255759682225e-05, 7.457234756703078e-05, 7.459527706057598e-05, 7.46063242303873e-05, 7.461771151936444e-05, 7.46286454816286e-05, 7.465778053624627e-05, 7.466434409136048e-05], 0, 5.483954668045044, 1576841596.2983494], "v": 0.1}
{"i": ["cuda -model=unknown", "topi_nn_conv2d", [["TENSOR", [8, 528, 13, 13], "float32"], ["TENSOR", [256, 528, 1, 1], "float32"], [1, 1], [0, 0], [1, 1], "NCHW", "float32"], {}, ["conv2d", [8, 528, 13, 13, "float32"], [256, 528, 1, 1, "float32"], [1, 1], [0, 0], [1, 1], "NCHW", "float32"], {"i": 278711, "t": "direct", "c": null, "e": [["tile_f", "sp", [-1, 4, 8, 1]], ["tile_y", "sp", [-1, 13, 1, 1]], ["tile_x", "sp", [-1, 1, 13, 1]], ["tile_rc", "sp", [-1, 8]], ["tile_ry", "sp", [-1, 1]], ["tile_rx", "sp", [-1, 1]], ["auto_unroll_max_step", "ot", 1500], ["unroll_explicit", "ot", 1]]}], "r": [[0.00010958628086838534, 0.0001095920474898236, 0.00010959356942559928, 0.0001095936684758028, 0.00010960399412030755, 0.00010960700814111262, 0.0001096251619176843, 0.0001096277657168702], 0, 20.835674047470093, 1576842874.511465], "v": 0.1}
{"i": ["cuda -model=unknown", "topi_nn_conv2d", [["TENSOR", [8, 832, 6, 6], "float32"], ["TENSOR", [256, 832, 1, 1], "float32"], [1, 1], [0, 0], [1, 1], "NCHW", "float32"], {}, ["conv2d", [8, 832, 6, 6, "float32"], [256, 832, 1, 1, "float32"], [1, 1], [0, 0], [1, 1], "NCHW", "float32"], {"i": 2640892, "t": "direct", "c": null, "e": [["tile_f", "sp", [-1, 2, 8, 2]], ["tile_y", "sp", [-1, 3, 2, 1]], ["tile_x", "sp", [-1, 1, 6, 1]], ["tile_rc", "sp", [-1, 26]], ["tile_ry", "sp", [-1, 1]], ["tile_rx", "sp", [-1, 1]], ["auto_unroll_max_step", "ot", 512], ["unroll_explicit", "ot", 1]]}], "r": [[4.8409501111335624e-05, 4.8412622752071126e-05, 4.841356455849667e-05, 4.84140513234997e-05, 4.8414563750252577e-05, 4.842041099211962e-05, 4.842143907860174e-05, 4.842522994544352e-05], 0, 10.062116384506226, 1576845756.494758], "v": 0.1}
{"i": ["cuda -model=unknown", "topi_nn_conv2d", [["TENSOR", [8, 832, 6, 6], "float32"], ["TENSOR", [384, 832, 1, 1], "float32"], [1, 1], [0, 0], [1, 1], "NCHW", "float32"], {}, ["conv2d", [8, 832, 6, 6, "float32"], [384, 832, 1, 1, "float32"], [1, 1], [0, 0], [1, 1], "NCHW", "float32"], {"i": 7682558, "t": "direct", "c": null, "e": [["tile_f", "sp", [-1, 2, 8, 2]], ["tile_y", "sp", [-1, 3, 2, 1]], ["tile_x", "sp", [-1, 1, 6, 1]], ["tile_rc", "sp", [-1, 26]], ["tile_ry", "sp", [-1, 1]], ["tile_rx", "sp", [-1, 1]], ["auto_unroll_max_step", "ot", 512], ["unroll_explicit", "ot", 1]]}], "r": [[5.242571982378855e-05, 5.242598370044053e-05, 5.2429479735682815e-05, 5.242967907488986e-05, 5.243318370044053e-05, 5.243486255506608e-05, 5.243570572687225e-05, 5.2436403964757706e-05], 0, 22.61777925491333, 1576849004.920487], "v": 0.1}
{"i": ["cuda -model=unknown", "topi_nn_dense", [["TENSOR", [8, 1024], "float32"], ["TENSOR", [1000, 1024], "float32"], null, "float32"], {}, ["dense", [8, 1024, "float32"], [1000, 1024, "float32"], 0, "float32"], {"i": 5, "t": "direct", "c": null, "e": [["tile_k", "sp", [-1, 32]]]}], "r": [[0.00011927509516765285, 0.00011928051824457594, 0.00011929313609467455, 0.00011933328599605523, 0.0001193363634122288, 0.00011933844822485208, 0.00011935093047337279, 0.00011935560009861933], 0, 6.611274242401123, 1576850318.4195879], "v": 0.1}
