mytophub/20191227/googlenet_bs_128.log
{"i": ["cuda -model=unknown", "topi_nn_conv2d", [["TENSOR", [128, 832, 6, 6], "float32"], ["TENSOR", [48, 832, 1, 1], "float32"], [1, 1], [0, 0], [1, 1], "NCHW", "float32"], {}, ["conv2d", [128, 832, 6, 6, "float32"], [48, 832, 1, 1, "float32"], [1, 1], [0, 0], [1, 1], "NCHW", "float32"], {"i": 1703135, "t": "direct", "c": null, "e": [["tile_f", "sp", [-1, 3, 8, 1]], ["tile_y", "sp", [-1, 3, 2, 1]], ["tile_x", "sp", [-1, 1, 6, 1]], ["tile_rc", "sp", [-1, 16]], ["tile_ry", "sp", [-1, 1]], ["tile_rx", "sp", [-1, 1]], ["auto_unroll_max_step", "ot", 0], ["unroll_explicit", "ot", 1]]}], "r": [[9.414243270735524e-05, 9.414757981220657e-05, 9.415778873239437e-05, 9.41648024256651e-05, 9.416929460093897e-05, 9.418711893583725e-05, 9.418773004694835e-05, 9.419782981220657e-05], 0, 11.36632752418518, 1576641645.368903], "v": 0.1}
{"i": ["cuda -model=unknown", "topi_nn_conv2d", [["TENSOR", [128, 48, 6, 6], "float32"], ["TENSOR", [128, 48, 3, 3], "float32"], [1, 1], [1, 1], [1, 1], "NCHW", "float32"], {}, ["conv2d", [128, 48, 6, 6, "float32"], [128, 48, 3, 3, "float32"], [1, 1], [1, 1], [1, 1], "NCHW", "float32"], {"i": 2811504, "t": "direct", "c": null, "e": [["tile_f", "sp", [-1, 8, 8, 1]], ["tile_y", "sp", [-1, 3, 2, 1]], ["tile_x", "sp", [-1, 1, 6, 1]], ["tile_rc", "sp", [-1, 2]], ["tile_ry", "sp", [-1, 3]], ["tile_rx", "sp", [-1, 1]], ["auto_unroll_max_step", "ot", 1500], ["unroll_explicit", "ot", 0]]}], "r": [[8.560384410646389e-05, 8.561046049852134e-05, 8.561159864807774e-05, 8.561593536121673e-05, 8.564340557667934e-05, 8.567257963667088e-05, 8.567941191381496e-05, 8.648179171947613e-05], 0, 3.6625823974609375, 1576642770.4206457], "v": 0.1}
{"i": ["cuda -model=unknown", "topi_nn_conv2d", [["TENSOR", [128, 832, 6, 6], "float32"], ["TENSOR", [192, 832, 1, 1], "float32"], [1, 1], [0, 0], [1, 1], "NCHW", "float32"], {}, ["conv2d", [128, 832, 6, 6, "float32"], [192, 832, 1, 1, "float32"], [1, 1], [0, 0], [1, 1], "NCHW", "float32"], {"i": 5291830, "t": "direct", "c": null, "e": [["tile_f", "sp", [-1, 2, 8, 3]], ["tile_y", "sp", [-1, 3, 2, 1]], ["tile_x", "sp", [-1, 1, 6, 1]], ["tile_rc", "sp", [-1, 16]], ["tile_ry", "sp", [-1, 1]], ["tile_rx", "sp", [-1, 1]], ["auto_unroll_max_step", "ot", 512], ["unroll_explicit", "ot", 1]]}], "r": [[0.00026052102512562814, 0.000260538824120603, 0.0002605474233668342, 0.00026056059422110555, 0.0002605753103015075, 0.0002605918417085427, 0.0002606795753768844, 0.000260979243718593], 0, 3.362653970718384, 1576643599.2554913], "v": 0.1}
{"i": ["cuda -model=unknown", "topi_nn_conv2d", [["TENSOR", [128, 192, 6, 6], "float32"], ["TENSOR", [384, 192, 3, 3], "float32"], [1, 1], [1, 1], [1, 1], "NCHW", "float32"], {}, ["conv2d", [128, 192, 6, 6, "float32"], [384, 192, 3, 3, "float32"], [1, 1], [1, 1], [1, 1], "NCHW", "float32"], {"i": 35199283, "t": "winograd", "c": null, "e": [["tile_b", "sp", [-1, 1, 1, 1]], ["tile_y", "sp", [-1, 1, 4, 16]], ["tile_x", "sp", [-1, 4, 16, 1]], ["tile_rc", "sp", [-1, 8]], ["auto_unroll_max_step", "ot", 128], ["unroll_explicit", "ot", 1]]}], "r": [[0.0007136280995260664, 0.0007137174597156398, 0.000713894952606635, 0.0007139448056872038, 0.0007139549478672986, 0.0007141290426540284, 0.0007142780758293838, 0.0007143550853080568], 0, 8.402772903442383, 1576645948.4413767], "v": 0.1}
{"i": ["cuda -model=unknown", "topi_nn_conv2d", [["TENSOR", [128, 832, 6, 6], "float32"], ["TENSOR", [128, 832, 1, 1], "float32"], [1, 1], [0, 0], [1, 1], "NCHW", "float32"], {}, ["conv2d", [128, 832, 6, 6, "float32"], [128, 832, 1, 1, "float32"], [1, 1], [0, 0], [1, 1], "NCHW", "float32"], {"i": 2295059, "t": "direct", "c": null, "e": [["tile_f", "sp", [-1, 2, 16, 2]], ["tile_y", "sp", [-1, 3, 2, 1]], ["tile_x", "sp", [-1, 1, 3, 2]], ["tile_rc", "sp", [-1, 13]], ["tile_ry", "sp", [-1, 1]], ["tile_rx", "sp", [-1, 1]], ["auto_unroll_max_step", "ot", 1500], ["unroll_explicit", "ot", 1]]}], "r": [[0.00018158671331828442, 0.00018163695334838225, 0.00018165204815650865, 0.00018168784198645596, 0.00018168945372460497, 0.0001817893107599699, 0.00018210856207674943, 0.00019083332505643338], 0, 13.534591436386108, 1576648068.0289862], "v": 0.1}
{"i": ["cuda -model=unknown", "topi_nn_conv2d", [["TENSOR", [128, 832, 6, 6], "float32"], ["TENSOR", [32, 832, 1, 1], "float32"], [1, 1], [0, 0], [1, 1], "NCHW", "float32"], {}, ["conv2d", [128, 832, 6, 6, "float32"], [32, 832, 1, 1, "float32"], [1, 1], [0, 0], [1, 1], "NCHW", "float32"], {"i": 277329, "t": "direct", "c": null, "e": [["tile_f", "sp", [-1, 4, 8, 1]], ["tile_y", "sp", [-1, 1, 6, 1]], ["tile_x", "sp", [-1, 3, 2, 1]], ["tile_rc", "sp", [-1, 16]], ["tile_ry", "sp", [-1, 1]], ["tile_rx", "sp", [-1, 1]], ["auto_unroll_max_step", "ot", 512], ["unroll_explicit", "ot", 0]]}], "r": [[9.022891915375897e-05, 9.023330562901397e-05, 9.023633925198338e-05, 9.023845863241406e-05, 9.023943520967132e-05, 9.025503853418964e-05, 9.026402493388742e-05, 9.026655836796374e-05], 0, 5.847636699676514, 1576648897.5895598], "v": 0.1}
{"i": ["cuda -model=unknown", "topi_nn_conv2d", [["TENSOR", [128, 32, 6, 6], "float32"], ["TENSOR", [128, 32, 3, 3], "float32"], [1, 1], [1, 1], [1, 1], "NCHW", "float32"], {}, ["conv2d", [128, 32, 6, 6, "float32"], [128, 32, 3, 3, "float32"], [1, 1], [1, 1], [1, 1], "NCHW", "float32"], {"i": 968304, "t": "direct", "c": null, "e": [["tile_f", "sp", [-1, 8, 8, 1]], ["tile_y", "sp", [-1, 3, 2, 1]], ["tile_x", "sp", [-1, 1, 6, 1]], ["tile_rc", "sp", [-1, 2]], ["tile_ry", "sp", [-1, 3]], ["tile_rx", "sp", [-1, 1]], ["auto_unroll_max_step", "ot", 512], ["unroll_explicit", "ot", 0]]}], "r": [[5.836684412121212e-05, 5.8371409696969696e-05, 5.837591927272727e-05, 5.837989284848485e-05, 5.838384606060606e-05, 5.838589866666667e-05, 5.838873915151515e-05, 5.8389665696969695e-05], 0, 4.282909393310547, 1576650022.5593994], "v": 0.1}
{"i": ["cuda -model=unknown", "topi_nn_conv2d", [["TENSOR", [128, 832, 6, 6], "float32"], ["TENSOR", [160, 832, 1, 1], "float32"], [1, 1], [0, 0], [1, 1], "NCHW", "float32"], {}, ["conv2d", [128, 832, 6, 6, "float32"], [160, 832, 1, 1, "float32"], [1, 1], [0, 0], [1, 1], "NCHW", "float32"], {"i": 2714364, "t": "direct", "c": null, "e": [["tile_f", "sp", [-1, 1, 16, 5]], ["tile_y", "sp", [-1, 3, 2, 1]], ["tile_x", "sp", [-1, 3, 2, 1]], ["tile_rc", "sp", [-1, 16]], ["tile_ry", "sp", [-1, 1]], ["tile_rx", "sp", [-1, 1]], ["auto_unroll_max_step", "ot", 0], ["unroll_explicit", "ot", 1]]}], "r": [[0.0002370607840909091, 0.00023707892159090908, 0.000237108625, 0.000237108625, 0.00023717058522727274, 0.00023717639886363637, 0.00023720313863636363, 0.00023722522727272728], 0, 3.49458646774292, 1576651285.996218], "v": 0.1}
{"i": ["cuda -model=unknown", "topi_nn_conv2d", [["TENSOR", [128, 160, 6, 6], "float32"], ["TENSOR", [320, 160, 3, 3], "float32"], [1, 1], [1, 1], [1, 1], "NCHW", "float32"], {}, ["conv2d", [128, 160, 6, 6, "float32"], [320, 160, 3, 3, "float32"], [1, 1], [1, 1], [1, 1], "NCHW", "float32"], {"i": 12140193, "t": "winograd", "c": null, "e": [["tile_b", "sp", [-1, 1, 1, 1]], ["tile_y", "sp", [-1, 2, 8, 4]], ["tile_x", "sp", [-1, 4, 16, 1]], ["tile_rc", "sp", [-1, 16]], ["auto_unroll_max_step", "ot", 1500], ["unroll_explicit", "ot", 0]]}], "r": [[0.0005450068243243243, 0.0005450346418918919, 0.0005452184346846847, 0.0005452609774774774, 0.0005452780653153153, 0.0005454003828828829, 0.0005454019481981982, 0.0005454980653153154], 0, 21.583755016326904, 1576653068.7915657], "v": 0.1}
{"i": ["cuda -model=unknown", "topi_nn_conv2d", [["TENSOR", [128, 528, 13, 13], "float32"], ["TENSOR", [128, 528, 1, 1], "float32"], [1, 1], [0, 0], [1, 1], "NCHW", "float32"], {}, ["conv2d", [128, 528, 13, 13, "float32"], [128, 528, 1, 1, "float32"], [1, 1], [0, 0], [1, 1], "NCHW", "float32"], {"i": 126144, "t": "direct", "c": null, "e": [["tile_f", "sp", [-1, 8, 8, 1]], ["tile_y", "sp", [-1, 1, 1, 13]], ["tile_x", "sp", [-1, 1, 13, 1]], ["tile_rc", "sp", [-1, 8]], ["tile_ry", "sp", [-1, 1]], ["tile_rx", "sp", [-1, 1]], ["auto_unroll_max_step", "ot", 0], ["unroll_explicit", "ot", 1]]}], "r": [[0.0005457076701298701, 0.0005457388701298701, 0.0005461421220779221, 0.0005462140727272727, 0.0005463849090909091, 0.000546934638961039, 0.0005470284, 0.0005481839792207792], 0, 3.321664571762085, 1576654798.02165], "v": 0.1}
{"i": ["cuda -model=unknown", "topi_nn_conv2d", [["TENSOR", [128, 528, 13, 13], "float32"], ["TENSOR", [32, 528, 1, 1], "float32"], [1, 1], [0, 0], [1, 1], "NCHW", "float32"], {}, ["conv2d", [128, 528, 13, 13, "float32"], [32, 528, 1, 1, "float32"], [1, 1], [0, 0], [1, 1], "NCHW", "float32"], {"i": 76698, "t": "direct", "c": null, "e": [["tile_f", "sp", [-1, 2, 8, 2]], ["tile_y", "sp", [-1, 13, 1, 1]], ["tile_x", "sp", [-1, 1, 13, 1]], ["tile_rc", "sp", [-1, 8]], ["tile_ry", "sp", [-1, 1]], ["tile_rx", "sp", [-1, 1]], ["auto_unroll_max_step", "ot", 512], ["unroll_explicit", "ot", 1]]}], "r": [[0.00022334353604436228, 0.00022336134658040664, 0.00022338873567467652, 0.00022342073844731978, 0.00022344245471349355, 0.00022347254898336414, 0.00022347699168207024, 0.0002234854879852126], 0, 15.19875979423523, 1576655893.154385], "v": 0.1}
{"i": ["cuda -model=unknown", "topi_nn_conv2d", [["TENSOR", [128, 32, 13, 13], "float32"], ["TENSOR", [128, 32, 3, 3], "float32"], [1, 1], [1, 1], [1, 1], "NCHW", "float32"], {}, ["conv2d", [128, 32, 13, 13, "float32"], [128, 32, 3, 3, "float32"], [1, 1], [1, 1], [1, 1], "NCHW", "float32"], {"i": 268261, "t": "direct", "c": null, "e": [["tile_f", "sp", [-1, 1, 32, 2]], ["tile_y", "sp", [-1, 1, 1, 13]], ["tile_x", "sp", [-1, 1, 13, 1]], ["tile_rc", "sp", [-1, 2]], ["tile_ry", "sp", [-1, 3]], ["tile_rx", "sp", [-1, 3]], ["auto_unroll_max_step", "ot", 1500], ["unroll_explicit", "ot", 1]]}], "r": [[0.0002892214287439614, 0.000289658943236715, 0.000289740056763285, 0.0002897526038647343, 0.00029006960507246376, 0.00029016198309178744, 0.00029093150966183576, 0.0002910937173913044], 0, 9.092592716217041, 1576657048.664302], "v": 0.1}
{"i": ["cuda -model=unknown", "topi_nn_conv2d", [["TENSOR", [128, 528, 13, 13], "float32"], ["TENSOR", [160, 528, 1, 1], "float32"], [1, 1], [0, 0], [1, 1], "NCHW", "float32"], {}, ["conv2d", [128, 528, 13, 13, "float32"], [160, 528, 1, 1, "float32"], [1, 1], [0, 0], [1, 1], "NCHW", "float32"], {"i": 378489, "t": "direct", "c": null, "e": [["tile_f", "sp", [-1, 1, 8, 5]], ["tile_y", "sp", [-1, 13, 1, 1]], ["tile_x", "sp", [-1, 1, 13, 1]], ["tile_rc", "sp", [-1, 8]], ["tile_ry", "sp", [-1, 1]], ["tile_rx", "sp", [-1, 1]], ["auto_unroll_max_step", "ot", 1500], ["unroll_explicit", "ot", 1]]}], "r": [[0.0006821466, 0.000682181275409836, 0.0006825004885245902, 0.0006827215114754098, 0.0006828082426229508, 0.0006828556098360656, 0.0006828692557377049, 0.0006829003704918033], 0, 4.3329198360443115, 1576658596.0250041], "v": 0.1}
{"i": ["cuda -model=unknown", "topi_nn_conv2d", [["TENSOR", [128, 160, 13, 13], "float32"], ["TENSOR", [320, 160, 3, 3], "float32"], [1, 1], [1, 1], [1, 1], "NCHW", "float32"], {}, ["conv2d", [128, 160, 13, 13, "float32"], [320, 160, 3, 3, "float32"], [1, 1], [1, 1], [1, 1], "NCHW", "float32"], {"i": 21003661, "t": "winograd", "c": null, "e": [["tile_b", "sp", [-1, 1, 1, 1]], ["tile_y", "sp", [-1, 1, 8, 20]], ["tile_x", "sp", [-1, 4, 16, 1]], ["tile_rc", "sp", [-1, 8]], ["auto_unroll_max_step", "ot", 128], ["unroll_explicit", "ot", 1]]}], "r": [[0.00252273503125, 0.002522742953125, 0.0025228519375, 0.002523314484375, 0.002524537625, 0.00252726425, 0.00252736603125, 0.002529432234375], 0, 10.339646339416504, 1576660926.575969], "v": 0.1}
{"i": ["cuda -model=unknown", "topi_nn_conv2d", [["TENSOR", [128, 512, 13, 13], "float32"], ["TENSOR", [32, 512, 1, 1], "float32"], [1, 1], [0, 0], [1, 1], "NCHW", "float32"], {}, ["conv2d", [128, 512, 13, 13, "float32"], [32, 512, 1, 1, "float32"], [1, 1], [0, 0], [1, 1], "NCHW", "float32"], {"i": 48138, "t": "direct", "c": null, "e": [["tile_f", "sp", [-1, 2, 8, 2]], ["tile_y", "sp", [-1, 1, 1, 13]], ["tile_x", "sp", [-1, 1, 13, 1]], ["tile_rc", "sp", [-1, 8]], ["tile_ry", "sp", [-1, 1]], ["tile_rx", "sp", [-1, 1]], ["auto_unroll_max_step", "ot", 1500], ["unroll_explicit", "ot", 1]]}], "r": [[0.00021586581752873563, 0.0002158756925287356, 0.00021591505890804598, 0.00021593417959770114, 0.00021594796264367815, 0.00021600516379310345, 0.0002160475761494253, 0.0002160517471264368], 0, 13.748239755630493, 1576662808.1941159], "v": 0.1}
{"i": ["cuda -model=unknown", "topi_nn_conv2d", [["TENSOR", [128, 32, 13, 13], "float32"], ["TENSOR", [64, 32, 3, 3], "float32"], [1, 1], [1, 1], [1, 1], "NCHW", "float32"], {}, ["conv2d", [128, 32, 13, 13, "float32"], [64, 32, 3, 3, "float32"], [1, 1], [1, 1], [1, 1], "NCHW", "float32"], {"i": 58739, "t": "direct", "c": null, "e": [["tile_f", "sp", [-1, 2, 16, 1]], ["tile_y", "sp", [-1, 1, 1, 13]], ["tile_x", "sp", [-1, 1, 13, 1]], ["tile_rc", "sp", [-1, 2]], ["tile_ry", "sp", [-1, 3]], ["tile_rx", "sp", [-1, 3]], ["auto_unroll_max_step", "ot", 512], ["unroll_explicit", "ot", 0]]}], "r": [[0.00015617002005174644, 0.00015617126261319533, 0.00015617982212160413, 0.00015619494372574386, 0.00015619776196636482, 0.00015620872509702457, 0.00015622347736093145, 0.00015622579107373868], 0, 19.213542938232422, 1576663709.6046305], "v": 0.1}
{"i": ["cuda -model=unknown", "topi_nn_conv2d", [["TENSOR", [128, 512, 13, 13], "float32"], ["TENSOR", [144, 512, 1, 1], "float32"], [1, 1], [0, 0], [1, 1], "NCHW", "float32"], {}, ["conv2d", [128, 512, 13, 13, "float32"], [144, 512, 1, 1, "float32"], [1, 1], [0, 0], [1, 1], "NCHW", "float32"], {"i": 76241, "t": "direct", "c": null, "e": [["tile_f", "sp", [-1, 1, 8, 9]], ["tile_y", "sp", [-1, 13, 1, 1]], ["tile_x", "sp", [-1, 1, 13, 1]], ["tile_rc", "sp", [-1, 8]], ["tile_ry", "sp", [-1, 1]], ["tile_rx", "sp", [-1, 1]], ["auto_unroll_max_step", "ot", 512], ["unroll_explicit", "ot", 0]]}], "r": [[0.0005715035106382978, 0.0005718280472813238, 0.0005718607115839244, 0.0005718647777777778, 0.000571996196217494, 0.0005721036572104019, 0.000572131560283688, 0.0005724411938534279], 0, 23.129348516464233, 1576664651.48936], "v": 0.1}
{"i": ["cuda -model=unknown", "topi_nn_conv2d", [["TENSOR", [128, 144, 13, 13], "float32"], ["TENSOR", [288, 144, 3, 3], "float32"], [1, 1], [1, 1], [1, 1], "NCHW", "float32"], {}, ["conv2d", [128, 144, 13, 13, "float32"], [288, 144, 3, 3, "float32"], [1, 1], [1, 1], [1, 1], "NCHW", "float32"], {"i": 43741974, "t": "winograd", "c": null, "e": [["tile_b", "sp", [-1, 1, 1, 1]], ["tile_y", "sp", [-1, 3, 8, 6]], ["tile_x", "sp", [-1, 4, 16, 1]], ["tile_rc", "sp", [-1, 8]], ["auto_unroll_max_step", "ot", 128], ["unroll_explicit", "ot", 1]]}], "r": [[0.0022225095882352944, 0.002222817338235294, 0.0022230261470588234, 0.00222329675, 0.002223910926470588, 0.0022240909264705884, 0.0022247222352941177, 0.0022261092647058826], 0, 19.14600896835327, 1576666258.314164], "v": 0.1}
{"i": ["cuda -model=unknown", "topi_nn_conv2d", [["TENSOR", [128, 128, 13, 13], "float32"], ["TENSOR", [256, 128, 3, 3], "float32"], [1, 1], [1, 1], [1, 1], "NCHW", "float32"], {}, ["conv2d", [128, 128, 13, 13, "float32"], [256, 128, 3, 3, "float32"], [1, 1], [1, 1], [1, 1], "NCHW", "float32"], {"i": 7344255, "t": "winograd", "c": null, "e": [["tile_b", "sp", [-1, 1, 1, 1]], ["tile_y", "sp", [-1, 4, 16, 4]], ["tile_x", "sp", [-1, 4, 16, 1]], ["tile_rc", "sp", [-1, 32]], ["auto_unroll_max_step", "ot", 128], ["unroll_explicit", "ot", 1]]}], "r": [[0.001820834168674699, 0.0018208852891566263, 0.001821162421686747, 0.0018213588915662652, 0.001821443048192771, 0.001821874638554217, 0.00182220578313253, 0.0018226343493975901], 0, 5.600924491882324, 1576669386.3489444], "v": 0.1}
{"i": ["cuda -model=unknown", "topi_nn_conv2d", [["TENSOR", [128, 512, 13, 13], "float32"], ["TENSOR", [64, 512, 1, 1], "float32"], [1, 1], [0, 0], [1, 1], "NCHW", "float32"], {}, ["conv2d", [128, 512, 13, 13, "float32"], [64, 512, 1, 1, "float32"], [1, 1], [0, 0], [1, 1], "NCHW", "float32"], {"i": 18440, "t": "direct", "c": null, "e": [["tile_f", "sp", [-1, 2, 8, 2]], ["tile_y", "sp", [-1, 1, 1, 13]], ["tile_x", "sp", [-1, 1, 13, 1]], ["tile_rc", "sp", [-1, 8]], ["tile_ry", "sp", [-1, 1]], ["tile_rx", "sp", [-1, 1]], ["auto_unroll_max_step", "ot", 512], ["unroll_explicit", "ot", 0]]}], "r": [[0.000307017937896071, 0.00030705530544993665, 0.00030721769835234474, 0.00030724291254752853, 0.0003075390659062104, 0.0003075889607097592, 0.00030766859442332066, 0.00030817903675538655], 0, 9.87500810623169, 1576670650.211144], "v": 0.1}
{"i": ["cuda -model=unknown", "topi_nn_conv2d", [["TENSOR", [128, 512, 13, 13], "float32"], ["TENSOR", [24, 512, 1, 1], "float32"], [1, 1], [0, 0], [1, 1], "NCHW", "float32"], {}, ["conv2d", [128, 512, 13, 13, "float32"], [24, 512, 1, 1, "float32"], [1, 1], [0, 0], [1, 1], "NCHW", "float32"], {"i": 43017, "t": "direct", "c": null, "e": [["tile_f", "sp", [-1, 1, 8, 3]], ["tile_y", "sp", [-1, 13, 1, 1]], ["tile_x", "sp", [-1, 1, 13, 1]], ["tile_rc", "sp", [-1, 8]], ["tile_ry", "sp", [-1, 1]], ["tile_rx", "sp", [-1, 1]], ["auto_unroll_max_step", "ot", 0], ["unroll_explicit", "ot", 1]]}], "r": [[0.00020714481849315068, 0.00020717735616438356, 0.00020718089726027398, 0.00020722491181506848, 0.0002072857551369863, 0.0002073213433219178, 0.00020734166267123288, 0.0002073525214041096], 0, 11.150813102722168, 1576671684.5979896], "v": 0.1}
{"i": ["cuda -model=unknown", "topi_nn_conv2d", [["TENSOR", [128, 24, 13, 13], "float32"], ["TENSOR", [64, 24, 3, 3], "float32"], [1, 1], [1, 1], [1, 1], "NCHW", "float32"], {}, ["conv2d", [128, 24, 13, 13, "float32"], [64, 24, 3, 3, "float32"], [1, 1], [1, 1], [1, 1], "NCHW", "float32"], {"i": 120563, "t": "direct", "c": null, "e": [["tile_f", "sp", [-1, 2, 16, 1]], ["tile_y", "sp", [-1, 1, 1, 13]], ["tile_x", "sp", [-1, 1, 13, 1]], ["tile_rc", "sp", [-1, 2]], ["tile_ry", "sp", [-1, 3]], ["tile_rx", "sp", [-1, 3]], ["auto_unroll_max_step", "ot", 1500], ["unroll_explicit", "ot", 0]]}], "r": [[0.0001220739602446483, 0.00012207935321100917, 0.00012209064016309887, 0.00012211170030581038, 0.00012214844291539244, 0.00012215220336391438, 0.00012216019011213047, 0.00012217512232415902], 0, 9.186487674713135, 1576672323.1030319], "v": 0.1}
{"i": ["cuda -model=unknown", "topi_nn_conv2d", [["TENSOR", [128, 112, 13, 13], "float32"], ["TENSOR", [224, 112, 3, 3], "float32"], [1, 1], [1, 1], [1, 1], "NCHW", "float32"], {}, ["conv2d", [128, 112, 13, 13, "float32"], [224, 112, 3, 3, "float32"], [1, 1], [1, 1], [1, 1], "NCHW", "float32"], {"i": 11852031, "t": "winograd", "c": null, "e": [["tile_b", "sp", [-1, 1, 1, 1]], ["tile_y", "sp", [-1, 1, 16, 14]], ["tile_x", "sp", [-1, 4, 16, 1]], ["tile_rc", "sp", [-1, 8]], ["auto_unroll_max_step", "ot", 128], ["unroll_explicit", "ot", 1]]}], "r": [[0.0015209842121212123, 0.001521136404040404, 0.0015211704141414142, 0.0015212554545454547, 0.0015213927070707072, 0.0015215826868686868, 0.001521854393939394, 0.001522107575757576], 0, 11.056539058685303, 1576673669.77387], "v": 0.1}
{"i": ["cuda -model=unknown", "topi_nn_conv2d", [["TENSOR", [128, 480, 13, 13], "float32"], ["TENSOR", [64, 480, 1, 1], "float32"], [1, 1], [0, 0], [1, 1], "NCHW", "float32"], {}, ["conv2d", [128, 480, 13, 13, "float32"], [64, 480, 1, 1, "float32"], [1, 1], [0, 0], [1, 1], "NCHW", "float32"], {"i": 170312, "t": "direct", "c": null, "e": [["tile_f", "sp", [-1, 2, 8, 2]], ["tile_y", "sp", [-1, 1, 1, 13]], ["tile_x", "sp", [-1, 1, 13, 1]], ["tile_rc", "sp", [-1, 8]], ["tile_ry", "sp", [-1, 1]], ["tile_rx", "sp", [-1, 1]], ["auto_unroll_max_step", "ot", 1500], ["unroll_explicit", "ot", 1]]}], "r": [[0.0002885824518072289, 0.0002885936048192771, 0.00028867344457831327, 0.0002887954313253012, 0.00028913979277108435, 0.0002892170060240964, 0.00028926000481927714, 0.00028937418554216866], 0, 6.006484270095825, 1576675144.0660243], "v": 0.1}
{"i": ["cuda -model=unknown", "topi_nn_conv2d", [["TENSOR", [128, 480, 13, 13], "float32"], ["TENSOR", [16, 480, 1, 1], "float32"], [1, 1], [0, 0], [1, 1], "NCHW", "float32"], {}, ["conv2d", [128, 480, 13, 13, "float32"], [16, 480, 1, 1, "float32"], [1, 1], [0, 0], [1, 1], "NCHW", "float32"], {"i": 30048, "t": "direct", "c": null, "e": [["tile_f", "sp", [-1, 8, 1, 2]], ["tile_y", "sp", [-1, 1, 13, 1]], ["tile_x", "sp", [-1, 1, 13, 1]], ["tile_rc", "sp", [-1, 6]], ["tile_ry", "sp", [-1, 1]], ["tile_rx", "sp", [-1, 1]], ["auto_unroll_max_step", "ot", 1500], ["unroll_explicit", "ot", 0]]}], "r": [[0.00018403887784522005, 0.0001840406206373293, 0.00018405442564491654, 0.0001841029817905918, 0.00018411417450682854, 0.0001841479559939302, 0.00018416668968133536, 0.0001841776335356601], 0, 7.809484958648682, 1576676207.859974], "v": 0.1}
{"i": ["cuda -model=unknown", "topi_nn_conv2d", [["TENSOR", [128, 16, 13, 13], "float32"], ["TENSOR", [48, 16, 3, 3], "float32"], [1, 1], [1, 1], [1, 1], "NCHW", "float32"], {}, ["conv2d", [128, 16, 13, 13, "float32"], [48, 16, 3, 3, "float32"], [1, 1], [1, 1], [1, 1], "NCHW", "float32"], {"i": 218858, "t": "direct", "c": null, "e": [["tile_f", "sp", [-1, 2, 12, 1]], ["tile_y", "sp", [-1, 1, 1, 13]], ["tile_x", "sp", [-1, 1, 13, 1]], ["tile_rc", "sp", [-1, 4]], ["tile_ry", "sp", [-1, 3]], ["tile_rx", "sp", [-1, 3]], ["auto_unroll_max_step", "ot", 512], ["unroll_explicit", "ot", 1]]}], "r": [[6.220134957020058e-05, 6.220876113571242e-05, 6.223074420421985e-05, 6.225355821828601e-05, 6.226953920291743e-05, 6.229328392810628e-05, 6.231214587132066e-05, 6.231608752279239e-05], 0, 10.218595743179321, 1576677130.5089278], "v": 0.1}
{"i": ["cuda -model=unknown", "topi_nn_conv2d", [["TENSOR", [128, 480, 13, 13], "float32"], ["TENSOR", [96, 480, 1, 1], "float32"], [1, 1], [0, 0], [1, 1], "NCHW", "float32"], {}, ["conv2d", [128, 480, 13, 13, "float32"], [96, 480, 1, 1, "float32"], [1, 1], [0, 0], [1, 1], "NCHW", "float32"], {"i": 199740, "t": "direct", "c": null, "e": [["tile_f", "sp", [-1, 1, 12, 4]], ["tile_y", "sp", [-1, 1, 1, 13]], ["tile_x", "sp", [-1, 1, 13, 1]], ["tile_rc", "sp", [-1, 10]], ["tile_ry", "sp", [-1, 1]], ["tile_rx", "sp", [-1, 1]], ["auto_unroll_max_step", "ot", 1500], ["unroll_explicit", "ot", 0]]}], "r": [[0.0004009209303482587, 0.00040095619071310113, 0.0004009905422885572, 0.00040099971144278606, 0.0004010354029850746, 0.0004010652520729685, 0.00040106827529021557, 0.0004010730912106136], 0, 9.079919576644897, 1576678224.0868692], "v": 0.1}
{"i": ["cuda -model=unknown", "topi_nn_conv2d", [["TENSOR", [128, 96, 13, 13], "float32"], ["TENSOR", [208, 96, 3, 3], "float32"], [1, 1], [1, 1], [1, 1], "NCHW", "float32"], {}, ["conv2d", [128, 96, 13, 13, "float32"], [208, 96, 3, 3, "float32"], [1, 1], [1, 1], [1, 1], "NCHW", "float32"], {"i": 8751527, "t": "winograd", "c": null, "e": [["tile_b", "sp", [-1, 1, 1, 1]], ["tile_y", "sp", [-1, 1, 4, 26]], ["tile_x", "sp", [-1, 4, 16, 1]], ["tile_rc", "sp", [-1, 6]], ["auto_unroll_max_step", "ot", 128], ["unroll_explicit", "ot", 1]]}], "r": [[0.0014872515940594058, 0.0014873641287128712, 0.001487612910891089, 0.0014879931188118813, 0.0014880917722772278, 0.0014881400198019801, 0.0014881493465346534, 0.0014881523663366337], 0, 6.05424952507019, 1576680115.2045038], "v": 0.1}
{"i": ["cuda -model=unknown", "topi_nn_conv2d", [["TENSOR", [128, 256, 27, 27], "float32"], ["TENSOR", [64, 256, 1, 1], "float32"], [1, 1], [0, 0], [1, 1], "NCHW", "float32"], {}, ["conv2d", [128, 256, 27, 27, "float32"], [64, 256, 1, 1, "float32"], [1, 1], [0, 0], [1, 1], "NCHW", "float32"], {"i": 1326402, "t": "direct", "c": null, "e": [["tile_f", "sp", [-1, 8, 4, 2]], ["tile_y", "sp", [-1, 1, 1, 3]], ["tile_x", "sp", [-1, 1, 27, 1]], ["tile_rc", "sp", [-1, 8]], ["tile_ry", "sp", [-1, 1]], ["tile_rx", "sp", [-1, 1]], ["auto_unroll_max_step", "ot", 512], ["unroll_explicit", "ot", 1]]}], "r": [[0.0006456513215339233, 0.0006457005663716814, 0.0006457217050147493, 0.0006457318908554573, 0.0006457451238938053, 0.0006457752507374631, 0.0006459324690265487, 0.0006462521799410029], 0, 3.6884663105010986, 1576681782.7315397], "v": 0.1}
{"i": ["cuda -model=unknown", "topi_nn_conv2d", [["TENSOR", [128, 256, 27, 27], "float32"], ["TENSOR", [32, 256, 1, 1], "float32"], [1, 1], [0, 0], [1, 1], "NCHW", "float32"], {}, ["conv2d", [128, 256, 27, 27, "float32"], [32, 256, 1, 1, "float32"], [1, 1], [0, 0], [1, 1], "NCHW", "float32"], {"i": 256623, "t": "direct", "c": null, "e": [["tile_f", "sp", [-1, 2, 4, 2]], ["tile_y", "sp", [-1, 9, 1, 1]], ["tile_x", "sp", [-1, 1, 27, 1]], ["tile_rc", "sp", [-1, 4]], ["tile_ry", "sp", [-1, 1]], ["tile_rx", "sp", [-1, 1]], ["auto_unroll_max_step", "ot", 512], ["unroll_explicit", "ot", 0]]}], "r": [[0.0004749884936708861, 0.0004750997658227848, 0.00047512810759493666, 0.0004751530031645569, 0.0004751586867088608, 0.0004752044272151899, 0.0004754846518987342, 0.00047552272784810127], 0, 7.050267457962036, 1576683159.5227172], "v": 0.1}
{"i": ["cuda -model=unknown", "topi_nn_conv2d", [["TENSOR", [128, 32, 27, 27], "float32"], ["TENSOR", [96, 32, 3, 3], "float32"], [1, 1], [1, 1], [1, 1], "NCHW", "float32"], {}, ["conv2d", [128, 32, 27, 27, "float32"], [96, 32, 3, 3, "float32"], [1, 1], [1, 1], [1, 1], "NCHW", "float32"], {"i": 3922299, "t": "direct", "c": null, "e": [["tile_f", "sp", [-1, 3, 32, 1]], ["tile_y", "sp", [-1, 1, 1, 3]], ["tile_x", "sp", [-1, 1, 9, 3]], ["tile_rc", "sp", [-1, 2]], ["tile_ry", "sp", [-1, 3]], ["tile_rx", "sp", [-1, 3]], ["auto_unroll_max_step", "ot", 512], ["unroll_explicit", "ot", 0]]}], "r": [[0.000841293943319838, 0.0008414142388663968, 0.0008414363927125506, 0.0008415425506072875, 0.0008416148340080971, 0.0008417208502024292, 0.0008418943562753036, 0.0008431424048582995], 0, 3.355844259262085, 1576684289.2549448], "v": 0.1}
{"i": ["cuda -model=unknown", "topi_nn_conv2d", [["TENSOR", [128, 128, 27, 27], "float32"], ["TENSOR", [192, 128, 3, 3], "float32"], [1, 1], [1, 1], [1, 1], "NCHW", "float32"], {}, ["conv2d", [128, 128, 27, 27, "float32"], [192, 128, 3, 3, "float32"], [1, 1], [1, 1], [1, 1], "NCHW", "float32"], {"i": 15571197, "t": "winograd", "c": null, "e": [["tile_b", "sp", [-1, 1, 1, 1]], ["tile_y", "sp", [-1, 1, 16, 12]], ["tile_x", "sp", [-1, 4, 16, 1]], ["tile_rc", "sp", [-1, 32]], ["auto_unroll_max_step", "ot", 1500], ["unroll_explicit", "ot", 0]]}], "r": [[0.0055540789, 0.005554156375, 0.00555470175, 0.0055563467, 0.0055570512750000006, 0.00555724535, 0.0055575853, 0.0055593213], 0, 3.4871420860290527, 1576687526.545558], "v": 0.1}
{"i": ["cuda -model=unknown", "topi_nn_conv2d", [["TENSOR", [128, 192, 27, 27], "float32"], ["TENSOR", [32, 192, 1, 1], "float32"], [1, 1], [0, 0], [1, 1], "NCHW", "float32"], {}, ["conv2d", [128, 192, 27, 27, "float32"], [32, 192, 1, 1, "float32"], [1, 1], [0, 0], [1, 1], "NCHW", "float32"], {"i": 458654, "t": "direct", "c": null, "e": [["tile_f", "sp", [-1, 8, 4, 1]], ["tile_y", "sp", [-1, 1, 1, 3]], ["tile_x", "sp", [-1, 1, 27, 1]], ["tile_rc", "sp", [-1, 12]], ["tile_ry", "sp", [-1, 1]], ["tile_rx", "sp", [-1, 1]], ["auto_unroll_max_step", "ot", 512], ["unroll_explicit", "ot", 0]]}], "r": [[0.00038362093564356435, 0.00038363210561056106, 0.00038365441419141916, 0.0003836904834983498, 0.0003837033069306931, 0.00038371881518151817, 0.00038373578712871286, 0.000383843397689769], 0, 3.559077024459839, 1576689479.953484], "v": 0.1}
{"i": ["cuda -model=unknown", "topi_nn_conv2d", [["TENSOR", [128, 192, 27, 27], "float32"], ["TENSOR", [16, 192, 1, 1], "float32"], [1, 1], [0, 0], [1, 1], "NCHW", "float32"], {}, ["conv2d", [128, 192, 27, 27, "float32"], [16, 192, 1, 1, "float32"], [1, 1], [0, 0], [1, 1], "NCHW", "float32"], {"i": 832393, "t": "direct", "c": null, "e": [["tile_f", "sp", [-1, 2, 4, 2]], ["tile_y", "sp", [-1, 9, 1, 1]], ["tile_x", "sp", [-1, 1, 27, 1]], ["tile_rc", "sp", [-1, 4]], ["tile_ry", "sp", [-1, 1]], ["tile_rx", "sp", [-1, 1]], ["auto_unroll_max_step", "ot", 512], ["unroll_explicit", "ot", 1]]}], "r": [[0.000331387385359116, 0.0003313975262430939, 0.00033140655939226517, 0.0003314348135359116, 0.00033147923895027626, 0.00033154735635359113, 0.0003315542237569061, 0.00033160316574585636], 0, 3.5736289024353027, 1576690879.9118745], "v": 0.1}
{"i": ["cuda -model=unknown", "topi_nn_conv2d", [["TENSOR", [128, 16, 27, 27], "float32"], ["TENSOR", [32, 16, 3, 3], "float32"], [1, 1], [1, 1], [1, 1], "NCHW", "float32"], {}, ["conv2d", [128, 16, 27, 27, "float32"], [32, 16, 3, 3, "float32"], [1, 1], [1, 1], [1, 1], "NCHW", "float32"], {"i": 2631027, "t": "direct", "c": null, "e": [["tile_f", "sp", [-1, 1, 16, 2]], ["tile_y", "sp", [-1, 9, 1, 1]], ["tile_x", "sp", [-1, 1, 27, 1]], ["tile_rc", "sp", [-1, 4]], ["tile_ry", "sp", [-1, 3]], ["tile_rx", "sp", [-1, 3]], ["auto_unroll_max_step", "ot", 1500], ["unroll_explicit", "ot", 1]]}], "r": [[0.00016682802567661345, 0.00016684166481609991, 0.00016685367314365023, 0.00016687686051353228, 0.00016694412977099235, 0.00016694942609299097, 0.00016696833102012492, 0.00016698032477446218], 0, 15.459773302078247, 1576691933.8865452], "v": 0.1}
{"i": ["cuda -model=unknown", "topi_nn_conv2d", [["TENSOR", [128, 192, 27, 27], "float32"], ["TENSOR", [96, 192, 1, 1], "float32"], [1, 1], [0, 0], [1, 1], "NCHW", "float32"], {}, ["conv2d", [128, 192, 27, 27, "float32"], [96, 192, 1, 1, "float32"], [1, 1], [0, 0], [1, 1], "NCHW", "float32"], {"i": 5595865, "t": "direct", "c": null, "e": [["tile_f", "sp", [-1, 4, 4, 3]], ["tile_y", "sp", [-1, 3, 1, 1]], ["tile_x", "sp", [-1, 1, 27, 1]], ["tile_rc", "sp", [-1, 12]], ["tile_ry", "sp", [-1, 1]], ["tile_rx", "sp", [-1, 1]], ["auto_unroll_max_step", "ot", 512], ["unroll_explicit", "ot", 1]]}], "r": [[0.0007151174857142858, 0.0007151181523809523, 0.0007151832238095237, 0.0007152035952380953, 0.0007152638857142857, 0.0007153233047619048, 0.0007154927476190476, 0.0007155952809523809], 0, 10.28575849533081, 1576693159.9476597], "v": 0.1}
{"i": ["cuda -model=unknown", "topi_nn_conv2d", [["TENSOR", [128, 96, 27, 27], "float32"], ["TENSOR", [128, 96, 3, 3], "float32"], [1, 1], [1, 1], [1, 1], "NCHW", "float32"], {}, ["conv2d", [128, 96, 27, 27, "float32"], [128, 96, 3, 3, "float32"], [1, 1], [1, 1], [1, 1], "NCHW", "float32"], {"i": 4505149, "t": "winograd", "c": null, "e": [["tile_b", "sp", [-1, 1, 1, 1]], ["tile_y", "sp", [-1, 1, 8, 16]], ["tile_x", "sp", [-1, 4, 16, 1]], ["tile_rc", "sp", [-1, 8]], ["auto_unroll_max_step", "ot", 128], ["unroll_explicit", "ot", 0]]}], "r": [[0.00369957459375, 0.00369973853125, 0.00369977646875, 0.0036998258125, 0.00369982759375, 0.003699843203125, 0.003700334671875, 0.003700391], 0, 8.46893572807312, 1576694778.7851143], "v": 0.1}
{"i": ["cuda -model=unknown", "topi_nn_conv2d", [["TENSOR", [128, 3, 224, 224], "float32"], ["TENSOR", [64, 3, 7, 7], "float32"], [2, 2], [3, 3], [1, 1], "NCHW", "float32"], {}, ["conv2d", [128, 3, 224, 224, "float32"], [64, 3, 7, 7, "float32"], [2, 2], [3, 3], [1, 1], "NCHW", "float32"], {"i": 63359399, "t": "direct", "c": null, "e": [["tile_f", "sp", [-1, 2, 16, 2]], ["tile_y", "sp", [-1, 1, 2, 7]], ["tile_x", "sp", [-1, 1, 8, 2]], ["tile_rc", "sp", [-1, 1]], ["tile_ry", "sp", [-1, 7]], ["tile_rx", "sp", [-1, 7]], ["auto_unroll_max_step", "ot", 512], ["unroll_explicit", "ot", 1]]}], "r": [[0.004980821125, 0.004984399075, 0.004987167275, 0.0049929056, 0.0049930679, 0.004994197425, 0.004997233475, 0.0051150250000000005], 0, 3.569554328918457, 1576696474.2917895], "v": 0.1}
{"i": ["cuda -model=unknown", "topi_nn_conv2d", [["TENSOR", [128, 64, 55, 55], "float32"], ["TENSOR", [64, 64, 1, 1], "float32"], [1, 1], [0, 0], [1, 1], "NCHW", "float32"], {}, ["conv2d", [128, 64, 55, 55, "float32"], [64, 64, 1, 1, "float32"], [1, 1], [0, 0], [1, 1], "NCHW", "float32"], {"i": 225858, "t": "direct", "c": null, "e": [["tile_f", "sp", [-1, 4, 1, 8]], ["tile_y", "sp", [-1, 1, 1, 1]], ["tile_x", "sp", [-1, 1, 55, 1]], ["tile_rc", "sp", [-1, 8]], ["tile_ry", "sp", [-1, 1]], ["tile_rx", "sp", [-1, 1]], ["auto_unroll_max_step", "ot", 512], ["unroll_explicit", "ot", 0]]}], "r": [[0.0009811886078431372, 0.0009811925032679738, 0.0009812139477124184, 0.0009813858431372549, 0.000981514954248366, 0.0009815334313725492, 0.0009818031307189542, 0.000981904843137255], 0, 7.276528596878052, 1576697729.2267447], "v": 0.1}
{"i": ["cuda -model=unknown", "topi_nn_conv2d", [["TENSOR", [128, 64, 55, 55], "float32"], ["TENSOR", [192, 64, 3, 3], "float32"], [1, 1], [1, 1], [1, 1], "NCHW", "float32"], {}, ["conv2d", [128, 64, 55, 55, "float32"], [192, 64, 3, 3, "float32"], [1, 1], [1, 1], [1, 1], "NCHW", "float32"], {"i": 36749977, "t": "winograd", "c": null, "e": [["tile_b", "sp", [-1, 1, 1, 1]], ["tile_y", "sp", [-1, 1, 8, 24]], ["tile_x", "sp", [-1, 4, 16, 1]], ["tile_rc", "sp", [-1, 4]], ["auto_unroll_max_step", "ot", 128], ["unroll_explicit", "ot", 1]]}], "r": [[0.01637169895, 0.016372435900000003, 0.0163725065, 0.016372563325, 0.016372623475, 0.01637263895, 0.01637288005, 0.016373781400000002], 0, 37.40911102294922, 1576699217.9694335], "v": 0.1}
{"i": ["cuda -model=unknown", "topi_nn_conv2d", [["TENSOR", [128, 192, 27, 27], "float32"], ["TENSOR", [64, 192, 1, 1], "float32"], [1, 1], [0, 0], [1, 1], "NCHW", "float32"], {}, ["conv2d", [128, 192, 27, 27, "float32"], [64, 192, 1, 1, "float32"], [1, 1], [0, 0], [1, 1], "NCHW", "float32"], {"i": 1124802, "t": "direct", "c": null, "e": [["tile_f", "sp", [-1, 8, 4, 2]], ["tile_y", "sp", [-1, 1, 1, 3]], ["tile_x", "sp", [-1, 1, 27, 1]], ["tile_rc", "sp", [-1, 8]], ["tile_ry", "sp", [-1, 1]], ["tile_rx", "sp", [-1, 1]], ["auto_unroll_max_step", "ot", 1500], ["unroll_explicit", "ot", 0]]}], "r": [[0.0005083193438155136, 0.0005083537882599581, 0.0005083687232704402, 0.0005083889224318658, 0.0005084025492662473, 0.0005084844025157232, 0.0005085806729559749, 0.0005086710915254238], 0, 7.894421815872192, 1576701173.5471518], "v": 0.1}
{"i": ["cuda -model=unknown", "topi_nn_conv2d", [["TENSOR", [128, 256, 27, 27], "float32"], ["TENSOR", [128, 256, 1, 1], "float32"], [1, 1], [0, 0], [1, 1], "NCHW", "float32"], {}, ["conv2d", [128, 256, 27, 27, "float32"], [128, 256, 1, 1, "float32"], [1, 1], [0, 0], [1, 1], "NCHW", "float32"], {"i": 2326852, "t": "direct", "c": null, "e": [["tile_f", "sp", [-1, 8, 4, 2]], ["tile_y", "sp", [-1, 1, 1, 3]], ["tile_x", "sp", [-1, 1, 27, 1]], ["tile_rc", "sp", [-1, 8]], ["tile_ry", "sp", [-1, 1]], ["tile_rx", "sp", [-1, 1]], ["auto_unroll_max_step", "ot", 1500], ["unroll_explicit", "ot", 1]]}], "r": [[0.0011706183966480447, 0.001170699966480447, 0.0011707315418994413, 0.0011707828994413406, 0.0011708910670391061, 0.0011709021787709496, 0.0011710192458100558, 0.0011710264134078211], 0, 3.628715991973877, 1576702270.719645], "v": 0.1}
{"i": ["cuda -model=unknown", "topi_nn_conv2d", [["TENSOR", [128, 480, 13, 13], "float32"], ["TENSOR", [192, 480, 1, 1], "float32"], [1, 1], [0, 0], [1, 1], "NCHW", "float32"], {}, ["conv2d", [128, 480, 13, 13, "float32"], [192, 480, 1, 1, "float32"], [1, 1], [0, 0], [1, 1], "NCHW", "float32"], {"i": 159094, "t": "direct", "c": null, "e": [["tile_f", "sp", [-1, 2, 8, 3]], ["tile_y", "sp", [-1, 13, 1, 1]], ["tile_x", "sp", [-1, 1, 13, 1]], ["tile_rc", "sp", [-1, 6]], ["tile_ry", "sp", [-1, 1]], ["tile_rx", "sp", [-1, 1]], ["auto_unroll_max_step", "ot", 512], ["unroll_explicit", "ot", 0]]}], "r": [[0.0007371347892156863, 0.000737872588235294, 0.0007382671813725491, 0.0007384738970588236, 0.0007388397892156862, 0.0007389472401960784, 0.0007393684754901961, 0.0007410020833333333], 0, 8.054492950439453, 1576703042.9788244], "v": 0.1}
{"i": ["cuda -model=unknown", "topi_nn_conv2d", [["TENSOR", [128, 512, 13, 13], "float32"], ["TENSOR", [160, 512, 1, 1], "float32"], [1, 1], [0, 0], [1, 1], "NCHW", "float32"], {}, ["conv2d", [128, 512, 13, 13, "float32"], [160, 512, 1, 1, "float32"], [1, 1], [0, 0], [1, 1], "NCHW", "float32"], {"i": 192121, "t": "direct", "c": null, "e": [["tile_f", "sp", [-1, 1, 8, 5]], ["tile_y", "sp", [-1, 13, 1, 1]], ["tile_x", "sp", [-1, 1, 13, 1]], ["tile_rc", "sp", [-1, 8]], ["tile_ry", "sp", [-1, 1]], ["tile_rx", "sp", [-1, 1]], ["auto_unroll_max_step", "ot", 1500], ["unroll_explicit", "ot", 1]]}], "r": [[0.0006614114008810573, 0.0006614392995594714, 0.0006615876475770925, 0.0006617175066079295, 0.0006617464933920705, 0.0006617626431718063, 0.0006618230572687225, 0.0006625446563876652], 0, 5.693273544311523, 1576703913.7766626], "v": 0.1}
{"i": ["cuda -model=unknown", "topi_nn_conv2d", [["TENSOR", [128, 512, 13, 13], "float32"], ["TENSOR", [128, 512, 1, 1], "float32"], [1, 1], [0, 0], [1, 1], "NCHW", "float32"], {}, ["conv2d", [128, 512, 13, 13, "float32"], [128, 512, 1, 1, "float32"], [1, 1], [0, 0], [1, 1], "NCHW", "float32"], {"i": 83904, "t": "direct", "c": null, "e": [["tile_f", "sp", [-1, 8, 8, 1]], ["tile_y", "sp", [-1, 1, 1, 13]], ["tile_x", "sp", [-1, 1, 13, 1]], ["tile_rc", "sp", [-1, 8]], ["tile_ry", "sp", [-1, 1]], ["tile_rx", "sp", [-1, 1]], ["auto_unroll_max_step", "ot", 512], ["unroll_explicit", "ot", 1]]}], "r": [[0.0005452741081081081, 0.0005455860585585585, 0.0005456143761261262, 0.0005457503806306306, 0.0005457825135135135, 0.0005458659144144144, 0.0005459255878378378, 0.000546219545045045], 0, 3.7610597610473633, 1576704970.1315935], "v": 0.1}
{"i": ["cuda -model=unknown", "topi_nn_conv2d", [["TENSOR", [128, 512, 13, 13], "float32"], ["TENSOR", [112, 512, 1, 1], "float32"], [1, 1], [0, 0], [1, 1], "NCHW", "float32"], {}, ["conv2d", [128, 512, 13, 13, "float32"], [112, 512, 1, 1, "float32"], [1, 1], [0, 0], [1, 1], "NCHW", "float32"], {"i": 117842, "t": "direct", "c": null, "e": [["tile_f", "sp", [-1, 1, 4, 7]], ["tile_y", "sp", [-1, 13, 1, 1]], ["tile_x", "sp", [-1, 1, 13, 1]], ["tile_rc", "sp", [-1, 4]], ["tile_ry", "sp", [-1, 1]], ["tile_rx", "sp", [-1, 1]], ["auto_unroll_max_step", "ot", 1500], ["unroll_explicit", "ot", 1]]}], "r": [[0.0005009936990291262, 0.0005010036723300971, 0.0005010687815533981, 0.0005010815266990291, 0.0005011065995145631, 0.000501109177184466, 0.0005011401723300971, 0.0005015395752427184], 0, 3.9433577060699463, 1576705924.8337722], "v": 0.1}
{"i": ["cuda -model=unknown", "topi_nn_conv2d", [["TENSOR", [128, 528, 13, 13], "float32"], ["TENSOR", [256, 528, 1, 1], "float32"], [1, 1], [0, 0], [1, 1], "NCHW", "float32"], {}, ["conv2d", [128, 528, 13, 13, "float32"], [256, 528, 1, 1, "float32"], [1, 1], [0, 0], [1, 1], "NCHW", "float32"], {"i": 173442, "t": "direct", "c": null, "e": [["tile_f", "sp", [-1, 8, 8, 1]], ["tile_y", "sp", [-1, 1, 1, 13]], ["tile_x", "sp", [-1, 1, 13, 1]], ["tile_rc", "sp", [-1, 8]], ["tile_ry", "sp", [-1, 1]], ["tile_rx", "sp", [-1, 1]], ["auto_unroll_max_step", "ot", 0], ["unroll_explicit", "ot", 1]]}], "r": [[0.0010459706805555557, 0.0010461195763888887, 0.0010461864166666666, 0.0010463129930555555, 0.0010466871875, 0.0010467599027777779, 0.0010468903541666667, 0.001047041763888889], 0, 10.347277879714966, 1576706764.154971], "v": 0.1}
{"i": ["cuda -model=unknown", "topi_nn_conv2d", [["TENSOR", [128, 832, 6, 6], "float32"], ["TENSOR", [256, 832, 1, 1], "float32"], [1, 1], [0, 0], [1, 1], "NCHW", "float32"], {}, ["conv2d", [128, 832, 6, 6, "float32"], [256, 832, 1, 1, "float32"], [1, 1], [0, 0], [1, 1], "NCHW", "float32"], {"i": 2564337, "t": "direct", "c": null, "e": [["tile_f", "sp", [-1, 2, 16, 2]], ["tile_y", "sp", [-1, 3, 2, 1]], ["tile_x", "sp", [-1, 1, 3, 2]], ["tile_rc", "sp", [-1, 13]], ["tile_ry", "sp", [-1, 1]], ["tile_rx", "sp", [-1, 1]], ["auto_unroll_max_step", "ot", 512], ["unroll_explicit", "ot", 1]]}], "r": [[0.0003484895014409222, 0.00034850519596541787, 0.000348515204610951, 0.0003485420706051873, 0.00034856388472622477, 0.00034859857780979826, 0.00034862734582132563, 0.0003486414293948127], 0, 6.326234579086304, 1576708183.2055964], "v": 0.1}
{"i": ["cuda -model=unknown", "topi_nn_conv2d", [["TENSOR", [128, 832, 6, 6], "float32"], ["TENSOR", [384, 832, 1, 1], "float32"], [1, 1], [0, 0], [1, 1], "NCHW", "float32"], {}, ["conv2d", [128, 832, 6, 6, "float32"], [384, 832, 1, 1, "float32"], [1, 1], [0, 0], [1, 1], "NCHW", "float32"], {"i": 5839261, "t": "direct", "c": null, "e": [["tile_f", "sp", [-1, 6, 8, 1]], ["tile_y", "sp", [-1, 3, 2, 1]], ["tile_x", "sp", [-1, 1, 6, 1]], ["tile_rc", "sp", [-1, 16]], ["tile_ry", "sp", [-1, 1]], ["tile_rx", "sp", [-1, 1]], ["auto_unroll_max_step", "ot", 0], ["unroll_explicit", "ot", 1]]}], "r": [[0.0004918002790224033, 0.0004919461221995926, 0.0004919533177189409, 0.0004919607474541751, 0.0004922999979633401, 0.0004923177922606925, 0.000492341517311609, 0.0004927685845213849], 0, 6.991501808166504, 1576709285.4593492], "v": 0.1}
{"i": ["cuda -model=unknown", "topi_nn_dense", [["TENSOR", [128, 1024], "float32"], ["TENSOR", [1000, 1024], "float32"], null, "float32"], {}, ["dense", [128, 1024, "float32"], [1000, 1024, "float32"], 0, "float32"], {"i": 1124290, "t": "direct", "c": null, "e": [["tile_x", "sp", [-1, 4, 2, 1]], ["tile_y", "sp", [-1, 5, 2, 4]], ["tile_k", "sp", [-1, 4, 4]]]}], "r": [[0.0007722751821086262, 0.0007725372076677317, 0.0007725523354632588, 0.0007726519456869009, 0.0007727428019169329, 0.000773014536741214, 0.0007730297412140575, 0.0007731024632587859], 0, 4.5116236209869385, 1576709976.360045], "v": 0.1}
