mytophub/20191227/mobilenet_v2_bs_128.log
{"i": ["cuda -model=unknown", "topi_nn_depthwise_conv2d_nchw", [["TENSOR", [128, 576, 14, 14], "float32"], ["TENSOR", [576, 1, 3, 3], "float32"], [1, 1], [1, 1], [1, 1], "float32"], {}, ["depthwise_conv2d_nchw", [128, 576, 14, 14, "float32"], [576, 1, 3, 3, "float32"], [1, 1], [1, 1], [1, 1], "float32"], {"i": 541892, "t": "direct", "c": null, "e": [["tile_f", "sp", [-1, 1, 9, 1]], ["tile_y", "sp", [-1, 7, 2, 1]], ["tile_x", "sp", [-1, 1, 14, 1]], ["auto_unroll_max_step", "ot", 1500], ["unroll_explicit", "ot", 0]]}], "r": [[0.0004924322769857434, 0.0004924659327902241, 0.0004924813238289205, 0.0004925114949083503, 0.0004925402790224032, 0.0004925837718940937, 0.0004925917617107943, 0.0004926085050916497], 0, 22.871050357818604, 1576982230.884389], "v": 0.1}
{"i": ["cuda -model=unknown", "topi_nn_depthwise_conv2d_nchw", [["TENSOR", [128, 192, 28, 28], "float32"], ["TENSOR", [192, 1, 3, 3], "float32"], [1, 1], [1, 1], [1, 1], "float32"], {}, ["depthwise_conv2d_nchw", [128, 192, 28, 28, "float32"], [192, 1, 3, 3, "float32"], [1, 1], [1, 1], [1, 1], "float32"], {"i": 2390654, "t": "direct", "c": null, "e": [["tile_f", "sp", [-1, 1, 2, 1]], ["tile_y", "sp", [-1, 1, 4, 7]], ["tile_x", "sp", [-1, 1, 28, 1]], ["auto_unroll_max_step", "ot", 256], ["unroll_explicit", "ot", 1]]}], "r": [[0.0006410275824468085, 0.000641137789893617, 0.0006411516968085106, 0.0006411983776595745, 0.0006412184893617021, 0.0006412689494680851, 0.000641275545212766, 0.000641281210106383], 0, 17.757728815078735, 1576983101.2966228], "v": 0.1}
{"i": ["cuda -model=unknown", "topi_nn_depthwise_conv2d_nchw", [["TENSOR", [128, 144, 56, 56], "float32"], ["TENSOR", [144, 1, 3, 3], "float32"], [1, 1], [1, 1], [1, 1], "float32"], {}, ["depthwise_conv2d_nchw", [128, 144, 56, 56, "float32"], [144, 1, 3, 3, "float32"], [1, 1], [1, 1], [1, 1], "float32"], {"i": 9790302, "t": "direct", "c": null, "e": [["tile_f", "sp", [-1, 1, 2, 2]], ["tile_y", "sp", [-1, 1, 2, 4]], ["tile_x", "sp", [-1, 1, 56, 1]], ["auto_unroll_max_step", "ot", 256], ["unroll_explicit", "ot", 1]]}], "r": [[0.0019051543924050634, 0.001905155670886076, 0.001905259253164557, 0.0019052785949367089, 0.0019054091012658226, 0.0019054247974683546, 0.0019054377848101265, 0.0019054836202531645], 0, 5.685882806777954, 1576984814.935286], "v": 0.1}
{"i": ["cuda -model=unknown", "topi_nn_conv2d", [["TENSOR", [128, 3, 224, 224], "float32"], ["TENSOR", [32, 3, 3, 3], "float32"], [2, 2], [1, 1], [1, 1], "NCHW", "float32"], {}, ["conv2d", [128, 3, 224, 224, "float32"], [32, 3, 3, 3, "float32"], [2, 2], [1, 1], [1, 1], "NCHW", "float32"], {"i": 50838811, "t": "direct", "c": null, "e": [["tile_f", "sp", [-1, 1, 4, 8]], ["tile_y", "sp", [-1, 1, 1, 4]], ["tile_x", "sp", [-1, 1, 112, 1]], ["tile_rc", "sp", [-1, 1]], ["tile_ry", "sp", [-1, 3]], ["tile_rx", "sp", [-1, 3]], ["auto_unroll_max_step", "ot", 1500], ["unroll_explicit", "ot", 1]]}], "r": [[0.0011669232512077296, 0.00116694715942029, 0.0011670172995169082, 0.0011670459420289854, 0.0011672542512077295, 0.0011673511304347826, 0.0011673662077294686, 0.0011674710628019323], 0, 8.119793891906738, 1576987464.199659], "v": 0.1}
{"i": ["cuda -model=unknown", "topi_nn_depthwise_conv2d_nchw", [["TENSOR", [128, 32, 112, 112], "float32"], ["TENSOR", [32, 1, 3, 3], "float32"], [1, 1], [1, 1], [1, 1], "float32"], {}, ["depthwise_conv2d_nchw", [128, 32, 112, 112, "float32"], [32, 1, 3, 3, "float32"], [1, 1], [1, 1], [1, 1], "float32"], {"i": 3642520, "t": "direct", "c": null, "e": [["tile_f", "sp", [-1, 1, 1, 1]], ["tile_y", "sp", [-1, 1, 4, 4]], ["tile_x", "sp", [-1, 1, 112, 1]], ["auto_unroll_max_step", "ot", 0], ["unroll_explicit", "ot", 1]]}], "r": [[0.0016790437847222222, 0.0016791174583333332, 0.0016791198333333335, 0.0016791405347222222, 0.0016792294583333333, 0.0016794495902777778, 0.0016795537847222224, 0.0016795567708333334], 0, 14.72003984451294, 1576989505.415866], "v": 0.1}
{"i": ["cuda -model=unknown", "topi_nn_conv2d", [["TENSOR", [128, 32, 112, 112], "float32"], ["TENSOR", [16, 32, 1, 1], "float32"], [1, 1], [0, 0], [1, 1], "NCHW", "float32"], {}, ["conv2d", [128, 32, 112, 112, "float32"], [16, 32, 1, 1, "float32"], [1, 1], [0, 0], [1, 1], "NCHW", "float32"], {"i": 15309186, "t": "direct", "c": null, "e": [["tile_f", "sp", [-1, 4, 4, 1]], ["tile_y", "sp", [-1, 1, 1, 2]], ["tile_x", "sp", [-1, 1, 112, 1]], ["tile_rc", "sp", [-1, 16]], ["tile_ry", "sp", [-1, 1]], ["tile_rx", "sp", [-1, 1]], ["auto_unroll_max_step", "ot", 0], ["unroll_explicit", "ot", 1]]}], "r": [[0.0012192305806451613, 0.0012192714677419355, 0.0012193339838709677, 0.001219483322580645, 0.0012195604274193546, 0.0012196175887096775, 0.001219651879032258, 0.001219747612903226], 0, 10.505413055419922, 1576992400.9788272], "v": 0.1}
{"i": ["cuda -model=unknown", "topi_nn_conv2d", [["TENSOR", [128, 16, 112, 112], "float32"], ["TENSOR", [96, 16, 1, 1], "float32"], [1, 1], [0, 0], [1, 1], "NCHW", "float32"], {}, ["conv2d", [128, 16, 112, 112, "float32"], [96, 16, 1, 1, "float32"], [1, 1], [0, 0], [1, 1], "NCHW", "float32"], {"i": 124282142, "t": "direct", "c": null, "e": [["tile_f", "sp", [-1, 1, 2, 48]], ["tile_y", "sp", [-1, 1, 2, 1]], ["tile_x", "sp", [-1, 2, 56, 1]], ["tile_rc", "sp", [-1, 8]], ["tile_ry", "sp", [-1, 1]], ["tile_rx", "sp", [-1, 1]], ["auto_unroll_max_step", "ot", 1500], ["unroll_explicit", "ot", 1]]}], "r": [[0.00292620685, 0.0029264251250000002, 0.0029265299500000003, 0.002926978525, 0.0029271707375, 0.0029272888375, 0.0029272892750000002, 0.002927462125], 0, 5.112454175949097, 1576995358.973894], "v": 0.1}
{"i": ["cuda -model=unknown", "topi_nn_depthwise_conv2d_nchw", [["TENSOR", [128, 96, 112, 112], "float32"], ["TENSOR", [96, 1, 3, 3], "float32"], [2, 2], [1, 1], [1, 1], "float32"], {}, ["depthwise_conv2d_nchw", [128, 96, 112, 112, "float32"], [96, 1, 3, 3, "float32"], [2, 2], [1, 1], [1, 1], "float32"], {"i": 7694400, "t": "direct", "c": null, "e": [["tile_f", "sp", [-1, 1, 1, 1]], ["tile_y", "sp", [-1, 1, 1, 2]], ["tile_x", "sp", [-1, 1, 56, 1]], ["auto_unroll_max_step", "ot", 1500], ["unroll_explicit", "ot", 1]]}], "r": [[0.003257665833333333, 0.0032577514166666666, 0.0032578503125, 0.003258083875, 0.003258299479166667, 0.0032583697083333335, 0.003258842645833333, 0.003259034166666667], 0, 2.9178566932678223, 1576997214.2991278], "v": 0.1}
{"i": ["cuda -model=unknown", "topi_nn_conv2d", [["TENSOR", [128, 96, 56, 56], "float32"], ["TENSOR", [24, 96, 1, 1], "float32"], [1, 1], [0, 0], [1, 1], "NCHW", "float32"], {}, ["conv2d", [128, 96, 56, 56, "float32"], [24, 96, 1, 1, "float32"], [1, 1], [0, 0], [1, 1], "NCHW", "float32"], {"i": 32954475, "t": "direct", "c": null, "e": [["tile_f", "sp", [-1, 1, 3, 8]], ["tile_y", "sp", [-1, 4, 2, 1]], ["tile_x", "sp", [-1, 1, 56, 1]], ["tile_rc", "sp", [-1, 6]], ["tile_ry", "sp", [-1, 1]], ["tile_rx", "sp", [-1, 1]], ["auto_unroll_max_step", "ot", 1500], ["unroll_explicit", "ot", 1]]}], "r": [[0.000775195570967742, 0.000775219829032258, 0.0007752351677419355, 0.0007752462580645161, 0.0007752852806451612, 0.000775311670967742, 0.0007753124516129032, 0.000775324770967742], 0, 3.656017303466797, 1577000856.7665567], "v": 0.1}
{"i": ["cuda -model=unknown", "topi_nn_conv2d", [["TENSOR", [128, 144, 56, 56], "float32"], ["TENSOR", [24, 144, 1, 1], "float32"], [1, 1], [0, 0], [1, 1], "NCHW", "float32"], {}, ["conv2d", [128, 144, 56, 56, "float32"], [24, 144, 1, 1, "float32"], [1, 1], [0, 0], [1, 1], "NCHW", "float32"], {"i": 17594475, "t": "direct", "c": null, "e": [["tile_f", "sp", [-1, 1, 3, 8]], ["tile_y", "sp", [-1, 4, 2, 1]], ["tile_x", "sp", [-1, 1, 56, 1]], ["tile_rc", "sp", [-1, 6]], ["tile_ry", "sp", [-1, 1]], ["tile_rx", "sp", [-1, 1]], ["auto_unroll_max_step", "ot", 1500], ["unroll_explicit", "ot", 0]]}], "r": [[0.0010762264454545454, 0.0010763786954545453, 0.0010765197318181817, 0.0010765394318181817, 0.0010765941954545455, 0.0010766144727272727, 0.00107665635, 0.0010767212681818182], 0, 3.779479742050171, 1577003398.419684], "v": 0.1}
{"i": ["cuda -model=unknown", "topi_nn_conv2d", [["TENSOR", [128, 24, 56, 56], "float32"], ["TENSOR", [144, 24, 1, 1], "float32"], [1, 1], [0, 0], [1, 1], "NCHW", "float32"], {}, ["conv2d", [128, 24, 56, 56, "float32"], [144, 24, 1, 1, "float32"], [1, 1], [0, 0], [1, 1], "NCHW", "float32"], {"i": 45623120, "t": "direct", "c": null, "e": [["tile_f", "sp", [-1, 1, 3, 8]], ["tile_y", "sp", [-1, 2, 1, 2]], ["tile_x", "sp", [-1, 1, 56, 1]], ["tile_rc", "sp", [-1, 6]], ["tile_ry", "sp", [-1, 1]], ["tile_rx", "sp", [-1, 1]], ["auto_unroll_max_step", "ot", 1500], ["unroll_explicit", "ot", 0]]}], "r": [[0.0010314081643835616, 0.0010314449178082192, 0.0010314843904109588, 0.0010315650136986303, 0.001031610212328767, 0.0010317074657534247, 0.0010317642945205478, 0.001031856794520548], 0, 12.336322784423828, 1577005390.9159007], "v": 0.1}
{"i": ["cuda -model=unknown", "topi_nn_depthwise_conv2d_nchw", [["TENSOR", [128, 144, 56, 56], "float32"], ["TENSOR", [144, 1, 3, 3], "float32"], [2, 2], [1, 1], [1, 1], "float32"], {}, ["depthwise_conv2d_nchw", [128, 144, 56, 56, "float32"], [144, 1, 3, 3, "float32"], [2, 2], [1, 1], [1, 1], "float32"], {"i": 2598400, "t": "direct", "c": null, "e": [["tile_f", "sp", [-1, 1, 1, 1]], ["tile_y", "sp", [-1, 1, 7, 2]], ["tile_x", "sp", [-1, 2, 7, 2]], ["auto_unroll_max_step", "ot", 256], ["unroll_explicit", "ot", 1]]}], "r": [[0.0012250302588832488, 0.0012251331472081218, 0.0012251812030456854, 0.001225217116751269, 0.0012252300862944162, 0.0012252728274111675, 0.0012253132588832488, 0.001225341116751269], 0, 3.809429407119751, 1577007590.3815002], "v": 0.1}
{"i": ["cuda -model=unknown", "topi_nn_conv2d", [["TENSOR", [128, 144, 28, 28], "float32"], ["TENSOR", [32, 144, 1, 1], "float32"], [1, 1], [0, 0], [1, 1], "NCHW", "float32"], {}, ["conv2d", [128, 144, 28, 28, "float32"], [32, 144, 1, 1, "float32"], [1, 1], [0, 0], [1, 1], "NCHW", "float32"], {"i": 5862504, "t": "direct", "c": null, "e": [["tile_f", "sp", [-1, 4, 4, 2]], ["tile_y", "sp", [-1, 2, 2, 1]], ["tile_x", "sp", [-1, 1, 28, 1]], ["tile_rc", "sp", [-1, 8]], ["tile_ry", "sp", [-1, 1]], ["tile_rx", "sp", [-1, 1]], ["auto_unroll_max_step", "ot", 512], ["unroll_explicit", "ot", 1]]}], "r": [[0.00030421541666666665, 0.00030421977146464645, 0.00030422413383838386, 0.00030429518055555553, 0.00030431397474747475, 0.00030433110606060607, 0.0003043926994949495, 0.00030440221212121215], 0, 9.922117233276367, 1577010261.225624], "v": 0.1}
{"i": ["cuda -model=unknown", "topi_nn_conv2d", [["TENSOR", [128, 192, 28, 28], "float32"], ["TENSOR", [32, 192, 1, 1], "float32"], [1, 1], [0, 0], [1, 1], "NCHW", "float32"], {}, ["conv2d", [128, 192, 28, 28, "float32"], [32, 192, 1, 1, "float32"], [1, 1], [0, 0], [1, 1], "NCHW", "float32"], {"i": 1740609, "t": "direct", "c": null, "e": [["tile_f", "sp", [-1, 4, 8, 1]], ["tile_y", "sp", [-1, 4, 1, 1]], ["tile_x", "sp", [-1, 1, 28, 1]], ["tile_rc", "sp", [-1, 8]], ["tile_ry", "sp", [-1, 1]], ["tile_rx", "sp", [-1, 1]], ["auto_unroll_max_step", "ot", 512], ["unroll_explicit", "ot", 0]]}], "r": [[0.0003867008465266559, 0.0003867304830371567, 0.00038674032310177705, 0.0003867692164781906, 0.00038679729240710827, 0.0003868171841680129, 0.0003868245573505654, 0.0003868939660743134], 0, 6.584372282028198, 1577012153.8546429], "v": 0.1}
{"i": ["cuda -model=unknown", "topi_nn_conv2d", [["TENSOR", [128, 32, 28, 28], "float32"], ["TENSOR", [192, 32, 1, 1], "float32"], [1, 1], [0, 0], [1, 1], "NCHW", "float32"], {}, ["conv2d", [128, 32, 28, 28, "float32"], [192, 32, 1, 1, "float32"], [1, 1], [0, 0], [1, 1], "NCHW", "float32"], {"i": 8836179, "t": "direct", "c": null, "e": [["tile_f", "sp", [-1, 3, 8, 1]], ["tile_y", "sp", [-1, 1, 1, 2]], ["tile_x", "sp", [-1, 1, 28, 1]], ["tile_rc", "sp", [-1, 16]], ["tile_ry", "sp", [-1, 1]], ["tile_rx", "sp", [-1, 1]], ["auto_unroll_max_step", "ot", 1500], ["unroll_explicit", "ot", 0]]}], "r": [[0.0003551378484375, 0.00035524364375, 0.0003552536515625, 0.000355354640625, 0.0003553730875, 0.0003553818140625, 0.000355406296875, 0.0003554092640625], 0, 3.3498692512512207, 1577014505.536223], "v": 0.1}
{"i": ["cuda -model=unknown", "topi_nn_depthwise_conv2d_nchw", [["TENSOR", [128, 192, 28, 28], "float32"], ["TENSOR", [192, 1, 3, 3], "float32"], [2, 2], [1, 1], [1, 1], "float32"], {}, ["depthwise_conv2d_nchw", [128, 192, 28, 28, "float32"], [192, 1, 3, 3, "float32"], [2, 2], [1, 1], [1, 1], "float32"], {"i": 385418, "t": "direct", "c": null, "e": [["tile_f", "sp", [-1, 1, 3, 1]], ["tile_y", "sp", [-1, 1, 7, 2]], ["tile_x", "sp", [-1, 2, 7, 1]], ["auto_unroll_max_step", "ot", 256], ["unroll_explicit", "ot", 1]]}], "r": [[0.000440803, 0.0004408038296703297, 0.00044080913553113554, 0.0004408110311355311, 0.0004408152747252747, 0.0004408232032967033, 0.000440838173992674, 0.00044084876007326006], 0, 19.497984647750854, 1577016371.363043], "v": 0.1}
{"i": ["cuda -model=unknown", "topi_nn_conv2d", [["TENSOR", [128, 192, 14, 14], "float32"], ["TENSOR", [64, 192, 1, 1], "float32"], [1, 1], [0, 0], [1, 1], "NCHW", "float32"], {}, ["conv2d", [128, 192, 14, 14, "float32"], [64, 192, 1, 1, "float32"], [1, 1], [0, 0], [1, 1], "NCHW", "float32"], {"i": 1323800, "t": "direct", "c": null, "e": [["tile_f", "sp", [-1, 2, 8, 2]], ["tile_y", "sp", [-1, 1, 1, 14]], ["tile_x", "sp", [-1, 1, 14, 1]], ["tile_rc", "sp", [-1, 8]], ["tile_ry", "sp", [-1, 1]], ["tile_rx", "sp", [-1, 1]], ["auto_unroll_max_step", "ot", 512], ["unroll_explicit", "ot", 1]]}], "r": [[0.00013619114844192634, 0.00013626524815864023, 0.00013627431104815864, 0.00013627742662889519, 0.00013630077393767705, 0.0001363245059490085, 0.0001363518090651558, 0.00013636298526912183], 0, 22.2538423538208, 1577017577.7665992], "v": 0.1}
{"i": ["cuda -model=unknown", "topi_nn_conv2d", [["TENSOR", [128, 384, 14, 14], "float32"], ["TENSOR", [64, 384, 1, 1], "float32"], [1, 1], [0, 0], [1, 1], "NCHW", "float32"], {}, ["conv2d", [128, 384, 14, 14, "float32"], [64, 384, 1, 1, "float32"], [1, 1], [0, 0], [1, 1], "NCHW", "float32"], {"i": 1838864, "t": "direct", "c": null, "e": [["tile_f", "sp", [-1, 4, 8, 1]], ["tile_y", "sp", [-1, 14, 1, 1]], ["tile_x", "sp", [-1, 1, 14, 1]], ["tile_rc", "sp", [-1, 8]], ["tile_ry", "sp", [-1, 1]], ["tile_rx", "sp", [-1, 1]], ["auto_unroll_max_step", "ot", 1500], ["unroll_explicit", "ot", 1]]}], "r": [[0.00024326830050251257, 0.00024333388944723617, 0.00024342593668341708, 0.00024345997487437186, 0.00024354556281407035, 0.00024355500301507537, 0.00024356102713567838, 0.00024356147638190955], 0, 22.29342246055603, 1577019846.617505], "v": 0.1}
{"i": ["cuda -model=unknown", "topi_nn_conv2d", [["TENSOR", [128, 64, 14, 14], "float32"], ["TENSOR", [384, 64, 1, 1], "float32"], [1, 1], [0, 0], [1, 1], "NCHW", "float32"], {}, ["conv2d", [128, 64, 14, 14, "float32"], [384, 64, 1, 1, "float32"], [1, 1], [0, 0], [1, 1], "NCHW", "float32"], {"i": 1292784, "t": "direct", "c": null, "e": [["tile_f", "sp", [-1, 4, 4, 2]], ["tile_y", "sp", [-1, 7, 2, 1]], ["tile_x", "sp", [-1, 1, 14, 1]], ["tile_rc", "sp", [-1, 8]], ["tile_ry", "sp", [-1, 1]], ["tile_rx", "sp", [-1, 1]], ["auto_unroll_max_step", "ot", 512], ["unroll_explicit", "ot", 0]]}], "r": [[0.00022571670681605977, 0.0002257359710550887, 0.00022574140056022407, 0.00022576462651727357, 0.0002257684304388422, 0.00022577994584500468, 0.00022583613165266106, 0.00022586610737628383], 0, 15.66208553314209, 1577022401.9926887], "v": 0.1}
{"i": ["cuda -model=unknown", "topi_nn_depthwise_conv2d_nchw", [["TENSOR", [128, 384, 14, 14], "float32"], ["TENSOR", [384, 1, 3, 3], "float32"], [1, 1], [1, 1], [1, 1], "float32"], {}, ["depthwise_conv2d_nchw", [128, 384, 14, 14, "float32"], [384, 1, 3, 3, "float32"], [1, 1], [1, 1], [1, 1], "float32"], {"i": 432537, "t": "direct", "c": null, "e": [["tile_f", "sp", [-1, 1, 8, 1]], ["tile_y", "sp", [-1, 7, 2, 1]], ["tile_x", "sp", [-1, 1, 14, 1]], ["auto_unroll_max_step", "ot", 0], ["unroll_explicit", "ot", 1]]}], "r": [[0.00033138103532008833, 0.00033150320529801326, 0.0003315039006622517, 0.0003315402582781457, 0.0003316247306843267, 0.0003316301412803532, 0.0003316793554083885, 0.0003316904856512141], 0, 19.53456687927246, 1577024074.2204301], "v": 0.1}
{"i": ["cuda -model=unknown", "topi_nn_conv2d", [["TENSOR", [128, 384, 14, 14], "float32"], ["TENSOR", [96, 384, 1, 1], "float32"], [1, 1], [0, 0], [1, 1], "NCHW", "float32"], {}, ["conv2d", [128, 384, 14, 14, "float32"], [96, 384, 1, 1, "float32"], [1, 1], [0, 0], [1, 1], "NCHW", "float32"], {"i": 1234104, "t": "direct", "c": null, "e": [["tile_f", "sp", [-1, 3, 4, 2]], ["tile_y", "sp", [-1, 7, 2, 1]], ["tile_x", "sp", [-1, 1, 14, 1]], ["tile_rc", "sp", [-1, 8]], ["tile_ry", "sp", [-1, 1]], ["tile_rx", "sp", [-1, 1]], ["auto_unroll_max_step", "ot", 512], ["unroll_explicit", "ot", 0]]}], "r": [[0.0003202832582781457, 0.0003203761311258278, 0.0003203799920529801, 0.0003203970476821192, 0.0003204525099337748, 0.0003204735430463576, 0.00032055492317880794, 0.0003206461509933775], 0, 12.39969515800476, 1577025491.089609], "v": 0.1}
{"i": ["cuda -model=unknown", "topi_nn_conv2d", [["TENSOR", [128, 576, 14, 14], "float32"], ["TENSOR", [96, 576, 1, 1], "float32"], [1, 1], [0, 0], [1, 1], "NCHW", "float32"], {}, ["conv2d", [128, 576, 14, 14, "float32"], [96, 576, 1, 1, "float32"], [1, 1], [0, 0], [1, 1], "NCHW", "float32"], {"i": 2725048, "t": "direct", "c": null, "e": [["tile_f", "sp", [-1, 3, 4, 2]], ["tile_y", "sp", [-1, 7, 2, 1]], ["tile_x", "sp", [-1, 1, 14, 1]], ["tile_rc", "sp", [-1, 8]], ["tile_ry", "sp", [-1, 1]], ["tile_rx", "sp", [-1, 1]], ["auto_unroll_max_step", "ot", 1500], ["unroll_explicit", "ot", 0]]}], "r": [[0.000472001599609375, 0.000472129212890625, 0.000472129615234375, 0.000472180564453125, 0.00047236093359375, 0.00047240101171875, 0.000472509556640625, 0.0004727565703125], 0, 31.21929383277893, 1577027886.4104795], "v": 0.1}
{"i": ["cuda -model=unknown", "topi_nn_conv2d", [["TENSOR", [128, 96, 14, 14], "float32"], ["TENSOR", [576, 96, 1, 1], "float32"], [1, 1], [0, 0], [1, 1], "NCHW", "float32"], {}, ["conv2d", [128, 96, 14, 14, "float32"], [576, 96, 1, 1, "float32"], [1, 1], [0, 0], [1, 1], "NCHW", "float32"], {"i": 11509444, "t": "direct", "c": null, "e": [["tile_f", "sp", [-1, 1, 4, 9]], ["tile_y", "sp", [-1, 7, 2, 1]], ["tile_x", "sp", [-1, 1, 14, 1]], ["tile_rc", "sp", [-1, 8]], ["tile_ry", "sp", [-1, 1]], ["tile_rx", "sp", [-1, 1]], ["auto_unroll_max_step", "ot", 512], ["unroll_explicit", "ot", 1]]}], "r": [[0.0004334905555555555, 0.0004335100125448029, 0.0004336135143369175, 0.0004336731827956989, 0.00043369396236559143, 0.00043372455376344083, 0.0004337485896057348, 0.00043377002688172047], 0, 10.24066972732544, 1577030442.7566364], "v": 0.1}
{"i": ["cuda -model=unknown", "topi_nn_depthwise_conv2d_nchw", [["TENSOR", [128, 576, 14, 14], "float32"], ["TENSOR", [576, 1, 3, 3], "float32"], [2, 2], [1, 1], [1, 1], "float32"], {}, ["depthwise_conv2d_nchw", [128, 576, 14, 14, "float32"], [576, 1, 3, 3, "float32"], [2, 2], [1, 1], [1, 1], "float32"], {"i": 75655, "t": "direct", "c": null, "e": [["tile_f", "sp", [-1, 3, 4, 1]], ["tile_y", "sp", [-1, 1, 7, 1]], ["tile_x", "sp", [-1, 1, 7, 1]], ["auto_unroll_max_step", "ot", 1500], ["unroll_explicit", "ot", 1]]}], "r": [[0.0003393663023909986, 0.00033943658790436005, 0.00033946630801687765, 0.00033947313220815753, 0.0003394738438818565, 0.0003394852953586498, 0.0003395200604781997, 0.0003395253670886076], 0, 4.610151052474976, 1577033207.9550354], "v": 0.1}
{"i": ["cuda -model=unknown", "topi_nn_conv2d", [["TENSOR", [128, 576, 7, 7], "float32"], ["TENSOR", [160, 576, 1, 1], "float32"], [1, 1], [0, 0], [1, 1], "NCHW", "float32"], {}, ["conv2d", [128, 576, 7, 7, "float32"], [160, 576, 1, 1, "float32"], [1, 1], [0, 0], [1, 1], "NCHW", "float32"], {"i": 403580, "t": "direct", "c": null, "e": [["tile_f", "sp", [-1, 1, 16, 5]], ["tile_y", "sp", [-1, 7, 1, 1]], ["tile_x", "sp", [-1, 1, 7, 1]], ["tile_rc", "sp", [-1, 12]], ["tile_ry", "sp", [-1, 1]], ["tile_rx", "sp", [-1, 1]], ["auto_unroll_max_step", "ot", 1500], ["unroll_explicit", "ot", 1]]}], "r": [[0.00025041541279669763, 0.0002504247450980392, 0.0002504995335397317, 0.0002506772249742002, 0.00025073734262125906, 0.000250791213622291, 0.00025079516193656095, 0.0002508958173374613], 0, 22.042405128479004, 1577034990.010283], "v": 0.1}
{"i": ["cuda -model=unknown", "topi_nn_conv2d", [["TENSOR", [128, 960, 7, 7], "float32"], ["TENSOR", [160, 960, 1, 1], "float32"], [1, 1], [0, 0], [1, 1], "NCHW", "float32"], {}, ["conv2d", [128, 960, 7, 7, "float32"], [160, 960, 1, 1, "float32"], [1, 1], [0, 0], [1, 1], "NCHW", "float32"], {"i": 532604, "t": "direct", "c": null, "e": [["tile_f", "sp", [-1, 1, 16, 5]], ["tile_y", "sp", [-1, 7, 1, 1]], ["tile_x", "sp", [-1, 1, 7, 1]], ["tile_rc", "sp", [-1, 12]], ["tile_ry", "sp", [-1, 1]], ["tile_rx", "sp", [-1, 1]], ["auto_unroll_max_step", "ot", 1500], ["unroll_explicit", "ot", 1]]}], "r": [[0.0004130911094017094, 0.0004132081162393162, 0.00041325050085470086, 0.0004132856854700855, 0.00041333794700854705, 0.00041334566666666666, 0.0004134788188034188, 0.0004135694051282051], 0, 6.42118239402771, 1577036732.061099], "v": 0.1}
{"i": ["cuda -model=unknown", "topi_nn_conv2d", [["TENSOR", [128, 160, 7, 7], "float32"], ["TENSOR", [960, 160, 1, 1], "float32"], [1, 1], [0, 0], [1, 1], "NCHW", "float32"], {}, ["conv2d", [128, 160, 7, 7, "float32"], [960, 160, 1, 1, "float32"], [1, 1], [0, 0], [1, 1], "NCHW", "float32"], {"i": 1391525, "t": "direct", "c": null, "e": [["tile_f", "sp", [-1, 2, 8, 3]], ["tile_y", "sp", [-1, 1, 1, 7]], ["tile_x", "sp", [-1, 1, 7, 1]], ["tile_rc", "sp", [-1, 8]], ["tile_ry", "sp", [-1, 1]], ["tile_rx", "sp", [-1, 1]], ["auto_unroll_max_step", "ot", 1500], ["unroll_explicit", "ot", 1]]}], "r": [[0.0003890511884057971, 0.0003890642028985507, 0.00038908027858293074, 0.0003890889001610306, 0.0003891082818035427, 0.0003891102818035427, 0.00038912962318840577, 0.00038929127858293076], 0, 13.870026111602783, 1577038664.8340282], "v": 0.1}
{"i": ["cuda -model=unknown", "topi_nn_depthwise_conv2d_nchw", [["TENSOR", [128, 960, 7, 7], "float32"], ["TENSOR", [960, 1, 3, 3], "float32"], [1, 1], [1, 1], [1, 1], "float32"], {}, ["depthwise_conv2d_nchw", [128, 960, 7, 7, "float32"], [960, 1, 3, 3, "float32"], [1, 1], [1, 1], [1, 1], "float32"], {"i": 121048, "t": "direct", "c": null, "e": [["tile_f", "sp", [-1, 3, 5, 1]], ["tile_y", "sp", [-1, 1, 7, 1]], ["tile_x", "sp", [-1, 1, 7, 1]], ["auto_unroll_max_step", "ot", 1500], ["unroll_explicit", "ot", 1]]}], "r": [[0.00021692545229007632, 0.00021698320610687022, 0.00021698354389312977, 0.000217005143129771, 0.00021701927099236642, 0.00021708887404580152, 0.0002171617576335878, 0.00021716972232824428], 0, 3.7297778129577637, 1577040416.36417], "v": 0.1}
{"i": ["cuda -model=unknown", "topi_nn_conv2d", [["TENSOR", [128, 960, 7, 7], "float32"], ["TENSOR", [320, 960, 1, 1], "float32"], [1, 1], [0, 0], [1, 1], "NCHW", "float32"], {}, ["conv2d", [128, 960, 7, 7, "float32"], [320, 960, 1, 1, "float32"], [1, 1], [0, 0], [1, 1], "NCHW", "float32"], {"i": 782809, "t": "direct", "c": null, "e": [["tile_f", "sp", [-1, 1, 8, 10]], ["tile_y", "sp", [-1, 7, 1, 1]], ["tile_x", "sp", [-1, 1, 7, 1]], ["tile_rc", "sp", [-1, 6]], ["tile_ry", "sp", [-1, 1]], ["tile_rx", "sp", [-1, 1]], ["auto_unroll_max_step", "ot", 1500], ["unroll_explicit", "ot", 1]]}], "r": [[0.0007245472432432432, 0.0007246782372372372, 0.0007248073693693695, 0.0007248727057057057, 0.0007248976156156156, 0.0007249364294294294, 0.0007250481381381381, 0.0007251297687687687], 0, 12.239248752593994, 1577042328.426015], "v": 0.1}
{"i": ["cuda -model=unknown", "topi_nn_conv2d", [["TENSOR", [128, 320, 7, 7], "float32"], ["TENSOR", [1280, 320, 1, 1], "float32"], [1, 1], [0, 0], [1, 1], "NCHW", "float32"], {}, ["conv2d", [128, 320, 7, 7, "float32"], [1280, 320, 1, 1, "float32"], [1, 1], [0, 0], [1, 1], "NCHW", "float32"], {"i": 630587, "t": "direct", "c": null, "e": [["tile_f", "sp", [-1, 2, 8, 4]], ["tile_y", "sp", [-1, 1, 1, 7]], ["tile_x", "sp", [-1, 1, 7, 1]], ["tile_rc", "sp", [-1, 5]], ["tile_ry", "sp", [-1, 1]], ["tile_rx", "sp", [-1, 1]], ["auto_unroll_max_step", "ot", 512], ["unroll_explicit", "ot", 1]]}], "r": [[0.0009332842906976744, 0.0009333610542635659, 0.000933489531007752, 0.0009335054612403101, 0.0009335902441860465, 0.0009336596589147286, 0.0009337442364341085, 0.0009337563682170543], 0, 25.36549663543701, 1577044315.2849915], "v": 0.1}
{"i": ["cuda -model=unknown", "topi_nn_dense", [["TENSOR", [128, 1280], "float32"], ["TENSOR", [1000, 1280], "float32"], null, "float32"], {}, ["dense", [128, 1280, "float32"], [1000, 1280, "float32"], 0, "float32"], {"i": 194291, "t": "direct", "c": null, "e": [["tile_x", "sp", [-1, 8, 2, 1]], ["tile_y", "sp", [-1, 5, 2, 1]], ["tile_k", "sp", [-1, 8, 1]]]}], "r": [[0.00047364567924528304, 0.00047377319496855343, 0.00047383921383647797, 0.00047407464465408803, 0.0004741108679245283, 0.00047445288050314467, 0.0004747232106918239, 0.00047494211006289305], 0, 22.404786348342896, 1577047211.6715684], "v": 0.1}
