mytophub/20191227/mobilenet_v2_bs_8.log
{"i": ["cuda -model=unknown", "topi_nn_depthwise_conv2d_nchw", [["TENSOR", [8, 576, 14, 14], "float32"], ["TENSOR", [576, 1, 3, 3], "float32"], [1, 1], [1, 1], [1, 1], "float32"], {}, ["depthwise_conv2d_nchw", [8, 576, 14, 14, "float32"], [576, 1, 3, 3, "float32"], [1, 1], [1, 1], [1, 1], "float32"], {"i": 1228920, "t": "direct", "c": null, "e": [["tile_f", "sp", [-1, 1, 1, 1]], ["tile_y", "sp", [-1, 2, 7, 1]], ["tile_x", "sp", [-1, 1, 7, 2]], ["auto_unroll_max_step", "ot", 1500], ["unroll_explicit", "ot", 1]]}], "r": [[3.5669175673663835e-05, 3.567513056423999e-05, 3.567604213190412e-05, 3.5687416555009676e-05, 3.569185573916927e-05, 3.5696842786958465e-05, 3.569754652374572e-05, 3.5718478785171956e-05], 0, 6.818683624267578, 1577025186.3151221], "v": 0.1}
{"i": ["cuda -model=unknown", "topi_nn_depthwise_conv2d_nchw", [["TENSOR", [8, 192, 28, 28], "float32"], ["TENSOR", [192, 1, 3, 3], "float32"], [1, 1], [1, 1], [1, 1], "float32"], {}, ["depthwise_conv2d_nchw", [8, 192, 28, 28, "float32"], [192, 1, 3, 3, "float32"], [1, 1], [1, 1], [1, 1], "float32"], {"i": 2928254, "t": "direct", "c": null, "e": [["tile_f", "sp", [-1, 1, 2, 1]], ["tile_y", "sp", [-1, 1, 4, 7]], ["tile_x", "sp", [-1, 1, 28, 1]], ["auto_unroll_max_step", "ot", 1500], ["unroll_explicit", "ot", 1]]}], "r": [[4.3285783862194015e-05, 4.3345013780598366e-05, 4.339025294650952e-05, 4.339941432456935e-05, 4.3416304805077065e-05, 4.349966727107888e-05, 4.352685947416137e-05, 4.3569819038984586e-05], 0, 15.84661078453064, 1577027391.440542], "v": 0.1}
{"i": ["cuda -model=unknown", "topi_nn_depthwise_conv2d_nchw", [["TENSOR", [8, 144, 56, 56], "float32"], ["TENSOR", [144, 1, 3, 3], "float32"], [1, 1], [1, 1], [1, 1], "float32"], {}, ["depthwise_conv2d_nchw", [8, 144, 56, 56, "float32"], [144, 1, 3, 3, "float32"], [1, 1], [1, 1], [1, 1], "float32"], {"i": 9794400, "t": "direct", "c": null, "e": [["tile_f", "sp", [-1, 1, 1, 1]], ["tile_y", "sp", [-1, 1, 4, 7]], ["tile_x", "sp", [-1, 1, 56, 1]], ["auto_unroll_max_step", "ot", 256], ["unroll_explicit", "ot", 1]]}], "r": [[0.0001232650200927357, 0.00012327157702215352, 0.00012327463626996395, 0.00012330674188562596, 0.0001233340432766615, 0.00012337212879958784, 0.00012342744513137556, 0.00012344814064914992], 0, 4.2695276737213135, 1577029008.68025], "v": 0.1}
{"i": ["cuda -model=unknown", "topi_nn_conv2d", [["TENSOR", [8, 3, 224, 224], "float32"], ["TENSOR", [32, 3, 3, 3], "float32"], [2, 2], [1, 1], [1, 1], "NCHW", "float32"], {}, ["conv2d", [8, 3, 224, 224, "float32"], [32, 3, 3, 3, "float32"], [2, 2], [1, 1], [1, 1], "NCHW", "float32"], {"i": 42006765, "t": "direct", "c": null, "e": [["tile_f", "sp", [-1, 1, 8, 4]], ["tile_y", "sp", [-1, 1, 1, 1]], ["tile_x", "sp", [-1, 7, 16, 1]], ["tile_rc", "sp", [-1, 1]], ["tile_ry", "sp", [-1, 3]], ["tile_rx", "sp", [-1, 3]], ["auto_unroll_max_step", "ot", 512], ["unroll_explicit", "ot", 1]]}], "r": [[8.33800919819507e-05, 8.342193162096494e-05, 8.348304095800069e-05, 8.358770669906282e-05, 8.364438562998958e-05, 8.366169940992711e-05, 8.368628913571676e-05, 8.371644602568552e-05], 0, 27.775304794311523, 1577031705.2260394], "v": 0.1}
{"i": ["cuda -model=unknown", "topi_nn_depthwise_conv2d_nchw", [["TENSOR", [8, 32, 112, 112], "float32"], ["TENSOR", [32, 1, 3, 3], "float32"], [1, 1], [1, 1], [1, 1], "float32"], {}, ["depthwise_conv2d_nchw", [8, 32, 112, 112, "float32"], [32, 1, 3, 3, "float32"], [1, 1], [1, 1], [1, 1], "float32"], {"i": 3626840, "t": "direct", "c": null, "e": [["tile_f", "sp", [-1, 1, 1, 1]], ["tile_y", "sp", [-1, 1, 4, 4]], ["tile_x", "sp", [-1, 1, 56, 1]], ["auto_unroll_max_step", "ot", 0], ["unroll_explicit", "ot", 1]]}], "r": [[0.0001104305337310693, 0.00011043610096374484, 0.00011043797521798991, 0.00011045434694814134, 0.00011045655667737495, 0.00011047186737035336, 0.00011054134511243689, 0.00011090290637907297], 0, 3.5581119060516357, 1577033846.5544987], "v": 0.1}
{"i": ["cuda -model=unknown", "topi_nn_conv2d", [["TENSOR", [8, 32, 112, 112], "float32"], ["TENSOR", [16, 32, 1, 1], "float32"], [1, 1], [0, 0], [1, 1], "NCHW", "float32"], {}, ["conv2d", [8, 32, 112, 112, "float32"], [16, 32, 1, 1, "float32"], [1, 1], [0, 0], [1, 1], "NCHW", "float32"], {"i": 9819770, "t": "direct", "c": null, "e": [["tile_f", "sp", [-1, 1, 4, 4]], ["tile_y", "sp", [-1, 8, 1, 1]], ["tile_x", "sp", [-1, 1, 112, 1]], ["tile_rc", "sp", [-1, 4]], ["tile_ry", "sp", [-1, 1]], ["tile_rx", "sp", [-1, 1]], ["auto_unroll_max_step", "ot", 1500], ["unroll_explicit", "ot", 0]]}], "r": [[7.883216835899116e-05, 7.883803668522764e-05, 7.884616049787094e-05, 7.885013560432362e-05, 7.8856649852604e-05, 7.887155715689485e-05, 7.887355650180151e-05, 7.887720700949885e-05], 0, 30.159452438354492, 1577037320.3374894], "v": 0.1}
{"i": ["cuda -model=unknown", "topi_nn_conv2d", [["TENSOR", [8, 16, 112, 112], "float32"], ["TENSOR", [96, 16, 1, 1], "float32"], [1, 1], [0, 0], [1, 1], "NCHW", "float32"], {}, ["conv2d", [8, 16, 112, 112, "float32"], [96, 16, 1, 1, "float32"], [1, 1], [0, 0], [1, 1], "NCHW", "float32"], {"i": 124125292, "t": "direct", "c": null, "e": [["tile_f", "sp", [-1, 2, 8, 6]], ["tile_y", "sp", [-1, 1, 2, 1]], ["tile_x", "sp", [-1, 7, 16, 1]], ["tile_rc", "sp", [-1, 8]], ["tile_ry", "sp", [-1, 1]], ["tile_rx", "sp", [-1, 1]], ["auto_unroll_max_step", "ot", 1500], ["unroll_explicit", "ot", 1]]}], "r": [[0.00018732534856700234, 0.0001873291525948877, 0.00018736358249419057, 0.00018753343919442292, 0.00018761719442292798, 0.00018767686134779242, 0.0001877239194422928, 0.0001877502416731216], 0, 12.485112190246582, 1577040071.49598], "v": 0.1}
{"i": ["cuda -model=unknown", "topi_nn_depthwise_conv2d_nchw", [["TENSOR", [8, 96, 112, 112], "float32"], ["TENSOR", [96, 1, 3, 3], "float32"], [2, 2], [1, 1], [1, 1], "float32"], {}, ["depthwise_conv2d_nchw", [8, 96, 112, 112, "float32"], [96, 1, 3, 3, "float32"], [2, 2], [1, 1], [1, 1], "float32"], {"i": 6260800, "t": "direct", "c": null, "e": [["tile_f", "sp", [-1, 1, 1, 1]], ["tile_y", "sp", [-1, 1, 1, 2]], ["tile_x", "sp", [-1, 1, 56, 1]], ["auto_unroll_max_step", "ot", 256], ["unroll_explicit", "ot", 1]]}], "r": [[0.0002090474766435986, 0.0002090854671280277, 0.0002090897560553633, 0.00020909301557093426, 0.0002090958088235294, 0.0002090997759515571, 0.00020913492387543252, 0.0002091731418685121], 0, 17.75760316848755, 1577042127.8527424], "v": 0.1}
{"i": ["cuda -model=unknown", "topi_nn_conv2d", [["TENSOR", [8, 96, 56, 56], "float32"], ["TENSOR", [24, 96, 1, 1], "float32"], [1, 1], [0, 0], [1, 1], "NCHW", "float32"], {}, ["conv2d", [8, 96, 56, 56, "float32"], [24, 96, 1, 1, "float32"], [1, 1], [0, 0], [1, 1], "NCHW", "float32"], {"i": 32437752, "t": "direct", "c": null, "e": [["tile_f", "sp", [-1, 1, 4, 6]], ["tile_y", "sp", [-1, 2, 1, 2]], ["tile_x", "sp", [-1, 2, 28, 1]], ["tile_rc", "sp", [-1, 4]], ["tile_ry", "sp", [-1, 1]], ["tile_rx", "sp", [-1, 1]], ["auto_unroll_max_step", "ot", 1500], ["unroll_explicit", "ot", 1]]}], "r": [[5.322861279610361e-05, 5.323237480628736e-05, 5.3252101394731015e-05, 5.325578746955945e-05, 5.3257390967456274e-05, 5.326599535089661e-05, 5.326720301084791e-05, 5.327394819570511e-05], 0, 23.620360851287842, 1577047087.701304], "v": 0.1}
{"i": ["cuda -model=unknown", "topi_nn_conv2d", [["TENSOR", [8, 144, 56, 56], "float32"], ["TENSOR", [24, 144, 1, 1], "float32"], [1, 1], [0, 0], [1, 1], "NCHW", "float32"], {}, ["conv2d", [8, 144, 56, 56, "float32"], [24, 144, 1, 1, "float32"], [1, 1], [0, 0], [1, 1], "NCHW", "float32"], {"i": 40636097, "t": "direct", "c": null, "e": [["tile_f", "sp", [-1, 8, 3, 1]], ["tile_y", "sp", [-1, 2, 1, 2]], ["tile_x", "sp", [-1, 1, 56, 1]], ["tile_rc", "sp", [-1, 6]], ["tile_ry", "sp", [-1, 1]], ["tile_rx", "sp", [-1, 1]], ["auto_unroll_max_step", "ot", 1500], ["unroll_explicit", "ot", 1]]}], "r": [[7.142262195845698e-05, 7.143360059347181e-05, 7.144461899109792e-05, 7.145777002967359e-05, 7.146389910979229e-05, 7.150970623145401e-05, 7.15296e-05, 7.153969673590505e-05], 0, 21.12481117248535, 1577050269.7861612], "v": 0.1}
{"i": ["cuda -model=unknown", "topi_nn_conv2d", [["TENSOR", [8, 24, 56, 56], "float32"], ["TENSOR", [144, 24, 1, 1], "float32"], [1, 1], [0, 0], [1, 1], "NCHW", "float32"], {}, ["conv2d", [8, 24, 56, 56, "float32"], [144, 24, 1, 1, "float32"], [1, 1], [0, 0], [1, 1], "NCHW", "float32"], {"i": 47852511, "t": "direct", "c": null, "e": [["tile_f", "sp", [-1, 2, 2, 3]], ["tile_y", "sp", [-1, 2, 1, 1]], ["tile_x", "sp", [-1, 1, 56, 1]], ["tile_rc", "sp", [-1, 8]], ["tile_ry", "sp", [-1, 1]], ["tile_rx", "sp", [-1, 1]], ["auto_unroll_max_step", "ot", 1500], ["unroll_explicit", "ot", 0]]}], "r": [[6.667625798319328e-05, 6.668540084033613e-05, 6.66967112044818e-05, 6.670515630252101e-05, 6.670611120448179e-05, 6.670913081232492e-05, 6.673613417366947e-05, 6.674050588235294e-05], 0, 6.433590650558472, 1577052848.5041995], "v": 0.1}
{"i": ["cuda -model=unknown", "topi_nn_depthwise_conv2d_nchw", [["TENSOR", [8, 144, 56, 56], "float32"], ["TENSOR", [144, 1, 3, 3], "float32"], [2, 2], [1, 1], [1, 1], "float32"], {}, ["depthwise_conv2d_nchw", [8, 144, 56, 56, "float32"], [144, 1, 3, 3, "float32"], [2, 2], [1, 1], [1, 1], "float32"], {"i": 2478700, "t": "direct", "c": null, "e": [["tile_f", "sp", [-1, 1, 1, 1]], ["tile_y", "sp", [-1, 4, 1, 1]], ["tile_x", "sp", [-1, 1, 28, 1]], ["auto_unroll_max_step", "ot", 256], ["unroll_explicit", "ot", 1]]}], "r": [[8.157018246205734e-05, 8.161573254637437e-05, 8.161759527824621e-05, 8.165797639123103e-05, 8.17569784148398e-05, 8.180711838111299e-05, 8.183942833052277e-05, 8.18401976391231e-05], 0, 40.31033253669739, 1577054424.1942546], "v": 0.1}
{"i": ["cuda -model=unknown", "topi_nn_conv2d", [["TENSOR", [8, 144, 28, 28], "float32"], ["TENSOR", [32, 144, 1, 1], "float32"], [1, 1], [0, 0], [1, 1], "NCHW", "float32"], {}, ["conv2d", [8, 144, 28, 28, "float32"], [32, 144, 1, 1, "float32"], [1, 1], [0, 0], [1, 1], "NCHW", "float32"], {"i": 3443905, "t": "direct", "c": null, "e": [["tile_f", "sp", [-1, 4, 8, 1]], ["tile_y", "sp", [-1, 1, 1, 2]], ["tile_x", "sp", [-1, 1, 28, 1]], ["tile_rc", "sp", [-1, 16]], ["tile_ry", "sp", [-1, 1]], ["tile_rx", "sp", [-1, 1]], ["auto_unroll_max_step", "ot", 1500], ["unroll_explicit", "ot", 0]]}], "r": [[2.454023656908064e-05, 2.4576680225988702e-05, 2.4599707447354905e-05, 2.4608112891628146e-05, 2.4628948022598868e-05, 2.463908145865434e-05, 2.466981068310221e-05, 2.47066614278377e-05], 0, 4.257974147796631, 1577056282.017053], "v": 0.1}
{"i": ["cuda -model=unknown", "topi_nn_conv2d", [["TENSOR", [8, 192, 28, 28], "float32"], ["TENSOR", [32, 192, 1, 1], "float32"], [1, 1], [0, 0], [1, 1], "NCHW", "float32"], {}, ["conv2d", [8, 192, 28, 28, "float32"], [32, 192, 1, 1, "float32"], [1, 1], [0, 0], [1, 1], "NCHW", "float32"], {"i": 5594301, "t": "direct", "c": null, "e": [["tile_f", "sp", [-1, 4, 4, 1]], ["tile_y", "sp", [-1, 1, 1, 2]], ["tile_x", "sp", [-1, 1, 28, 1]], ["tile_rc", "sp", [-1, 12]], ["tile_ry", "sp", [-1, 1]], ["tile_rx", "sp", [-1, 1]], ["auto_unroll_max_step", "ot", 512], ["unroll_explicit", "ot", 1]]}], "r": [[3.142844767210505e-05, 3.146623119777159e-05, 3.148899960206924e-05, 3.149302029446876e-05, 3.152974240615466e-05, 3.153818861918026e-05, 3.1554146173232525e-05, 3.1634306671972406e-05], 0, 24.322300910949707, 1577058193.2497644], "v": 0.1}
{"i": ["cuda -model=unknown", "topi_nn_conv2d", [["TENSOR", [8, 32, 28, 28], "float32"], ["TENSOR", [192, 32, 1, 1], "float32"], [1, 1], [0, 0], [1, 1], "NCHW", "float32"], {}, ["conv2d", [8, 32, 28, 28, "float32"], [192, 32, 1, 1, "float32"], [1, 1], [0, 0], [1, 1], "NCHW", "float32"], {"i": 15287493, "t": "direct", "c": null, "e": [["tile_f", "sp", [-1, 1, 8, 3]], ["tile_y", "sp", [-1, 1, 1, 2]], ["tile_x", "sp", [-1, 1, 28, 1]], ["tile_rc", "sp", [-1, 16]], ["tile_ry", "sp", [-1, 1]], ["tile_rx", "sp", [-1, 1]], ["auto_unroll_max_step", "ot", 512], ["unroll_explicit", "ot", 1]]}], "r": [[2.5667207573482084e-05, 2.5780096009440036e-05, 2.5786979618107702e-05, 2.5799740506329115e-05, 2.5808542909246945e-05, 2.5808670349710363e-05, 2.5820789101051276e-05, 2.5872650504183653e-05], 0, 21.165749073028564, 1577059807.9907591], "v": 0.1}
{"i": ["cuda -model=unknown", "topi_nn_depthwise_conv2d_nchw", [["TENSOR", [8, 192, 28, 28], "float32"], ["TENSOR", [192, 1, 3, 3], "float32"], [2, 2], [1, 1], [1, 1], "float32"], {}, ["depthwise_conv2d_nchw", [8, 192, 28, 28, "float32"], [192, 1, 3, 3, "float32"], [2, 2], [1, 1], [1, 1], "float32"], {"i": 476868, "t": "direct", "c": null, "e": [["tile_f", "sp", [-1, 1, 1, 2]], ["tile_y", "sp", [-1, 1, 7, 2]], ["tile_x", "sp", [-1, 1, 14, 1]], ["auto_unroll_max_step", "ot", 1500], ["unroll_explicit", "ot", 1]]}], "r": [[3.1763851004759385e-05, 3.1770004494976205e-05, 3.1777092675832893e-05, 3.178300066102591e-05, 3.17909276837652e-05, 3.1797302088841884e-05, 3.180947435219461e-05, 3.181597501322052e-05], 0, 12.726351022720337, 1577061551.003724], "v": 0.1}
{"i": ["cuda -model=unknown", "topi_nn_conv2d", [["TENSOR", [8, 192, 14, 14], "float32"], ["TENSOR", [64, 192, 1, 1], "float32"], [1, 1], [0, 0], [1, 1], "NCHW", "float32"], {}, ["conv2d", [8, 192, 14, 14, "float32"], [64, 192, 1, 1, "float32"], [1, 1], [0, 0], [1, 1], "NCHW", "float32"], {"i": 1692476, "t": "direct", "c": null, "e": [["tile_f", "sp", [-1, 2, 8, 2]], ["tile_y", "sp", [-1, 1, 2, 1]], ["tile_x", "sp", [-1, 1, 7, 2]], ["tile_rc", "sp", [-1, 24]], ["tile_ry", "sp", [-1, 1]], ["tile_rx", "sp", [-1, 1]], ["auto_unroll_max_step", "ot", 1500], ["unroll_explicit", "ot", 1]]}], "r": [[1.523153599740091e-05, 1.523222391163093e-05, 1.523312001299545e-05, 1.5233745419103314e-05, 1.5234619168291098e-05, 1.523627257959714e-05, 1.5236481611435997e-05, 1.5237268291098115e-05], 0, 24.46720051765442, 1577063015.4099426], "v": 0.1}
{"i": ["cuda -model=unknown", "topi_nn_conv2d", [["TENSOR", [8, 384, 14, 14], "float32"], ["TENSOR", [64, 384, 1, 1], "float32"], [1, 1], [0, 0], [1, 1], "NCHW", "float32"], {}, ["conv2d", [8, 384, 14, 14, "float32"], [64, 384, 1, 1, "float32"], [1, 1], [0, 0], [1, 1], "NCHW", "float32"], {"i": 1907516, "t": "direct", "c": null, "e": [["tile_f", "sp", [-1, 2, 8, 2]], ["tile_y", "sp", [-1, 1, 2, 1]], ["tile_x", "sp", [-1, 1, 7, 2]], ["tile_rc", "sp", [-1, 24]], ["tile_ry", "sp", [-1, 1]], ["tile_rx", "sp", [-1, 1]], ["auto_unroll_max_step", "ot", 1500], ["unroll_explicit", "ot", 1]]}], "r": [[2.7104173504079783e-05, 2.7104218041704443e-05, 2.7104731754306438e-05, 2.710505575702629e-05, 2.7106652538531277e-05, 2.7108722461468724e-05, 2.711186536718042e-05, 2.711198470081596e-05], 0, 24.56200408935547, 1577064708.7898057], "v": 0.1}
{"i": ["cuda -model=unknown", "topi_nn_conv2d", [["TENSOR", [8, 64, 14, 14], "float32"], ["TENSOR", [384, 64, 1, 1], "float32"], [1, 1], [0, 0], [1, 1], "NCHW", "float32"], {}, ["conv2d", [8, 64, 14, 14, "float32"], [384, 64, 1, 1, "float32"], [1, 1], [0, 0], [1, 1], "NCHW", "float32"], {"i": 4733323, "t": "direct", "c": null, "e": [["tile_f", "sp", [-1, 8, 4, 1]], ["tile_y", "sp", [-1, 7, 2, 1]], ["tile_x", "sp", [-1, 1, 14, 1]], ["tile_rc", "sp", [-1, 8]], ["tile_ry", "sp", [-1, 1]], ["tile_rx", "sp", [-1, 1]], ["auto_unroll_max_step", "ot", 1500], ["unroll_explicit", "ot", 1]]}], "r": [[1.9784056151313012e-05, 1.9785875453854596e-05, 1.9787038588195558e-05, 1.9787638520645105e-05, 1.9790801654986068e-05, 1.9790973739761883e-05, 1.9792394916828507e-05, 1.979556404627206e-05], 0, 18.558823823928833, 1577066491.66608], "v": 0.1}
{"i": ["cuda -model=unknown", "topi_nn_depthwise_conv2d_nchw", [["TENSOR", [8, 384, 14, 14], "float32"], ["TENSOR", [384, 1, 3, 3], "float32"], [1, 1], [1, 1], [1, 1], "float32"], {}, ["depthwise_conv2d_nchw", [8, 384, 14, 14, "float32"], [384, 1, 3, 3, "float32"], [1, 1], [1, 1], [1, 1], "float32"], {"i": 559696, "t": "direct", "c": null, "e": [["tile_f", "sp", [-1, 1, 2, 1]], ["tile_y", "sp", [-1, 1, 2, 7]], ["tile_x", "sp", [-1, 1, 14, 1]], ["auto_unroll_max_step", "ot", 256], ["unroll_explicit", "ot", 1]]}], "r": [[2.4591763803049033e-05, 2.4593488051091884e-05, 2.4593998351874742e-05, 2.4606124845488258e-05, 2.4607122785331683e-05, 2.4675283168520807e-05, 2.4724753090234856e-05, 2.4803031726411208e-05], 0, 19.9319806098938, 1577068190.5743427], "v": 0.1}
{"i": ["cuda -model=unknown", "topi_nn_conv2d", [["TENSOR", [8, 384, 14, 14], "float32"], ["TENSOR", [96, 384, 1, 1], "float32"], [1, 1], [0, 0], [1, 1], "NCHW", "float32"], {}, ["conv2d", [8, 384, 14, 14, "float32"], [96, 384, 1, 1, "float32"], [1, 1], [0, 0], [1, 1], "NCHW", "float32"], {"i": 4154797, "t": "direct", "c": null, "e": [["tile_f", "sp", [-1, 6, 8, 1]], ["tile_y", "sp", [-1, 1, 2, 1]], ["tile_x", "sp", [-1, 2, 7, 1]], ["tile_rc", "sp", [-1, 24]], ["tile_ry", "sp", [-1, 1]], ["tile_rx", "sp", [-1, 1]], ["auto_unroll_max_step", "ot", 512], ["unroll_explicit", "ot", 1]]}], "r": [[3.461854668630339e-05, 3.463162179675994e-05, 3.463527525773196e-05, 3.4637909867452134e-05, 3.470426288659794e-05, 3.470739558173785e-05, 3.470866318114875e-05, 3.472387982326951e-05], 0, 6.891187429428101, 1577069912.342446], "v": 0.1}
{"i": ["cuda -model=unknown", "topi_nn_conv2d", [["TENSOR", [8, 576, 14, 14], "float32"], ["TENSOR", [96, 576, 1, 1], "float32"], [1, 1], [0, 0], [1, 1], "NCHW", "float32"], {}, ["conv2d", [8, 576, 14, 14, "float32"], [96, 576, 1, 1, "float32"], [1, 1], [0, 0], [1, 1], "NCHW", "float32"], {"i": 5430701, "t": "direct", "c": null, "e": [["tile_f", "sp", [-1, 6, 8, 1]], ["tile_y", "sp", [-1, 1, 2, 1]], ["tile_x", "sp", [-1, 1, 7, 2]], ["tile_rc", "sp", [-1, 24]], ["tile_ry", "sp", [-1, 1]], ["tile_rx", "sp", [-1, 1]], ["auto_unroll_max_step", "ot", 512], ["unroll_explicit", "ot", 1]]}], "r": [[4.9222830204422194e-05, 4.9231537546933666e-05, 4.9259656862745095e-05, 4.927378639966625e-05, 4.9287508969545266e-05, 4.929806925323321e-05, 4.938426387150605e-05, 4.93953310387985e-05], 0, 6.5696797370910645, 1577071960.985715], "v": 0.1}
{"i": ["cuda -model=unknown", "topi_nn_conv2d", [["TENSOR", [8, 96, 14, 14], "float32"], ["TENSOR", [576, 96, 1, 1], "float32"], [1, 1], [0, 0], [1, 1], "NCHW", "float32"], {}, ["conv2d", [8, 96, 14, 14, "float32"], [576, 96, 1, 1, "float32"], [1, 1], [0, 0], [1, 1], "NCHW", "float32"], {"i": 3767896, "t": "direct", "c": null, "e": [["tile_f", "sp", [-1, 1, 4, 6]], ["tile_y", "sp", [-1, 7, 2, 1]], ["tile_x", "sp", [-1, 1, 14, 1]], ["tile_rc", "sp", [-1, 8]], ["tile_ry", "sp", [-1, 1]], ["tile_rx", "sp", [-1, 1]], ["auto_unroll_max_step", "ot", 512], ["unroll_explicit", "ot", 0]]}], "r": [[4.0616557446062094e-05, 4.0650350815646375e-05, 4.068101473425715e-05, 4.06991383967725e-05, 4.075791492720575e-05, 4.0799126819856164e-05, 4.0825016137519736e-05, 4.0832094544816696e-05], 0, 6.116156578063965, 1577074245.0034497], "v": 0.1}
{"i": ["cuda -model=unknown", "topi_nn_depthwise_conv2d_nchw", [["TENSOR", [8, 576, 14, 14], "float32"], ["TENSOR", [576, 1, 3, 3], "float32"], [2, 2], [1, 1], [1, 1], "float32"], {}, ["depthwise_conv2d_nchw", [8, 576, 14, 14, "float32"], [576, 1, 3, 3, "float32"], [2, 2], [1, 1], [1, 1], "float32"], {"i": 76440, "t": "direct", "c": null, "e": [["tile_f", "sp", [-1, 1, 1, 1]], ["tile_y", "sp", [-1, 1, 1, 7]], ["tile_x", "sp", [-1, 1, 7, 1]], ["auto_unroll_max_step", "ot", 1500], ["unroll_explicit", "ot", 1]]}], "r": [[2.6108463751438433e-05, 2.6112443843498274e-05, 2.6118005868814728e-05, 2.612111979286536e-05, 2.6160622094361336e-05, 2.6226580667433833e-05, 2.6232252589182967e-05, 2.6280418757192173e-05], 0, 6.775911569595337, 1577076018.7019913], "v": 0.1}
{"i": ["cuda -model=unknown", "topi_nn_conv2d", [["TENSOR", [8, 576, 7, 7], "float32"], ["TENSOR", [160, 576, 1, 1], "float32"], [1, 1], [0, 0], [1, 1], "NCHW", "float32"], {}, ["conv2d", [8, 576, 7, 7, "float32"], [160, 576, 1, 1, "float32"], [1, 1], [0, 0], [1, 1], "NCHW", "float32"], {"i": 414415, "t": "direct", "c": null, "e": [["tile_f", "sp", [-1, 5, 2, 1]], ["tile_y", "sp", [-1, 1, 7, 1]], ["tile_x", "sp", [-1, 1, 7, 1]], ["tile_rc", "sp", [-1, 24]], ["tile_ry", "sp", [-1, 1]], ["tile_rx", "sp", [-1, 1]], ["auto_unroll_max_step", "ot", 1500], ["unroll_explicit", "ot", 1]]}], "r": [[4.3834081568771866e-05, 4.3842779598600626e-05, 4.3861865402320015e-05, 4.386188050082857e-05, 4.386282470999816e-05, 4.386499907935923e-05, 4.38699972380777e-05, 4.389224212852145e-05], 0, 18.242265224456787, 1577077095.7741208], "v": 0.1}
{"i": ["cuda -model=unknown", "topi_nn_conv2d", [["TENSOR", [8, 960, 7, 7], "float32"], ["TENSOR", [160, 960, 1, 1], "float32"], [1, 1], [0, 0], [1, 1], "NCHW", "float32"], {}, ["conv2d", [8, 960, 7, 7, "float32"], [160, 960, 1, 1, "float32"], [1, 1], [0, 0], [1, 1], "NCHW", "float32"], {"i": 536321, "t": "direct", "c": null, "e": [["tile_f", "sp", [-1, 4, 1, 2]], ["tile_y", "sp", [-1, 1, 7, 1]], ["tile_x", "sp", [-1, 1, 7, 1]], ["tile_rc", "sp", [-1, 15]], ["tile_ry", "sp", [-1, 1]], ["tile_rx", "sp", [-1, 1]], ["auto_unroll_max_step", "ot", 1500], ["unroll_explicit", "ot", 1]]}], "r": [[6.4000689858175e-05, 6.400274391222906e-05, 6.400405485683704e-05, 6.401103559004549e-05, 6.40133786459727e-05, 6.402129007225047e-05, 6.402430532512712e-05, 6.402782793684773e-05], 0, 19.17388677597046, 1577079077.3417273], "v": 0.1}
{"i": ["cuda -model=unknown", "topi_nn_conv2d", [["TENSOR", [8, 160, 7, 7], "float32"], ["TENSOR", [960, 160, 1, 1], "float32"], [1, 1], [0, 0], [1, 1], "NCHW", "float32"], {}, ["conv2d", [8, 160, 7, 7, "float32"], [960, 160, 1, 1, "float32"], [1, 1], [0, 0], [1, 1], "NCHW", "float32"], {"i": 1434208, "t": "direct", "c": null, "e": [["tile_f", "sp", [-1, 4, 16, 1]], ["tile_y", "sp", [-1, 1, 1, 7]], ["tile_x", "sp", [-1, 1, 7, 1]], ["tile_rc", "sp", [-1, 16]], ["tile_ry", "sp", [-1, 1]], ["tile_rx", "sp", [-1, 1]], ["auto_unroll_max_step", "ot", 1500], ["unroll_explicit", "ot", 1]]}], "r": [[3.48041003798948e-05, 3.480448056691993e-05, 3.480857305669199e-05, 3.480859614260666e-05, 3.480969783752192e-05, 3.481210169491526e-05, 3.481237156633548e-05, 3.481531516656926e-05], 0, 31.684184789657593, 1577080901.030168], "v": 0.1}
{"i": ["cuda -model=unknown", "topi_nn_depthwise_conv2d_nchw", [["TENSOR", [8, 960, 7, 7], "float32"], ["TENSOR", [960, 1, 3, 3], "float32"], [1, 1], [1, 1], [1, 1], "float32"], {}, ["depthwise_conv2d_nchw", [8, 960, 7, 7, "float32"], [960, 1, 3, 3, "float32"], [1, 1], [1, 1], [1, 1], "float32"], {"i": 99897, "t": "direct", "c": null, "e": [["tile_f", "sp", [-1, 1, 1, 3]], ["tile_y", "sp", [-1, 1, 7, 1]], ["tile_x", "sp", [-1, 1, 7, 1]], ["auto_unroll_max_step", "ot", 256], ["unroll_explicit", "ot", 1]]}], "r": [[1.3741140247841663e-05, 1.3741577494567452e-05, 1.374161020731779e-05, 1.374192453162624e-05, 1.3742197098725553e-05, 1.3742983379338697e-05, 1.3743329183062196e-05, 1.3743398543489752e-05], 0, 28.37011408805847, 1577082597.7219343], "v": 0.1}
{"i": ["cuda -model=unknown", "topi_nn_conv2d", [["TENSOR", [8, 960, 7, 7], "float32"], ["TENSOR", [320, 960, 1, 1], "float32"], [1, 1], [0, 0], [1, 1], "NCHW", "float32"], {}, ["conv2d", [8, 960, 7, 7, "float32"], [320, 960, 1, 1, "float32"], [1, 1], [0, 0], [1, 1], "NCHW", "float32"], {"i": 804851, "t": "direct", "c": null, "e": [["tile_f", "sp", [-1, 1, 16, 2]], ["tile_y", "sp", [-1, 1, 1, 7]], ["tile_x", "sp", [-1, 1, 7, 1]], ["tile_rc", "sp", [-1, 15]], ["tile_ry", "sp", [-1, 1]], ["tile_rx", "sp", [-1, 1]], ["auto_unroll_max_step", "ot", 1500], ["unroll_explicit", "ot", 1]]}], "r": [[0.00010123226318009279, 0.00010125099493884437, 0.00010125151834668916, 0.00010125188443694643, 0.00010127882918599748, 0.00010128709405314213, 0.00010129502404048924, 0.00010131703247574863], 0, 40.078184843063354, 1577085516.2485526], "v": 0.1}
{"i": ["cuda -model=unknown", "topi_nn_conv2d", [["TENSOR", [8, 320, 7, 7], "float32"], ["TENSOR", [1280, 320, 1, 1], "float32"], [1, 1], [0, 0], [1, 1], "NCHW", "float32"], {}, ["conv2d", [8, 320, 7, 7, "float32"], [1280, 320, 1, 1, "float32"], [1, 1], [0, 0], [1, 1], "NCHW", "float32"], {"i": 798241, "t": "direct", "c": null, "e": [["tile_f", "sp", [-1, 2, 16, 4]], ["tile_y", "sp", [-1, 7, 1, 1]], ["tile_x", "sp", [-1, 1, 7, 1]], ["tile_rc", "sp", [-1, 10]], ["tile_ry", "sp", [-1, 1]], ["tile_rx", "sp", [-1, 1]], ["auto_unroll_max_step", "ot", 1500], ["unroll_explicit", "ot", 1]]}], "r": [[7.538858774474257e-05, 7.53982291515591e-05, 7.539948042059464e-05, 7.541244778825236e-05, 7.541432596084118e-05, 7.541997897026831e-05, 7.543684300217549e-05, 7.544389738941262e-05], 0, 4.084026575088501, 1577087984.0792356], "v": 0.1}
{"i": ["cuda -model=unknown", "topi_nn_dense", [["TENSOR", [8, 1280], "float32"], ["TENSOR", [1000, 1280], "float32"], null, "float32"], {}, ["dense", [8, 1280, "float32"], [1000, 1280, "float32"], 0, "float32"], {"i": 15, "t": "direct", "c": null, "e": [["tile_k", "sp", [-1, 320]]]}], "r": [[0.00016843751947148816, 0.00016859290820584144, 0.00016859392350486788, 0.0001685963602225313, 0.0001686155542420028, 0.00016863228442280946, 0.00016863876008344923, 0.00016869267454798332], 0, 6.655681848526001, 1577089208.2909489], "v": 0.1}
