mytophub/20191227/mobilenet_v2_bs_1.log
{"i": ["cuda -model=unknown", "topi_nn_depthwise_conv2d_nchw", [["TENSOR", [1, 576, 14, 14], "float32"], ["TENSOR", [576, 1, 3, 3], "float32"], [1, 1], [1, 1], [1, 1], "float32"], {}, ["depthwise_conv2d_nchw", [1, 576, 14, 14, "float32"], [576, 1, 3, 3, "float32"], [1, 1], [1, 1], [1, 1], "float32"], {"i": 1186920, "t": "direct", "c": null, "e": [["tile_f", "sp", [-1, 1, 1, 1]], ["tile_y", "sp", [-1, 7, 2, 1]], ["tile_x", "sp", [-1, 1, 14, 1]], ["auto_unroll_max_step", "ot", 1500], ["unroll_explicit", "ot", 1]]}], "r": [[4.256162015643442e-06, 4.2563126487827325e-06, 4.256411190461901e-06, 4.2567419032187085e-06, 4.2567880933805435e-06, 4.256937226189762e-06, 4.257065054311949e-06, 4.2571571145652045e-06], 0, 29.913546562194824, 1577083282.9573474], "v": 0.1}
{"i": ["cuda -model=unknown", "topi_nn_depthwise_conv2d_nchw", [["TENSOR", [1, 192, 28, 28], "float32"], ["TENSOR", [192, 1, 3, 3], "float32"], [1, 1], [1, 1], [1, 1], "float32"], {}, ["depthwise_conv2d_nchw", [1, 192, 28, 28, "float32"], [192, 1, 3, 3, "float32"], [1, 1], [1, 1], [1, 1], "float32"], {"i": 2924880, "t": "direct", "c": null, "e": [["tile_f", "sp", [-1, 1, 1, 1]], ["tile_y", "sp", [-1, 2, 7, 2]], ["tile_x", "sp", [-1, 1, 28, 1]], ["auto_unroll_max_step", "ot", 1500], ["unroll_explicit", "ot", 1]]}], "r": [[4.766426336721167e-06, 4.767010649580203e-06, 4.768153557224922e-06, 4.768980357931949e-06, 4.7780454264251e-06, 4.7780648475475036e-06, 4.778221718957137e-06, 4.778257909854176e-06], 0, 5.5999884605407715, 1577084138.5747097], "v": 0.1}
{"i": ["cuda -model=unknown", "topi_nn_depthwise_conv2d_nchw", [["TENSOR", [1, 144, 56, 56], "float32"], ["TENSOR", [144, 1, 3, 3], "float32"], [1, 1], [1, 1], [1, 1], "float32"], {}, ["depthwise_conv2d_nchw", [1, 144, 56, 56, "float32"], [144, 1, 3, 3, "float32"], [1, 1], [1, 1], [1, 1], "float32"], {"i": 12007450, "t": "direct", "c": null, "e": [["tile_f", "sp", [-1, 1, 1, 1]], ["tile_y", "sp", [-1, 1, 1, 8]], ["tile_x", "sp", [-1, 2, 28, 1]], ["auto_unroll_max_step", "ot", 1500], ["unroll_explicit", "ot", 1]]}], "r": [[1.3898894137096298e-05, 1.38993009387731e-05, 1.389971016118557e-05, 1.3901035366357678e-05, 1.3901307787683769e-05, 1.3901483970006496e-05, 1.3902622955659207e-05, 1.3903008561138335e-05], 0, 33.551636695861816, 1577085863.0345652], "v": 0.1}
{"i": ["cuda -model=unknown", "topi_nn_conv2d", [["TENSOR", [1, 3, 224, 224], "float32"], ["TENSOR", [32, 3, 3, 3], "float32"], [2, 2], [1, 1], [1, 1], "NCHW", "float32"], {}, ["conv2d", [1, 3, 224, 224, "float32"], [32, 3, 3, 3, "float32"], [2, 2], [1, 1], [1, 1], "NCHW", "float32"], {"i": 42004105, "t": "direct", "c": null, "e": [["tile_f", "sp", [-1, 4, 8, 1]], ["tile_y", "sp", [-1, 1, 1, 7]], ["tile_x", "sp", [-1, 1, 16, 1]], ["tile_rc", "sp", [-1, 1]], ["tile_ry", "sp", [-1, 3]], ["tile_rx", "sp", [-1, 3]], ["auto_unroll_max_step", "ot", 512], ["unroll_explicit", "ot", 1]]}], "r": [[8.649715312597063e-06, 8.649995207880374e-06, 8.650231042286018e-06, 8.650303412166658e-06, 8.650794648799752e-06, 8.65089208856547e-06, 8.650967830678439e-06, 8.651983626924612e-06], 0, 7.5378313064575195, 1577088139.3531494], "v": 0.1}
{"i": ["cuda -model=unknown", "topi_nn_depthwise_conv2d_nchw", [["TENSOR", [1, 32, 112, 112], "float32"], ["TENSOR", [32, 1, 3, 3], "float32"], [1, 1], [1, 1], [1, 1], "float32"], {}, ["depthwise_conv2d_nchw", [1, 32, 112, 112, "float32"], [32, 1, 3, 3, "float32"], [1, 1], [1, 1], [1, 1], "float32"], {"i": 5830328, "t": "direct", "c": null, "e": [["tile_f", "sp", [-1, 1, 1, 1]], ["tile_y", "sp", [-1, 1, 1, 7]], ["tile_x", "sp", [-1, 2, 56, 1]], ["auto_unroll_max_step", "ot", 1500], ["unroll_explicit", "ot", 1]]}], "r": [[7.183194829237152e-06, 7.1835263006702835e-06, 7.183646632620491e-06, 7.183808266836898e-06, 7.184015544206831e-06, 7.184131790616023e-06, 7.184360293648261e-06, 7.185253814235557e-06], 0, 6.09515643119812, 1577089519.9242003], "v": 0.1}
{"i": ["cuda -model=unknown", "topi_nn_conv2d", [["TENSOR", [1, 32, 112, 112], "float32"], ["TENSOR", [16, 32, 1, 1], "float32"], [1, 1], [0, 0], [1, 1], "NCHW", "float32"], {}, ["conv2d", [1, 32, 112, 112, "float32"], [16, 32, 1, 1, "float32"], [1, 1], [0, 0], [1, 1], "NCHW", "float32"], {"i": 18703358, "t": "direct", "c": null, "e": [["tile_f", "sp", [-1, 2, 4, 2]], ["tile_y", "sp", [-1, 2, 1, 1]], ["tile_x", "sp", [-1, 1, 16, 1]], ["tile_rc", "sp", [-1, 8]], ["tile_ry", "sp", [-1, 1]], ["tile_rx", "sp", [-1, 1]], ["auto_unroll_max_step", "ot", 512], ["unroll_explicit", "ot", 1]]}], "r": [[5.841753497942387e-06, 5.844725778953556e-06, 5.84535681951793e-06, 5.8472145502645506e-06, 5.848550235155791e-06, 5.8599458847736625e-06, 5.879950323339213e-06, 5.883456643151088e-06], 0, 3.213482618331909, 1577091945.6474025], "v": 0.1}
{"i": ["cuda -model=unknown", "topi_nn_depthwise_conv2d_nchw", [["TENSOR", [1, 96, 112, 112], "float32"], ["TENSOR", [96, 1, 3, 3], "float32"], [2, 2], [1, 1], [1, 1], "float32"], {}, ["depthwise_conv2d_nchw", [1, 96, 112, 112, "float32"], [96, 1, 3, 3, "float32"], [2, 2], [1, 1], [1, 1], "float32"], {"i": 6254976, "t": "direct", "c": null, "e": [["tile_f", "sp", [-1, 1, 1, 1]], ["tile_y", "sp", [-1, 8, 1, 1]], ["tile_x", "sp", [-1, 1, 56, 1]], ["auto_unroll_max_step", "ot", 256], ["unroll_explicit", "ot", 1]]}], "r": [[2.895801455427532e-05, 2.8958062704669497e-05, 2.8958580715585204e-05, 2.8958952819890844e-05, 2.8959407155852035e-05, 2.896004499696786e-05, 2.8960418071558523e-05, 2.8960928320194055e-05], 0, 17.70728850364685, 1577095402.1052015], "v": 0.1}
{"i": ["cuda -model=unknown", "topi_nn_conv2d", [["TENSOR", [1, 96, 56, 56], "float32"], ["TENSOR", [24, 96, 1, 1], "float32"], [1, 1], [0, 0], [1, 1], "NCHW", "float32"], {}, ["conv2d", [1, 96, 56, 56, "float32"], [24, 96, 1, 1, "float32"], [1, 1], [0, 0], [1, 1], "NCHW", "float32"], {"i": 34401177, "t": "direct", "c": null, "e": [["tile_f", "sp", [-1, 1, 8, 3]], ["tile_y", "sp", [-1, 1, 4, 1]], ["tile_x", "sp", [-1, 2, 4, 1]], ["tile_rc", "sp", [-1, 16]], ["tile_ry", "sp", [-1, 1]], ["tile_rx", "sp", [-1, 1]], ["auto_unroll_max_step", "ot", 1500], ["unroll_explicit", "ot", 1]]}], "r": [[7.162611532792926e-06, 7.163162196020634e-06, 7.163197089167281e-06, 7.163887214443626e-06, 7.164199926308032e-06, 7.164350921149594e-06, 7.164514627855563e-06, 7.178308843036109e-06], 0, 3.538969039916992, 1577098448.371999], "v": 0.1}
{"i": ["cuda -model=unknown", "topi_nn_conv2d", [["TENSOR", [1, 144, 56, 56], "float32"], ["TENSOR", [24, 144, 1, 1], "float32"], [1, 1], [0, 0], [1, 1], "NCHW", "float32"], {}, ["conv2d", [1, 144, 56, 56, "float32"], [24, 144, 1, 1, "float32"], [1, 1], [0, 0], [1, 1], "NCHW", "float32"], {"i": 19597577, "t": "direct", "c": null, "e": [["tile_f", "sp", [-1, 1, 8, 3]], ["tile_y", "sp", [-1, 2, 2, 1]], ["tile_x", "sp", [-1, 1, 8, 1]], ["tile_rc", "sp", [-1, 16]], ["tile_ry", "sp", [-1, 1]], ["tile_rx", "sp", [-1, 1]], ["auto_unroll_max_step", "ot", 1500], ["unroll_explicit", "ot", 0]]}], "r": [[9.574150888610764e-06, 9.574410463078848e-06, 9.574568911138924e-06, 9.575588035043805e-06, 9.5759211514393e-06, 9.577087058823529e-06, 9.580039499374217e-06, 9.580816821026283e-06], 0, 3.36997127532959, 1577100212.032417], "v": 0.1}
{"i": ["cuda -model=unknown", "topi_nn_conv2d", [["TENSOR", [1, 24, 56, 56], "float32"], ["TENSOR", [144, 24, 1, 1], "float32"], [1, 1], [0, 0], [1, 1], "NCHW", "float32"], {}, ["conv2d", [1, 24, 56, 56, "float32"], [144, 24, 1, 1, "float32"], [1, 1], [0, 0], [1, 1], "NCHW", "float32"], {"i": 32172392, "t": "direct", "c": null, "e": [["tile_f", "sp", [-1, 9, 4, 1]], ["tile_y", "sp", [-1, 2, 1, 1]], ["tile_x", "sp", [-1, 1, 56, 1]], ["tile_rc", "sp", [-1, 12]], ["tile_ry", "sp", [-1, 1]], ["tile_rx", "sp", [-1, 1]], ["auto_unroll_max_step", "ot", 512], ["unroll_explicit", "ot", 0]]}], "r": [[7.403441449198569e-06, 7.403902404291959e-06, 7.404091336600874e-06, 7.404116671082263e-06, 7.404120380182806e-06, 7.404631441250497e-06, 7.40475384156842e-06, 7.405115545105312e-06], 0, 11.287461757659912, 1577104116.1376636], "v": 0.1}
{"i": ["cuda -model=unknown", "topi_nn_depthwise_conv2d_nchw", [["TENSOR", [1, 144, 56, 56], "float32"], ["TENSOR", [144, 1, 3, 3], "float32"], [2, 2], [1, 1], [1, 1], "float32"], {}, ["depthwise_conv2d_nchw", [1, 144, 56, 56, "float32"], [144, 1, 3, 3, "float32"], [2, 2], [1, 1], [1, 1], "float32"], {"i": 3038700, "t": "direct", "c": null, "e": [["tile_f", "sp", [-1, 1, 1, 1]], ["tile_y", "sp", [-1, 4, 1, 1]], ["tile_x", "sp", [-1, 1, 28, 1]], ["auto_unroll_max_step", "ot", 1500], ["unroll_explicit", "ot", 1]]}], "r": [[5.2229270524166105e-06, 5.228248985704561e-06, 5.250097699115044e-06, 5.277759700476515e-06, 5.278095112321307e-06, 5.2993250374404354e-06, 5.299374976174268e-06, 5.4285359564329475e-06], 0, 3.1553022861480713, 1577105674.5875518], "v": 0.1}
{"i": ["cuda -model=unknown", "topi_nn_conv2d", [["TENSOR", [1, 144, 28, 28], "float32"], ["TENSOR", [32, 144, 1, 1], "float32"], [1, 1], [0, 0], [1, 1], "NCHW", "float32"], {}, ["conv2d", [1, 144, 28, 28, "float32"], [32, 144, 1, 1, "float32"], [1, 1], [0, 0], [1, 1], "NCHW", "float32"], {"i": 6688659, "t": "direct", "c": null, "e": [["tile_f", "sp", [-1, 2, 16, 1]], ["tile_y", "sp", [-1, 1, 1, 1]], ["tile_x", "sp", [-1, 1, 14, 2]], ["tile_rc", "sp", [-1, 144]], ["tile_ry", "sp", [-1, 1]], ["tile_rx", "sp", [-1, 1]], ["auto_unroll_max_step", "ot", 512], ["unroll_explicit", "ot", 1]]}], "r": [[5.958930087524424e-06, 5.959027542089344e-06, 5.95940464655657e-06, 5.959563475281711e-06, 5.959722678729156e-06, 5.959848344530393e-06, 5.959906399721635e-06, 5.960143732769466e-06], 0, 5.992655277252197, 1577107250.3644614], "v": 0.1}
{"i": ["cuda -model=unknown", "topi_nn_conv2d", [["TENSOR", [1, 192, 28, 28], "float32"], ["TENSOR", [32, 192, 1, 1], "float32"], [1, 1], [0, 0], [1, 1], "NCHW", "float32"], {}, ["conv2d", [1, 192, 28, 28, "float32"], [32, 192, 1, 1, "float32"], [1, 1], [0, 0], [1, 1], "NCHW", "float32"], {"i": 7011627, "t": "direct", "c": null, "e": [["tile_f", "sp", [-1, 1, 16, 2]], ["tile_y", "sp", [-1, 2, 2, 1]], ["tile_x", "sp", [-1, 1, 4, 1]], ["tile_rc", "sp", [-1, 24]], ["tile_ry", "sp", [-1, 1]], ["tile_rx", "sp", [-1, 1]], ["auto_unroll_max_step", "ot", 1500], ["unroll_explicit", "ot", 1]]}], "r": [[7.046878329846038e-06, 7.0474393991443115e-06, 7.048045282783174e-06, 7.049342868742388e-06, 7.050769776084444e-06, 7.0512095499828235e-06, 7.051481465288404e-06, 7.051635926423285e-06], 0, 9.481719732284546, 1577111353.3867362], "v": 0.1}
{"i": ["cuda -model=unknown", "topi_nn_conv2d", [["TENSOR", [1, 32, 28, 28], "float32"], ["TENSOR", [192, 32, 1, 1], "float32"], [1, 1], [0, 0], [1, 1], "NCHW", "float32"], {}, ["conv2d", [1, 32, 28, 28, "float32"], [192, 32, 1, 1, "float32"], [1, 1], [0, 0], [1, 1], "NCHW", "float32"], {"i": 8292977, "t": "direct", "c": null, "e": [["tile_f", "sp", [-1, 2, 4, 3]], ["tile_y", "sp", [-1, 2, 1, 1]], ["tile_x", "sp", [-1, 1, 28, 1]], ["tile_rc", "sp", [-1, 8]], ["tile_ry", "sp", [-1, 1]], ["tile_rx", "sp", [-1, 1]], ["auto_unroll_max_step", "ot", 1500], ["unroll_explicit", "ot", 0]]}], "r": [[4.898193303988262e-06, 4.898248446045085e-06, 4.898303854875284e-06, 4.898452794451113e-06, 4.898921942110178e-06, 4.8990147525676935e-06, 4.918776017073495e-06, 4.925037161531279e-06], 0, 3.0670552253723145, 1577112859.4634447], "v": 0.1}
{"i": ["cuda -model=unknown", "topi_nn_depthwise_conv2d_nchw", [["TENSOR", [1, 192, 28, 28], "float32"], ["TENSOR", [192, 1, 3, 3], "float32"], [2, 2], [1, 1], [1, 1], "float32"], {}, ["depthwise_conv2d_nchw", [1, 192, 28, 28, "float32"], [192, 1, 3, 3, "float32"], [2, 2], [1, 1], [1, 1], "float32"], {"i": 389760, "t": "direct", "c": null, "e": [["tile_f", "sp", [-1, 1, 1, 1]], ["tile_y", "sp", [-1, 1, 14, 1]], ["tile_x", "sp", [-1, 1, 14, 1]], ["auto_unroll_max_step", "ot", 256], ["unroll_explicit", "ot", 1]]}], "r": [[4.0862087758663674e-06, 4.097030491149339e-06, 4.098363525305411e-06, 4.136863924208427e-06, 4.175083071553229e-06, 4.194510022438295e-06, 4.1986394664672155e-06, 4.237582822238843e-06], 0, 2.86110258102417, 1577114034.9081006], "v": 0.1}
{"i": ["cuda -model=unknown", "topi_nn_conv2d", [["TENSOR", [1, 192, 14, 14], "float32"], ["TENSOR", [64, 192, 1, 1], "float32"], [1, 1], [0, 0], [1, 1], "NCHW", "float32"], {}, ["conv2d", [1, 192, 14, 14, "float32"], [64, 192, 1, 1, "float32"], [1, 1], [0, 0], [1, 1], "NCHW", "float32"], {"i": 1430039, "t": "direct", "c": null, "e": [["tile_f", "sp", [-1, 2, 16, 1]], ["tile_y", "sp", [-1, 1, 1, 1]], ["tile_x", "sp", [-1, 1, 14, 1]], ["tile_rc", "sp", [-1, 48]], ["tile_ry", "sp", [-1, 1]], ["tile_rx", "sp", [-1, 1]], ["auto_unroll_max_step", "ot", 512], ["unroll_explicit", "ot", 1]]}], "r": [[6.312398292531847e-06, 6.315889957178638e-06, 6.334382402843985e-06, 6.342390967116426e-06, 6.345885944359161e-06, 6.354949960949072e-06, 6.358513156122916e-06, 6.362491503056745e-06], 0, 11.796204328536987, 1577115071.6172433], "v": 0.1}
{"i": ["cuda -model=unknown", "topi_nn_conv2d", [["TENSOR", [1, 384, 14, 14], "float32"], ["TENSOR", [64, 384, 1, 1], "float32"], [1, 1], [0, 0], [1, 1], "NCHW", "float32"], {}, ["conv2d", [1, 384, 14, 14, "float32"], [64, 384, 1, 1, "float32"], [1, 1], [0, 0], [1, 1], "NCHW", "float32"], {"i": 1946135, "t": "direct", "c": null, "e": [["tile_f", "sp", [-1, 2, 16, 1]], ["tile_y", "sp", [-1, 1, 1, 1]], ["tile_x", "sp", [-1, 1, 14, 1]], ["tile_rc", "sp", [-1, 48]], ["tile_ry", "sp", [-1, 1]], ["tile_rx", "sp", [-1, 1]], ["auto_unroll_max_step", "ot", 1500], ["unroll_explicit", "ot", 1]]}], "r": [[1.0617377347559504e-05, 1.0620711388982766e-05, 1.0622015738907933e-05, 1.062692782310626e-05, 1.062701144208951e-05, 1.0627607879109737e-05, 1.0628751701829769e-05, 1.0630421474436345e-05], 0, 9.924859046936035, 1577116739.1119459], "v": 0.1}
{"i": ["cuda -model=unknown", "topi_nn_conv2d", [["TENSOR", [1, 64, 14, 14], "float32"], ["TENSOR", [384, 64, 1, 1], "float32"], [1, 1], [0, 0], [1, 1], "NCHW", "float32"], {}, ["conv2d", [1, 64, 14, 14, "float32"], [384, 64, 1, 1, "float32"], [1, 1], [0, 0], [1, 1], "NCHW", "float32"], {"i": 2273973, "t": "direct", "c": null, "e": [["tile_f", "sp", [-1, 1, 8, 3]], ["tile_y", "sp", [-1, 2, 1, 1]], ["tile_x", "sp", [-1, 1, 14, 1]], ["tile_rc", "sp", [-1, 16]], ["tile_ry", "sp", [-1, 1]], ["tile_rx", "sp", [-1, 1]], ["auto_unroll_max_step", "ot", 1500], ["unroll_explicit", "ot", 0]]}], "r": [[6.522165207756232e-06, 6.529184487534626e-06, 6.53598947368421e-06, 6.542384930747923e-06, 6.554154958448754e-06, 6.557132963988919e-06, 6.573822742382271e-06, 6.585809362880887e-06], 0, 9.513134241104126, 1577118703.810596], "v": 0.1}
{"i": ["cuda -model=unknown", "topi_nn_depthwise_conv2d_nchw", [["TENSOR", [1, 384, 14, 14], "float32"], ["TENSOR", [384, 1, 3, 3], "float32"], [1, 1], [1, 1], [1, 1], "float32"], {}, ["depthwise_conv2d_nchw", [1, 384, 14, 14, "float32"], [384, 1, 3, 3, "float32"], [1, 1], [1, 1], [1, 1], "float32"], {"i": 702736, "t": "direct", "c": null, "e": [["tile_f", "sp", [-1, 1, 2, 1]], ["tile_y", "sp", [-1, 1, 14, 1]], ["tile_x", "sp", [-1, 1, 7, 2]], ["auto_unroll_max_step", "ot", 1500], ["unroll_explicit", "ot", 1]]}], "r": [[3.632894071552672e-06, 3.6334047441761516e-06, 3.6334306102187713e-06, 3.633492890827217e-06, 3.6337781973548914e-06, 3.6338098783817322e-06, 3.633916941460128e-06, 3.6340649044427897e-06], 0, 10.450222969055176, 1577119442.6631932], "v": 0.1}
{"i": ["cuda -model=unknown", "topi_nn_conv2d", [["TENSOR", [1, 384, 14, 14], "float32"], ["TENSOR", [96, 384, 1, 1], "float32"], [1, 1], [0, 0], [1, 1], "NCHW", "float32"], {}, ["conv2d", [1, 384, 14, 14, "float32"], [96, 384, 1, 1, "float32"], [1, 1], [0, 0], [1, 1], "NCHW", "float32"], {"i": 5183408, "t": "direct", "c": null, "e": [["tile_f", "sp", [-1, 2, 12, 1]], ["tile_y", "sp", [-1, 1, 2, 1]], ["tile_x", "sp", [-1, 1, 7, 1]], ["tile_rc", "sp", [-1, 48]], ["tile_ry", "sp", [-1, 1]], ["tile_rx", "sp", [-1, 1]], ["auto_unroll_max_step", "ot", 1500], ["unroll_explicit", "ot", 1]]}], "r": [[1.1937419841393252e-05, 1.193864608925517e-05, 1.1938808272430416e-05, 1.1940988285906805e-05, 1.1941515627429637e-05, 1.1942867827709532e-05, 1.1943505882962732e-05, 1.1943663815891773e-05], 0, 6.855751991271973, 1577121202.8205402], "v": 0.1}
{"i": ["cuda -model=unknown", "topi_nn_conv2d", [["TENSOR", [1, 576, 14, 14], "float32"], ["TENSOR", [96, 576, 1, 1], "float32"], [1, 1], [0, 0], [1, 1], "NCHW", "float32"], {}, ["conv2d", [1, 576, 14, 14, "float32"], [96, 576, 1, 1, "float32"], [1, 1], [0, 0], [1, 1], "NCHW", "float32"], {"i": 1914794, "t": "direct", "c": null, "e": [["tile_f", "sp", [-1, 2, 8, 1]], ["tile_y", "sp", [-1, 1, 2, 1]], ["tile_x", "sp", [-1, 1, 7, 1]], ["tile_rc", "sp", [-1, 36]], ["tile_ry", "sp", [-1, 1]], ["tile_rx", "sp", [-1, 1]], ["auto_unroll_max_step", "ot", 512], ["unroll_explicit", "ot", 0]]}], "r": [[1.815036938931298e-05, 1.815235038167939e-05, 1.8153618702290078e-05, 1.815396404580153e-05, 1.8154230916030535e-05, 1.8159444351145038e-05, 1.8159473282442747e-05, 1.816900786259542e-05], 0, 6.211086988449097, 1577123092.1215918], "v": 0.1}
{"i": ["cuda -model=unknown", "topi_nn_depthwise_conv2d_nchw", [["TENSOR", [1, 576, 14, 14], "float32"], ["TENSOR", [576, 1, 3, 3], "float32"], [2, 2], [1, 1], [1, 1], "float32"], {}, ["depthwise_conv2d_nchw", [1, 576, 14, 14, "float32"], [576, 1, 3, 3, "float32"], [2, 2], [1, 1], [1, 1], "float32"], {"i": 62160, "t": "direct", "c": null, "e": [["tile_f", "sp", [-1, 1, 1, 1]], ["tile_y", "sp", [-1, 1, 7, 1]], ["tile_x", "sp", [-1, 1, 7, 1]], ["auto_unroll_max_step", "ot", 256], ["unroll_explicit", "ot", 1]]}], "r": [[3.9184910079619905e-06, 3.9185321727510625e-06, 3.918747796069115e-06, 3.9187520090569955e-06, 3.918796477422468e-06, 3.9188999461776875e-06, 3.918965163972457e-06, 3.91907824650619e-06], 0, 13.658522367477417, 1577127326.064711], "v": 0.1}
{"i": ["cuda -model=unknown", "topi_nn_conv2d", [["TENSOR", [1, 576, 7, 7], "float32"], ["TENSOR", [160, 576, 1, 1], "float32"], [1, 1], [0, 0], [1, 1], "NCHW", "float32"], {}, ["conv2d", [1, 576, 7, 7, "float32"], [160, 576, 1, 1, "float32"], [1, 1], [0, 0], [1, 1], "NCHW", "float32"], {"i": 197625, "t": "direct", "c": null, "e": [["tile_f", "sp", [-1, 1, 40, 1]], ["tile_y", "sp", [-1, 1, 7, 1]], ["tile_x", "sp", [-1, 1, 1, 1]], ["tile_rc", "sp", [-1, 48]], ["tile_ry", "sp", [-1, 1]], ["tile_rx", "sp", [-1, 1]], ["auto_unroll_max_step", "ot", 1500], ["unroll_explicit", "ot", 0]]}], "r": [[1.5496503255120033e-05, 1.549661311542113e-05, 1.549692092770921e-05, 1.5498575681540757e-05, 1.5498696527871966e-05, 1.5500766648582668e-05, 1.550101274922013e-05, 1.5501034789095347e-05], 0, 9.248530149459839, 1577128684.9711614], "v": 0.1}
{"i": ["cuda -model=unknown", "topi_nn_conv2d", [["TENSOR", [1, 960, 7, 7], "float32"], ["TENSOR", [160, 960, 1, 1], "float32"], [1, 1], [0, 0], [1, 1], "NCHW", "float32"], {}, ["conv2d", [1, 960, 7, 7, "float32"], [160, 960, 1, 1, "float32"], [1, 1], [0, 0], [1, 1], "NCHW", "float32"], {"i": 557369, "t": "direct", "c": null, "e": [["tile_f", "sp", [-1, 1, 40, 1]], ["tile_y", "sp", [-1, 1, 1, 1]], ["tile_x", "sp", [-1, 1, 7, 1]], ["tile_rc", "sp", [-1, 40]], ["tile_ry", "sp", [-1, 1]], ["tile_rx", "sp", [-1, 1]], ["auto_unroll_max_step", "ot", 1500], ["unroll_explicit", "ot", 1]]}], "r": [[2.0863379659790084e-05, 2.086367453854506e-05, 2.086381044154904e-05, 2.086463255519363e-05, 2.0864978736880203e-05, 2.0865093286283027e-05, 2.086545258776692e-05, 2.0865820213536014e-05], 0, 4.844036817550659, 1577130480.5591009], "v": 0.1}
{"i": ["cuda -model=unknown", "topi_nn_conv2d", [["TENSOR", [1, 160, 7, 7], "float32"], ["TENSOR", [960, 160, 1, 1], "float32"], [1, 1], [0, 0], [1, 1], "NCHW", "float32"], {}, ["conv2d", [1, 160, 7, 7, "float32"], [960, 160, 1, 1, "float32"], [1, 1], [0, 0], [1, 1], "NCHW", "float32"], {"i": 228595, "t": "direct", "c": null, "e": [["tile_f", "sp", [-1, 4, 8, 1]], ["tile_y", "sp", [-1, 1, 7, 1]], ["tile_x", "sp", [-1, 1, 7, 1]], ["tile_rc", "sp", [-1, 80]], ["tile_ry", "sp", [-1, 1]], ["tile_rx", "sp", [-1, 1]], ["auto_unroll_max_step", "ot", 0], ["unroll_explicit", "ot", 0]]}], "r": [[1.0966452136400986e-05, 1.0967450133525062e-05, 1.0968967235004108e-05, 1.0970244299506983e-05, 1.0970635630649137e-05, 1.0972328985209532e-05, 1.0974144515201315e-05, 1.09784135168447e-05], 0, 5.936706781387329, 1577131748.0362394], "v": 0.1}
{"i": ["cuda -model=unknown", "topi_nn_depthwise_conv2d_nchw", [["TENSOR", [1, 960, 7, 7], "float32"], ["TENSOR", [960, 1, 3, 3], "float32"], [1, 1], [1, 1], [1, 1], "float32"], {}, ["depthwise_conv2d_nchw", [1, 960, 7, 7, "float32"], [960, 1, 3, 3, "float32"], [1, 1], [1, 1], [1, 1], "float32"], {"i": 121072, "t": "direct", "c": null, "e": [["tile_f", "sp", [-1, 1, 8, 1]], ["tile_y", "sp", [-1, 1, 7, 1]], ["tile_x", "sp", [-1, 1, 7, 1]], ["auto_unroll_max_step", "ot", 1500], ["unroll_explicit", "ot", 1]]}], "r": [[3.611961681842175e-06, 3.620906868566904e-06, 3.6210494358669835e-06, 3.6363834949854844e-06, 3.653309976247031e-06, 3.6787850191343363e-06, 3.687062054631829e-06, 3.689518111638955e-06], 0, 3.3101305961608887, 1577132890.1084025], "v": 0.1}
{"i": ["cuda -model=unknown", "topi_nn_conv2d", [["TENSOR", [1, 960, 7, 7], "float32"], ["TENSOR", [320, 960, 1, 1], "float32"], [1, 1], [0, 0], [1, 1], "NCHW", "float32"], {}, ["conv2d", [1, 960, 7, 7, "float32"], [320, 960, 1, 1, "float32"], [1, 1], [0, 0], [1, 1], "NCHW", "float32"], {"i": 836031, "t": "direct", "c": null, "e": [["tile_f", "sp", [-1, 1, 20, 1]], ["tile_y", "sp", [-1, 1, 1, 1]], ["tile_x", "sp", [-1, 1, 7, 1]], ["tile_rc", "sp", [-1, 40]], ["tile_ry", "sp", [-1, 1]], ["tile_rx", "sp", [-1, 1]], ["auto_unroll_max_step", "ot", 1500], ["unroll_explicit", "ot", 1]]}], "r": [[3.429527770609319e-05, 3.4295376057347666e-05, 3.429598336917563e-05, 3.429667827956989e-05, 3.4298970609318994e-05, 3.429956286738351e-05, 3.4300457347670254e-05, 3.430223168458781e-05], 0, 4.7007317543029785, 1577133963.272713], "v": 0.1}
{"i": ["cuda -model=unknown", "topi_nn_conv2d", [["TENSOR", [1, 320, 7, 7], "float32"], ["TENSOR", [1280, 320, 1, 1], "float32"], [1, 1], [0, 0], [1, 1], "NCHW", "float32"], {}, ["conv2d", [1, 320, 7, 7, "float32"], [1280, 320, 1, 1, "float32"], [1, 1], [0, 0], [1, 1], "NCHW", "float32"], {"i": 524062, "t": "direct", "c": null, "e": [["tile_f", "sp", [-1, 8, 2, 1]], ["tile_y", "sp", [-1, 1, 7, 1]], ["tile_x", "sp", [-1, 1, 7, 1]], ["tile_rc", "sp", [-1, 20]], ["tile_ry", "sp", [-1, 1]], ["tile_rx", "sp", [-1, 1]], ["auto_unroll_max_step", "ot", 0], ["unroll_explicit", "ot", 1]]}], "r": [[2.61371262993763e-05, 2.6138839916839915e-05, 2.613949818087318e-05, 2.614049792099792e-05, 2.6143544828482328e-05, 2.6143851091476094e-05, 2.6144472323284822e-05, 2.6145180743243243e-05], 0, 3.301823854446411, 1577135231.2540295], "v": 0.1}
{"i": ["cuda -model=unknown", "topi_nn_dense", [["TENSOR", [1, 1280], "float32"], ["TENSOR", [1000, 1280], "float32"], null, "float32"], {}, ["dense", [1, 1280, "float32"], [1000, 1280, "float32"], 0, "float32"], {"i": 12, "t": "direct", "c": null, "e": [["tile_k", "sp", [-1, 128]]]}], "r": [[2.3896592488451496e-05, 2.3912026913034746e-05, 2.3912977605944968e-05, 2.3918613376179953e-05, 2.393022725446877e-05, 2.393378650331392e-05, 2.3941181763406304e-05, 2.3958782888130145e-05], 0, 6.477096796035767, 1577135912.7309265], "v": 0.1}
{"i": ["cuda -model=unknown", "topi_nn_conv2d", [["TENSOR", [1, 16, 112, 112], "float32"], ["TENSOR", [96, 16, 1, 1], "float32"], [1, 1], [0, 0], [1, 1], "NCHW", "float32"], {}, ["conv2d", [1, 16, 112, 112, "float32"], [96, 16, 1, 1, "float32"], [1, 1], [0, 0], [1, 1], "NCHW", "float32"], {"i": 36287689, "t": "direct", "c": null, "e": [["tile_f", "sp", [-1, 1, 2, 4]], ["tile_y", "sp", [-1, 1, 4, 1]], ["tile_x", "sp", [-1, 1, 16, 1]], ["tile_rc", "sp", [-1, 8]], ["tile_ry", "sp", [-1, 1]], ["tile_rx", "sp", [-1, 1]], ["auto_unroll_max_step", "ot", 512], ["unroll_explicit", "ot", 0]]}], "r": [[1.9788722391752575e-05, 1.9789338474226802e-05, 1.9792051216494844e-05, 1.979239917525773e-05, 1.9792576989690723e-05, 1.979290375257732e-05, 1.979402630927835e-05, 1.9794034144329898e-05], 0, 43.663047790527344, 1577037207.4167051], "v": 0.1}
{"i": ["cuda -model=unknown", "topi_nn_conv2d", [["TENSOR", [1, 96, 14, 14], "float32"], ["TENSOR", [576, 96, 1, 1], "float32"], [1, 1], [0, 0], [1, 1], "NCHW", "float32"], {}, ["conv2d", [1, 96, 14, 14, "float32"], [576, 96, 1, 1, "float32"], [1, 1], [0, 0], [1, 1], "NCHW", "float32"], {"i": 12157414, "t": "direct", "c": null, "e": [["tile_f", "sp", [-1, 4, 9, 1]], ["tile_y", "sp", [-1, 1, 1, 2]], ["tile_x", "sp", [-1, 1, 14, 1]], ["tile_rc", "sp", [-1, 24]], ["tile_ry", "sp", [-1, 1]], ["tile_rx", "sp", [-1, 1]], ["auto_unroll_max_step", "ot", 512], ["unroll_explicit", "ot", 1]]}], "r": [[8.802540760660776e-06, 8.802668152132154e-06, 8.802742143680369e-06, 8.805153745678064e-06, 8.806079062620054e-06, 8.807195197848637e-06, 8.807517249327699e-06, 8.809732347291586e-06], 0, 6.136052370071411, 1577069179.8141932], "v": 0.1}
