mytophub/20191227/resnet50v1_bs_128.log
{"i": ["cuda -model=unknown", "topi_nn_conv2d", [["TENSOR", [128, 1024, 14, 14], "float32"], ["TENSOR", [2048, 1024, 1, 1], "float32"], [2, 2], [0, 0], [1, 1], "NCHW", "float32"], {}, ["conv2d", [128, 1024, 14, 14, "float32"], [2048, 1024, 1, 1, "float32"], [2, 2], [0, 0], [1, 1], "NCHW", "float32"], {"i": 271364, "t": "direct", "c": null, "e": [["tile_f", "sp", [-1, 1, 32, 4]], ["tile_y", "sp", [-1, 7, 1, 1]], ["tile_x", "sp", [-1, 1, 7, 1]], ["tile_rc", "sp", [-1, 4]], ["tile_ry", "sp", [-1, 1]], ["tile_rx", "sp", [-1, 1]], ["auto_unroll_max_step", "ot", 512], ["unroll_explicit", "ot", 1]]}], "r": [[0.0063333786, 0.006333583966666667, 0.0063340782, 0.0063342022, 0.006334789666666666, 0.006334933066666667, 0.006335168433333333, 0.006335286533333333], 0, 10.870361804962158, 1577184029.5545614], "v": 0.1}
{"i": ["cuda -model=unknown", "topi_nn_conv2d", [["TENSOR", [128, 512, 28, 28], "float32"], ["TENSOR", [1024, 512, 1, 1], "float32"], [2, 2], [0, 0], [1, 1], "NCHW", "float32"], {}, ["conv2d", [128, 512, 28, 28, "float32"], [1024, 512, 1, 1, "float32"], [2, 2], [0, 0], [1, 1], "NCHW", "float32"], {"i": 3917438, "t": "direct", "c": null, "e": [["tile_f", "sp", [-1, 8, 8, 2]], ["tile_y", "sp", [-1, 2, 1, 1]], ["tile_x", "sp", [-1, 1, 14, 1]], ["tile_rc", "sp", [-1, 8]], ["tile_ry", "sp", [-1, 1]], ["tile_rx", "sp", [-1, 1]], ["auto_unroll_max_step", "ot", 1500], ["unroll_explicit", "ot", 1]]}], "r": [[0.006335183066666666, 0.006335312166666667, 0.0063353601, 0.006335797733333333, 0.0063359148, 0.0063360051, 0.006336081733333334, 0.006336378266666666], 0, 6.4039671421051025, 1577187556.1523485], "v": 0.1}
{"i": ["cuda -model=unknown", "topi_nn_conv2d", [["TENSOR", [128, 256, 56, 56], "float32"], ["TENSOR", [512, 256, 1, 1], "float32"], [2, 2], [0, 0], [1, 1], "NCHW", "float32"], {}, ["conv2d", [128, 256, 56, 56, "float32"], [512, 256, 1, 1, "float32"], [2, 2], [0, 0], [1, 1], "NCHW", "float32"], {"i": 16684918, "t": "direct", "c": null, "e": [["tile_f", "sp", [-1, 8, 4, 4]], ["tile_y", "sp", [-1, 1, 1, 1]], ["tile_x", "sp", [-1, 2, 14, 1]], ["tile_rc", "sp", [-1, 4]], ["tile_ry", "sp", [-1, 1]], ["tile_rx", "sp", [-1, 1]], ["auto_unroll_max_step", "ot", 1500], ["unroll_explicit", "ot", 1]]}], "r": [[0.006168428366666667, 0.006168544366666666, 0.0061705516, 0.0061715065333333334, 0.006171509966666667, 0.006173020333333334, 0.0061733456, 0.0061744653], 0, 12.13925814628601, 1577189666.2390392], "v": 0.1}
{"i": ["cuda -model=unknown", "topi_nn_conv2d", [["TENSOR", [128, 3, 224, 224], "float32"], ["TENSOR", [64, 3, 7, 7], "float32"], [2, 2], [3, 3], [1, 1], "NCHW", "float32"], {}, ["conv2d", [128, 3, 224, 224, "float32"], [64, 3, 7, 7, "float32"], [2, 2], [3, 3], [1, 1], "NCHW", "float32"], {"i": 61363740, "t": "direct", "c": null, "e": [["tile_f", "sp", [-1, 4, 4, 4]], ["tile_y", "sp", [-1, 1, 1, 1]], ["tile_x", "sp", [-1, 7, 16, 1]], ["tile_rc", "sp", [-1, 3]], ["tile_ry", "sp", [-1, 1]], ["tile_rx", "sp", [-1, 7]], ["auto_unroll_max_step", "ot", 512], ["unroll_explicit", "ot", 1]]}], "r": [[0.00444663625, 0.0044471325, 0.004447371958333333, 0.004447579895833334, 0.004448198833333333, 0.004448200979166666, 0.004448517604166666, 0.004449726416666667], 0, 16.35187339782715, 1577192937.8761232], "v": 0.1}
{"i": ["cuda -model=unknown", "topi_nn_conv2d", [["TENSOR", [128, 64, 56, 56], "float32"], ["TENSOR", [64, 64, 1, 1], "float32"], [1, 1], [0, 0], [1, 1], "NCHW", "float32"], {}, ["conv2d", [128, 64, 56, 56, "float32"], [64, 64, 1, 1, "float32"], [1, 1], [0, 0], [1, 1], "NCHW", "float32"], {"i": 20623909, "t": "direct", "c": null, "e": [["tile_f", "sp", [-1, 1, 8, 4]], ["tile_y", "sp", [-1, 4, 1, 1]], ["tile_x", "sp", [-1, 1, 56, 1]], ["tile_rc", "sp", [-1, 8]], ["tile_ry", "sp", [-1, 1]], ["tile_rx", "sp", [-1, 1]], ["auto_unroll_max_step", "ot", 1500], ["unroll_explicit", "ot", 1]]}], "r": [[0.0008555583011363635, 0.0008557415511363637, 0.0008557471250000001, 0.0008557529772727272, 0.0008557752670454545, 0.0008558784715909091, 0.0008558810568181818, 0.0008559708579545454], 0, 11.823119163513184, 1577195723.720199], "v": 0.1}
{"i": ["cuda -model=unknown", "topi_nn_conv2d", [["TENSOR", [128, 256, 56, 56], "float32"], ["TENSOR", [64, 256, 1, 1], "float32"], [1, 1], [0, 0], [1, 1], "NCHW", "float32"], {}, ["conv2d", [128, 256, 56, 56, "float32"], [64, 256, 1, 1, "float32"], [1, 1], [0, 0], [1, 1], "NCHW", "float32"], {"i": 1767468, "t": "direct", "c": null, "e": [["tile_f", "sp", [-1, 4, 16, 1]], ["tile_y", "sp", [-1, 2, 1, 1]], ["tile_x", "sp", [-1, 7, 8, 1]], ["tile_rc", "sp", [-1, 8]], ["tile_ry", "sp", [-1, 1]], ["tile_rx", "sp", [-1, 1]], ["auto_unroll_max_step", "ot", 0], ["unroll_explicit", "ot", 0]]}], "r": [[0.0022989868, 0.002299052123809524, 0.0022990729714285714, 0.0022993259428571427, 0.0022999061904761904, 0.0023003163238095236, 0.002300357419047619, 0.002300424161904762], 0, 11.046765804290771, 1577197279.0836613], "v": 0.1}
{"i": ["cuda -model=unknown", "topi_nn_conv2d", [["TENSOR", [128, 64, 56, 56], "float32"], ["TENSOR", [64, 64, 3, 3], "float32"], [1, 1], [1, 1], [1, 1], "NCHW", "float32"], {}, ["conv2d", [128, 64, 56, 56, "float32"], [64, 64, 3, 3, "float32"], [1, 1], [1, 1], [1, 1], "NCHW", "float32"], {"i": 3338391, "t": "winograd", "c": null, "e": [["tile_b", "sp", [-1, 1, 1, 1]], ["tile_y", "sp", [-1, 1, 16, 4]], ["tile_x", "sp", [-1, 4, 16, 1]], ["tile_rc", "sp", [-1, 16]], ["auto_unroll_max_step", "ot", 1500], ["unroll_explicit", "ot", 0]]}], "r": [[0.0056325614, 0.005641175866666666, 0.005642314866666666, 0.0056435340666666665, 0.005643602533333333, 0.005644356866666667, 0.005644704733333334, 0.0056456084], 0, 5.522424697875977, 1577200478.7034633], "v": 0.1}
{"i": ["cuda -model=unknown", "topi_nn_conv2d", [["TENSOR", [128, 64, 56, 56], "float32"], ["TENSOR", [256, 64, 1, 1], "float32"], [1, 1], [0, 0], [1, 1], "NCHW", "float32"], {}, ["conv2d", [128, 64, 56, 56, "float32"], [256, 64, 1, 1, "float32"], [1, 1], [0, 0], [1, 1], "NCHW", "float32"], {"i": 25652622, "t": "direct", "c": null, "e": [["tile_f", "sp", [-1, 2, 16, 2]], ["tile_y", "sp", [-1, 1, 1, 2]], ["tile_x", "sp", [-1, 7, 8, 1]], ["tile_rc", "sp", [-1, 8]], ["tile_ry", "sp", [-1, 1]], ["tile_rx", "sp", [-1, 1]], ["auto_unroll_max_step", "ot", 0], ["unroll_explicit", "ot", 1]]}], "r": [[0.00234870725, 0.00234874696875, 0.00234890246875, 0.002348962984375, 0.00234902284375, 0.002349046234375, 0.00234921534375, 0.002349832796875], 0, 105.75595426559448, 1577202198.2353306], "v": 0.1}
{"i": ["cuda -model=unknown", "topi_nn_conv2d", [["TENSOR", [128, 256, 56, 56], "float32"], ["TENSOR", [128, 256, 1, 1], "float32"], [1, 1], [0, 0], [1, 1], "NCHW", "float32"], {}, ["conv2d", [128, 256, 56, 56, "float32"], [128, 256, 1, 1, "float32"], [1, 1], [0, 0], [1, 1], "NCHW", "float32"], {"i": 37853820, "t": "direct", "c": null, "e": [["tile_f", "sp", [-1, 4, 16, 2]], ["tile_y", "sp", [-1, 1, 2, 1]], ["tile_x", "sp", [-1, 7, 8, 1]], ["tile_rc", "sp", [-1, 16]], ["tile_ry", "sp", [-1, 1]], ["tile_rx", "sp", [-1, 1]], ["auto_unroll_max_step", "ot", 1500], ["unroll_explicit", "ot", 1]]}], "r": [[0.00392392, 0.003924131020833333, 0.003924147395833333, 0.00392435775, 0.003924503833333333, 0.003925032770833333, 0.003925191604166667, 0.003925416625], 0, 7.427847862243652, 1577203574.600377], "v": 0.1}
{"i": ["cuda -model=unknown", "topi_nn_conv2d", [["TENSOR", [128, 128, 56, 56], "float32"], ["TENSOR", [128, 128, 3, 3], "float32"], [2, 2], [1, 1], [1, 1], "NCHW", "float32"], {}, ["conv2d", [128, 128, 56, 56, "float32"], [128, 128, 3, 3, "float32"], [2, 2], [1, 1], [1, 1], "NCHW", "float32"], {"i": 29237619, "t": "direct", "c": null, "e": [["tile_f", "sp", [-1, 1, 16, 8]], ["tile_y", "sp", [-1, 1, 2, 1]], ["tile_x", "sp", [-1, 7, 4, 1]], ["tile_rc", "sp", [-1, 1]], ["tile_ry", "sp", [-1, 3]], ["tile_rx", "sp", [-1, 3]], ["auto_unroll_max_step", "ot", 512], ["unroll_explicit", "ot", 1]]}], "r": [[0.0046910962499999995, 0.0046914873125, 0.0046915503125, 0.004691641, 0.004691673541666667, 0.004691932645833333, 0.0046925105833333335, 0.0046926720208333335], 0, 6.548671245574951, 1577204844.5141144], "v": 0.1}
{"i": ["cuda -model=unknown", "topi_nn_conv2d", [["TENSOR", [128, 512, 28, 28], "float32"], ["TENSOR", [128, 512, 1, 1], "float32"], [1, 1], [0, 0], [1, 1], "NCHW", "float32"], {}, ["conv2d", [128, 512, 28, 28, "float32"], [128, 512, 1, 1, "float32"], [1, 1], [0, 0], [1, 1], "NCHW", "float32"], {"i": 2550080, "t": "direct", "c": null, "e": [["tile_f", "sp", [-1, 2, 8, 4]], ["tile_y", "sp", [-1, 1, 4, 1]], ["tile_x", "sp", [-1, 7, 4, 1]], ["tile_rc", "sp", [-1, 8]], ["tile_ry", "sp", [-1, 1]], ["tile_rx", "sp", [-1, 1]], ["auto_unroll_max_step", "ot", 512], ["unroll_explicit", "ot", 0]]}], "r": [[0.0017684523445378152, 0.0017684902184873948, 0.0017688306050420168, 0.001768910512605042, 0.0017689984033613445, 0.0017690652773109242, 0.0017692476722689077, 0.0017698901848739496], 0, 3.747542381286621, 1577206867.8462474], "v": 0.1}
{"i": ["cuda -model=unknown", "topi_nn_conv2d", [["TENSOR", [128, 128, 28, 28], "float32"], ["TENSOR", [128, 128, 3, 3], "float32"], [1, 1], [1, 1], [1, 1], "NCHW", "float32"], {}, ["conv2d", [128, 128, 28, 28, "float32"], [128, 128, 3, 3, "float32"], [1, 1], [1, 1], [1, 1], "NCHW", "float32"], {"i": 5033138, "t": "winograd", "c": null, "e": [["tile_b", "sp", [-1, 1, 1, 1]], ["tile_y", "sp", [-1, 2, 8, 8]], ["tile_x", "sp", [-1, 4, 16, 1]], ["tile_rc", "sp", [-1, 8]], ["auto_unroll_max_step", "ot", 1500], ["unroll_explicit", "ot", 0]]}], "r": [[0.004257382, 0.004257907041666667, 0.00425800125, 0.004258857666666667, 0.004258938375, 0.0042590041458333335, 0.004259054520833334, 0.004259465083333333], 0, 9.401336908340454, 1577208403.7020595], "v": 0.1}
{"i": ["cuda -model=unknown", "topi_nn_conv2d", [["TENSOR", [128, 128, 28, 28], "float32"], ["TENSOR", [512, 128, 1, 1], "float32"], [1, 1], [0, 0], [1, 1], "NCHW", "float32"], {}, ["conv2d", [128, 128, 28, 28, "float32"], [512, 128, 1, 1, "float32"], [1, 1], [0, 0], [1, 1], "NCHW", "float32"], {"i": 6787122, "t": "direct", "c": null, "e": [["tile_f", "sp", [-1, 2, 8, 4]], ["tile_y", "sp", [-1, 1, 4, 1]], ["tile_x", "sp", [-1, 7, 4, 1]], ["tile_rc", "sp", [-1, 8]], ["tile_ry", "sp", [-1, 1]], ["tile_rx", "sp", [-1, 1]], ["auto_unroll_max_step", "ot", 1500], ["unroll_explicit", "ot", 0]]}], "r": [[0.0018619601327433627, 0.0018620013805309735, 0.001862185814159292, 0.0018622138318584072, 0.0018622363628318583, 0.0018623675044247786, 0.0018624400088495577, 0.0018782160619469027], 0, 3.6450414657592773, 1577210775.4263706], "v": 0.1}
{"i": ["cuda -model=unknown", "topi_nn_conv2d", [["TENSOR", [128, 512, 28, 28], "float32"], ["TENSOR", [256, 512, 1, 1], "float32"], [1, 1], [0, 0], [1, 1], "NCHW", "float32"], {}, ["conv2d", [128, 512, 28, 28, "float32"], [256, 512, 1, 1, "float32"], [1, 1], [0, 0], [1, 1], "NCHW", "float32"], {"i": 6146350, "t": "direct", "c": null, "e": [["tile_f", "sp", [-1, 2, 8, 4]], ["tile_y", "sp", [-1, 1, 4, 1]], ["tile_x", "sp", [-1, 7, 4, 1]], ["tile_rc", "sp", [-1, 8]], ["tile_ry", "sp", [-1, 1]], ["tile_rx", "sp", [-1, 1]], ["auto_unroll_max_step", "ot", 1500], ["unroll_explicit", "ot", 0]]}], "r": [[0.003360054520833333, 0.0033604686666666665, 0.0033610647708333333, 0.003361179854166667, 0.0033613111875, 0.00336152825, 0.0033617021666666664, 0.003361851291666667], 0, 10.219793796539307, 1577212144.9801183], "v": 0.1}
{"i": ["cuda -model=unknown", "topi_nn_conv2d", [["TENSOR", [128, 256, 28, 28], "float32"], ["TENSOR", [256, 256, 3, 3], "float32"], [2, 2], [1, 1], [1, 1], "NCHW", "float32"], {}, ["conv2d", [128, 256, 28, 28, "float32"], [256, 256, 3, 3, "float32"], [2, 2], [1, 1], [1, 1], "NCHW", "float32"], {"i": 7229672, "t": "direct", "c": null, "e": [["tile_f", "sp", [-1, 4, 16, 1]], ["tile_y", "sp", [-1, 1, 14, 1]], ["tile_x", "sp", [-1, 7, 1, 1]], ["tile_rc", "sp", [-1, 1]], ["tile_ry", "sp", [-1, 3]], ["tile_rx", "sp", [-1, 3]], ["auto_unroll_max_step", "ot", 512], ["unroll_explicit", "ot", 1]]}], "r": [[0.005012377766666667, 0.005013697366666667, 0.005014059766666666, 0.0050140877, 0.005014166433333333, 0.005014345866666667, 0.005014913533333333, 0.005015982933333333], 0, 4.985369920730591, 1577213996.6693065], "v": 0.1}
{"i": ["cuda -model=unknown", "topi_nn_conv2d", [["TENSOR", [128, 1024, 14, 14], "float32"], ["TENSOR", [256, 1024, 1, 1], "float32"], [1, 1], [0, 0], [1, 1], "NCHW", "float32"], {}, ["conv2d", [128, 1024, 14, 14, "float32"], [256, 1024, 1, 1, "float32"], [1, 1], [0, 0], [1, 1], "NCHW", "float32"], {"i": 2006798, "t": "direct", "c": null, "e": [["tile_f", "sp", [-1, 4, 8, 2]], ["tile_y", "sp", [-1, 7, 1, 1]], ["tile_x", "sp", [-1, 1, 14, 1]], ["tile_rc", "sp", [-1, 8]], ["tile_ry", "sp", [-1, 1]], ["tile_rx", "sp", [-1, 1]], ["auto_unroll_max_step", "ot", 512], ["unroll_explicit", "ot", 1]]}], "r": [[0.0018891316756756756, 0.0018892606216216216, 0.001890942864864865, 0.0018910406036036036, 0.001891078945945946, 0.0018923574684684683, 0.0018925857117117117, 0.0019125934864864865], 0, 3.913076162338257, 1577215706.467319], "v": 0.1}
{"i": ["cuda -model=unknown", "topi_nn_conv2d", [["TENSOR", [128, 256, 14, 14], "float32"], ["TENSOR", [256, 256, 3, 3], "float32"], [1, 1], [1, 1], [1, 1], "NCHW", "float32"], {}, ["conv2d", [128, 256, 14, 14, "float32"], [256, 256, 3, 3, "float32"], [1, 1], [1, 1], [1, 1], "NCHW", "float32"], {"i": 9918294, "t": "winograd", "c": null, "e": [["tile_b", "sp", [-1, 1, 1, 1]], ["tile_y", "sp", [-1, 1, 16, 16]], ["tile_x", "sp", [-1, 4, 16, 1]], ["tile_rc", "sp", [-1, 32]], ["auto_unroll_max_step", "ot", 1500], ["unroll_explicit", "ot", 1]]}], "r": [[0.0028194786296296295, 0.0028195532222222226, 0.002819559092592593, 0.002819758222222222, 0.0028198510185185183, 0.0028208181111111113, 0.0028208662777777778, 0.002820978537037037], 0, 12.24785852432251, 1577217545.5047538], "v": 0.1}
{"i": ["cuda -model=unknown", "topi_nn_conv2d", [["TENSOR", [128, 256, 14, 14], "float32"], ["TENSOR", [1024, 256, 1, 1], "float32"], [1, 1], [0, 0], [1, 1], "NCHW", "float32"], {}, ["conv2d", [128, 256, 14, 14, "float32"], [1024, 256, 1, 1, "float32"], [1, 1], [0, 0], [1, 1], "NCHW", "float32"], {"i": 2893549, "t": "direct", "c": null, "e": [["tile_f", "sp", [-1, 4, 4, 2]], ["tile_y", "sp", [-1, 7, 2, 1]], ["tile_x", "sp", [-1, 1, 14, 1]], ["tile_rc", "sp", [-1, 8]], ["tile_ry", "sp", [-1, 1]], ["tile_rx", "sp", [-1, 1]], ["auto_unroll_max_step", "ot", 512], ["unroll_explicit", "ot", 1]]}], "r": [[0.0018912268272727273, 0.0018912852272727273, 0.0018913062636363638, 0.0018913225636363637, 0.0018913725, 0.0018914268818181817, 0.0018914759818181818, 0.0018919370454545455], 0, 4.0207695960998535, 1577219490.0937035], "v": 0.1}
{"i": ["cuda -model=unknown", "topi_nn_conv2d", [["TENSOR", [128, 1024, 14, 14], "float32"], ["TENSOR", [512, 1024, 1, 1], "float32"], [1, 1], [0, 0], [1, 1], "NCHW", "float32"], {}, ["conv2d", [128, 1024, 14, 14, "float32"], [512, 1024, 1, 1, "float32"], [1, 1], [0, 0], [1, 1], "NCHW", "float32"], {"i": 3352170, "t": "direct", "c": null, "e": [["tile_f", "sp", [-1, 8, 8, 1]], ["tile_y", "sp", [-1, 7, 2, 1]], ["tile_x", "sp", [-1, 1, 14, 1]], ["tile_rc", "sp", [-1, 16]], ["tile_ry", "sp", [-1, 1]], ["tile_rx", "sp", [-1, 1]], ["auto_unroll_max_step", "ot", 1500], ["unroll_explicit", "ot", 1]]}], "r": [[0.0037138228125, 0.0037138601249999998, 0.0037142617291666667, 0.0037151835416666668, 0.0037152678333333337, 0.0037155553541666666, 0.003715655520833333, 0.0037160250625], 0, 6.917834043502808, 1577220783.8878543], "v": 0.1}
{"i": ["cuda -model=unknown", "topi_nn_conv2d", [["TENSOR", [128, 512, 14, 14], "float32"], ["TENSOR", [512, 512, 3, 3], "float32"], [2, 2], [1, 1], [1, 1], "NCHW", "float32"], {}, ["conv2d", [128, 512, 14, 14, "float32"], [512, 512, 3, 3, "float32"], [2, 2], [1, 1], [1, 1], "NCHW", "float32"], {"i": 812716, "t": "direct", "c": null, "e": [["tile_f", "sp", [-1, 4, 16, 1]], ["tile_y", "sp", [-1, 1, 7, 1]], ["tile_x", "sp", [-1, 1, 1, 7]], ["tile_rc", "sp", [-1, 1]], ["tile_ry", "sp", [-1, 3]], ["tile_rx", "sp", [-1, 3]], ["auto_unroll_max_step", "ot", 1500], ["unroll_explicit", "ot", 1]]}], "r": [[0.005348595133333333, 0.005348718333333334, 0.0053490687333333335, 0.005349613366666667, 0.005349644966666667, 0.0053498461, 0.005350681533333334, 0.005357540333333333], 0, 14.815961837768555, 1577222382.7355168], "v": 0.1}
{"i": ["cuda -model=unknown", "topi_nn_conv2d", [["TENSOR", [128, 2048, 7, 7], "float32"], ["TENSOR", [512, 2048, 1, 1], "float32"], [1, 1], [0, 0], [1, 1], "NCHW", "float32"], {}, ["conv2d", [128, 2048, 7, 7, "float32"], [512, 2048, 1, 1, "float32"], [1, 1], [0, 0], [1, 1], "NCHW", "float32"], {"i": 223770, "t": "direct", "c": null, "e": [["tile_f", "sp", [-1, 8, 8, 1]], ["tile_y", "sp", [-1, 7, 1, 1]], ["tile_x", "sp", [-1, 1, 7, 1]], ["tile_rc", "sp", [-1, 8]], ["tile_ry", "sp", [-1, 1]], ["tile_rx", "sp", [-1, 1]], ["auto_unroll_max_step", "ot", 1500], ["unroll_explicit", "ot", 1]]}], "r": [[0.002460925557377049, 0.002461113969387755, 0.0024633469387755104, 0.0024633795901639346, 0.0024636931475409836, 0.002464621918032787, 0.0024662767540983605, 0.0024701937213114753], 0, 14.985524892807007, 1577223791.8787625], "v": 0.1}
{"i": ["cuda -model=unknown", "topi_nn_conv2d", [["TENSOR", [128, 512, 7, 7], "float32"], ["TENSOR", [512, 512, 3, 3], "float32"], [1, 1], [1, 1], [1, 1], "NCHW", "float32"], {}, ["conv2d", [128, 512, 7, 7, "float32"], [512, 512, 3, 3, "float32"], [1, 1], [1, 1], [1, 1], "NCHW", "float32"], {"i": 4252318, "t": "winograd", "c": null, "e": [["tile_b", "sp", [-1, 1, 1, 1]], ["tile_y", "sp", [-1, 1, 16, 8]], ["tile_x", "sp", [-1, 8, 8, 1]], ["tile_rc", "sp", [-1, 8]], ["auto_unroll_max_step", "ot", 1500], ["unroll_explicit", "ot", 1]]}], "r": [[0.002740793218181818, 0.002741003763636364, 0.0027419965454545453, 0.0027422580909090906, 0.0027423864363636365, 0.002742666090909091, 0.0027428159272727274, 0.0027432565272727276], 0, 8.088928461074829, 1577225121.2877896], "v": 0.1}
{"i": ["cuda -model=unknown", "topi_nn_conv2d", [["TENSOR", [128, 512, 7, 7], "float32"], ["TENSOR", [2048, 512, 1, 1], "float32"], [1, 1], [0, 0], [1, 1], "NCHW", "float32"], {}, ["conv2d", [128, 512, 7, 7, "float32"], [2048, 512, 1, 1, "float32"], [1, 1], [0, 0], [1, 1], "NCHW", "float32"], {"i": 253818, "t": "direct", "c": null, "e": [["tile_f", "sp", [-1, 4, 8, 2]], ["tile_y", "sp", [-1, 7, 1, 1]], ["tile_x", "sp", [-1, 1, 7, 1]], ["tile_rc", "sp", [-1, 8]], ["tile_ry", "sp", [-1, 1]], ["tile_rx", "sp", [-1, 1]], ["auto_unroll_max_step", "ot", 512], ["unroll_explicit", "ot", 1]]}], "r": [[0.0025597322711864404, 0.002561245254237288, 0.0025629808474576274, 0.0025632487966101695, 0.002563518033898305, 0.0025641496271186443, 0.002564390779661017, 0.00256525206779661], 0, 13.628146648406982, 1577227038.6051059], "v": 0.1}
{"i": ["cuda -model=unknown", "topi_nn_dense", [["TENSOR", [128, 2048], "float32"], ["TENSOR", [1000, 2048], "float32"], null, "float32"], {}, ["dense", [128, 2048, "float32"], [1000, 2048, "float32"], 0, "float32"], {"i": 70959, "t": "direct", "c": null, "e": [["tile_x", "sp", [-1, 8, 1, 2]], ["tile_y", "sp", [-1, 2, 1, 5]], ["tile_k", "sp", [-1, 2, 1]]]}], "r": [[0.00354612025, 0.0035470710833333335, 0.0035479164375, 0.003548581104166667, 0.0035512449791666664, 0.003552203958333333, 0.0035528297291666667, 0.0035902876458333336], 0, 3.521620750427246, 1577228784.847085], "v": 0.1}
