mytophub/20191227/senet_bs1.log
{"i": ["cuda -model=unknown", "topi_nn_group_conv2d_nchw", [["TENSOR", [1, 256, 14, 14], "float32"], ["TENSOR", [256, 8, 3, 3], "float32"], [1, 1], [1, 1], [1, 1], 32, "float32"], {}, ["group_conv2d_nchw", [1, 256, 14, 14, "float32"], [256, 8, 3, 3, "float32"], [1, 1], [1, 1], [1, 1], 32, "float32"], {"i": 4747368, "t": "direct", "c": null, "e": [["tile_n", "sp", [1, 1, 1, 1]], ["tile_g", "sp", [32, 1]], ["tile_f", "sp", [1, 2, 4, 1]], ["tile_y", "sp", [7, 1, 1, 2]], ["tile_x", "sp", [1, 1, 14, 1]], ["tile_rc", "sp", [2, 4]], ["tile_ry", "sp", [3, 1]], ["tile_rx", "sp", [1, 3]], ["auto_unroll_max_step", "ot", 0], ["unroll_explicit", "ot", 1], ["fuse_yx", "ot", 1]]}], "r": [[5.349635768443856e-06], 0, 16.112272024154663, 1573851204.243783], "v": 0.1}
{"i": ["cuda -model=unknown", "topi_nn_group_conv2d_nchw", [["TENSOR", [1, 256, 14, 14], "float32"], ["TENSOR", [256, 8, 1, 1], "float32"], [1, 1], [0, 0], [1, 1], 32, "float32"], {}, ["group_conv2d_nchw", [1, 256, 14, 14, "float32"], [256, 8, 1, 1, "float32"], [1, 1], [0, 0], [1, 1], 32, "float32"], {"i": 113874, "t": "direct", "c": null, "e": [["tile_n", "sp", [1, 1, 1, 1]], ["tile_g", "sp", [32, 1]], ["tile_f", "sp", [1, 1, 1, 8]], ["tile_y", "sp", [7, 1, 2, 1]], ["tile_x", "sp", [1, 1, 7, 2]], ["tile_rc", "sp", [1, 8]], ["tile_ry", "sp", [1, 1]], ["tile_rx", "sp", [1, 1]], ["auto_unroll_max_step", "ot", 0], ["unroll_explicit", "ot", 0], ["fuse_yx", "ot", 0]]}], "r": [[2.8610110956656776e-06], 0, 37.00697684288025, 1573859236.2265162], "v": 0.1}
{"i": ["cuda -model=unknown", "topi_nn_conv2d", [["TENSOR", [1, 2048, 1, 1], "float32"], ["TENSOR", [128, 2048, 1, 1], "float32"], [1, 1], [0, 0], [1, 1], "NCHW", "float32"], {}, ["conv2d", [1, 2048, 1, 1, "float32"], [128, 2048, 1, 1, "float32"], [1, 1], [0, 0], [1, 1], "NCHW", "float32"], {"i": 5655, "t": "direct", "c": null, "e": [["tile_f", "sp", [32, 1, 4, 1]], ["tile_y", "sp", [1, 1, 1, 1]], ["tile_x", "sp", [1, 1, 1, 1]], ["tile_rc", "sp", [1, 2048]], ["tile_ry", "sp", [1, 1]], ["tile_rx", "sp", [1, 1]], ["auto_unroll_max_step", "ot", 0], ["unroll_explicit", "ot", 1]]}], "r": [[4.58800547224927e-05], 0, 39.51883268356323, 1573867042.8838367], "v": 0.1}
{"i": ["cuda -model=unknown", "topi_nn_conv2d", [["TENSOR", [1, 128, 1, 1], "float32"], ["TENSOR", [2048, 128, 1, 1], "float32"], [1, 1], [0, 0], [1, 1], "NCHW", "float32"], {}, ["conv2d", [1, 128, 1, 1, "float32"], [2048, 128, 1, 1, "float32"], [1, 1], [0, 0], [1, 1], "NCHW", "float32"], {"i": 1125, "t": "direct", "c": null, "e": [["tile_f", "sp", [256, 1, 8, 1]], ["tile_y", "sp", [1, 1, 1, 1]], ["tile_x", "sp", [1, 1, 1, 1]], ["tile_rc", "sp", [16, 8]], ["tile_ry", "sp", [1, 1]], ["tile_rx", "sp", [1, 1]], ["auto_unroll_max_step", "ot", 0], ["unroll_explicit", "ot", 0]]}], "r": [[6.703300149476831e-06], 0, 37.23241114616394, 1573870591.804822], "v": 0.1}
{"i": ["cuda -model=unknown", "topi_nn_conv2d", [["TENSOR", [1, 1024, 1, 1], "float32"], ["TENSOR", [64, 1024, 1, 1], "float32"], [1, 1], [0, 0], [1, 1], "NCHW", "float32"], {}, ["conv2d", [1, 1024, 1, 1, "float32"], [64, 1024, 1, 1, "float32"], [1, 1], [0, 0], [1, 1], "NCHW", "float32"], {"i": 1609, "t": "direct", "c": null, "e": [["tile_f", "sp", [16, 1, 4, 1]], ["tile_y", "sp", [1, 1, 1, 1]], ["tile_x", "sp", [1, 1, 1, 1]], ["tile_rc", "sp", [4, 256]], ["tile_ry", "sp", [1, 1]], ["tile_rx", "sp", [1, 1]], ["auto_unroll_max_step", "ot", 512], ["unroll_explicit", "ot", 0]]}], "r": [[2.1862977080033542e-05], 0, 38.88309669494629, 1573874770.521379], "v": 0.1}
{"i": ["cuda -model=unknown", "topi_nn_conv2d", [["TENSOR", [1, 64, 1, 1], "float32"], ["TENSOR", [1024, 64, 1, 1], "float32"], [1, 1], [0, 0], [1, 1], "NCHW", "float32"], {}, ["conv2d", [1, 64, 1, 1, "float32"], [1024, 64, 1, 1, "float32"], [1, 1], [0, 0], [1, 1], "NCHW", "float32"], {"i": 4913, "t": "direct", "c": null, "e": [["tile_f", "sp", [16, 1, 64, 1]], ["tile_y", "sp", [1, 1, 1, 1]], ["tile_x", "sp", [1, 1, 1, 1]], ["tile_rc", "sp", [8, 8]], ["tile_ry", "sp", [1, 1]], ["tile_rx", "sp", [1, 1]], ["auto_unroll_max_step", "ot", 1500], ["unroll_explicit", "ot", 0]]}], "r": [[5.209478586430463e-06], 0, 11.381235837936401, 1573879515.5387776], "v": 0.1}
{"i": ["cuda -model=unknown", "topi_nn_conv2d", [["TENSOR", [1, 512, 1, 1], "float32"], ["TENSOR", [32, 512, 1, 1], "float32"], [1, 1], [0, 0], [1, 1], "NCHW", "float32"], {}, ["conv2d", [1, 512, 1, 1, "float32"], [32, 512, 1, 1, "float32"], [1, 1], [0, 0], [1, 1], "NCHW", "float32"], {"i": 2195, "t": "direct", "c": null, "e": [["tile_f", "sp", [8, 1, 4, 1]], ["tile_y", "sp", [1, 1, 1, 1]], ["tile_x", "sp", [1, 1, 1, 1]], ["tile_rc", "sp", [1, 512]], ["tile_ry", "sp", [1, 1]], ["tile_rx", "sp", [1, 1]], ["auto_unroll_max_step", "ot", 0], ["unroll_explicit", "ot", 1]]}], "r": [[1.1735622924234561e-05], 0, 11.347518682479858, 1573881887.3473442], "v": 0.1}
{"i": ["cuda -model=unknown", "topi_nn_conv2d", [["TENSOR", [1, 32, 1, 1], "float32"], ["TENSOR", [512, 32, 1, 1], "float32"], [1, 1], [0, 0], [1, 1], "NCHW", "float32"], {}, ["conv2d", [1, 32, 1, 1, "float32"], [512, 32, 1, 1, "float32"], [1, 1], [0, 0], [1, 1], "NCHW", "float32"], {"i": 5739, "t": "direct", "c": null, "e": [["tile_f", "sp", [128, 1, 4, 1]], ["tile_y", "sp", [1, 1, 1, 1]], ["tile_x", "sp", [1, 1, 1, 1]], ["tile_rc", "sp", [8, 4]], ["tile_ry", "sp", [1, 1]], ["tile_rx", "sp", [1, 1]], ["auto_unroll_max_step", "ot", 512], ["unroll_explicit", "ot", 1]]}], "r": [[3.4769398403658833e-06], 0, 10.79317569732666, 1573886125.5253837], "v": 0.1}
{"i": ["cuda -model=unknown", "topi_nn_conv2d", [["TENSOR", [1, 256, 1, 1], "float32"], ["TENSOR", [16, 256, 1, 1], "float32"], [1, 1], [0, 0], [1, 1], "NCHW", "float32"], {}, ["conv2d", [1, 256, 1, 1, "float32"], [16, 256, 1, 1, "float32"], [1, 1], [0, 0], [1, 1], "NCHW", "float32"], {"i": 608, "t": "direct", "c": null, "e": [["tile_f", "sp", [1, 2, 8, 1]], ["tile_y", "sp", [1, 1, 1, 1]], ["tile_x", "sp", [1, 1, 1, 1]], ["tile_rc", "sp", [1, 256]], ["tile_ry", "sp", [1, 1]], ["tile_rx", "sp", [1, 1]], ["auto_unroll_max_step", "ot", 512], ["unroll_explicit", "ot", 0]]}], "r": [[8.654474909529554e-06], 0, 9.263394594192505, 1573889264.864715], "v": 0.1}
{"i": ["cuda -model=unknown", "topi_nn_conv2d", [["TENSOR", [1, 16, 1, 1], "float32"], ["TENSOR", [256, 16, 1, 1], "float32"], [1, 1], [0, 0], [1, 1], "NCHW", "float32"], {}, ["conv2d", [1, 16, 1, 1, "float32"], [256, 16, 1, 1, "float32"], [1, 1], [0, 0], [1, 1], "NCHW", "float32"], {"i": 4838, "t": "direct", "c": null, "e": [["tile_f", "sp", [64, 1, 2, 2]], ["tile_y", "sp", [1, 1, 1, 1]], ["tile_x", "sp", [1, 1, 1, 1]], ["tile_rc", "sp", [1, 16]], ["tile_ry", "sp", [1, 1]], ["tile_rx", "sp", [1, 1]], ["auto_unroll_max_step", "ot", 1500], ["unroll_explicit", "ot", 1]]}], "r": [[3.034638909472644e-06], 0, 7.021868467330933, 1573892309.1956773], "v": 0.1}
{"i": ["cuda -model=unknown", "topi_nn_conv2d", [["TENSOR", [1, 3, 224, 224], "float32"], ["TENSOR", [64, 3, 7, 7], "float32"], [2, 2], [3, 3], [1, 1], "NCHW", "float32"], {}, ["conv2d", [1, 3, 224, 224, "float32"], [64, 3, 7, 7, "float32"], [2, 2], [3, 3], [1, 1], "NCHW", "float32"], {"i": 49831129, "t": "direct", "c": null, "e": [["tile_f", "sp", [2, 1, 8, 4]], ["tile_y", "sp", [14, 4, 1, 2]], ["tile_x", "sp", [7, 1, 16, 1]], ["tile_rc", "sp", [3, 1]], ["tile_ry", "sp", [1, 7]], ["tile_rx", "sp", [1, 7]], ["auto_unroll_max_step", "ot", 0], ["unroll_explicit", "ot", 1]]}], "r": [[6.449022974710673e-05], 0, 10.569023132324219, 1573903592.9419713], "v": 0.1}
{"i": ["cuda -model=unknown", "topi_nn_conv2d", [["TENSOR", [1, 64, 55, 55], "float32"], ["TENSOR", [128, 64, 1, 1], "float32"], [1, 1], [0, 0], [1, 1], "NCHW", "float32"], {}, ["conv2d", [1, 64, 55, 55, "float32"], [128, 64, 1, 1, "float32"], [1, 1], [0, 0], [1, 1], "NCHW", "float32"], {"i": 963984, "t": "direct", "c": null, "e": [["tile_f", "sp", [2, 8, 8, 1]], ["tile_y", "sp", [11, 5, 1, 1]], ["tile_x", "sp", [5, 1, 11, 1]], ["tile_rc", "sp", [8, 8]], ["tile_ry", "sp", [1, 1]], ["tile_rx", "sp", [1, 1]], ["auto_unroll_max_step", "ot", 512], ["unroll_explicit", "ot", 1]]}], "r": [[1.875042603550296e-05], 0, 9.32938265800476, 1573921190.5419319], "v": 0.1}
{"i": ["cuda -model=unknown", "topi_nn_conv2d", [["TENSOR", [1, 64, 55, 55], "float32"], ["TENSOR", [256, 64, 1, 1], "float32"], [1, 1], [0, 0], [1, 1], "NCHW", "float32"], {}, ["conv2d", [1, 64, 55, 55, "float32"], [256, 64, 1, 1, "float32"], [1, 1], [0, 0], [1, 1], "NCHW", "float32"], {"i": 63640, "t": "direct", "c": null, "e": [["tile_f", "sp", [16, 1, 2, 8]], ["tile_y", "sp", [11, 5, 1, 1]], ["tile_x", "sp", [1, 1, 55, 1]], ["tile_rc", "sp", [32, 2]], ["tile_ry", "sp", [1, 1]], ["tile_rx", "sp", [1, 1]], ["auto_unroll_max_step", "ot", 0], ["unroll_explicit", "ot", 0]]}], "r": [[3.870874340112506e-05], 0, 7.273250341415405, 1573936257.987826], "v": 0.1}
{"i": ["cuda -model=unknown", "topi_nn_conv2d", [["TENSOR", [1, 256, 55, 55], "float32"], ["TENSOR", [128, 256, 1, 1], "float32"], [1, 1], [0, 0], [1, 1], "NCHW", "float32"], {}, ["conv2d", [1, 256, 55, 55, "float32"], [128, 256, 1, 1, "float32"], [1, 1], [0, 0], [1, 1], "NCHW", "float32"], {"i": 907390, "t": "direct", "c": null, "e": [["tile_f", "sp", [16, 1, 2, 4]], ["tile_y", "sp", [11, 1, 1, 5]], ["tile_x", "sp", [1, 1, 55, 1]], ["tile_rc", "sp", [64, 4]], ["tile_ry", "sp", [1, 1]], ["tile_rx", "sp", [1, 1]], ["auto_unroll_max_step", "ot", 0], ["unroll_explicit", "ot", 1]]}], "r": [[7.929224630801688e-05], 0, 6.0178797245025635, 1573944140.4486804], "v": 0.1}
{"i": ["cuda -model=unknown", "topi_nn_group_conv2d_nchw", [["TENSOR", [1, 128, 55, 55], "float32"], ["TENSOR", [128, 4, 3, 3], "float32"], [1, 1], [1, 1], [1, 1], 32, "float32"], {}, ["group_conv2d_nchw", [1, 128, 55, 55, "float32"], [128, 4, 3, 3, "float32"], [1, 1], [1, 1], [1, 1], 32, "float32"], {"i": 1790004, "t": "direct", "c": null, "e": [["tile_n", "sp", [1, 1, 1, 1]], ["tile_g", "sp", [32, 1]], ["tile_f", "sp", [1, 2, 2, 1]], ["tile_y", "sp", [11, 1, 1, 5]], ["tile_x", "sp", [1, 1, 55, 1]], ["tile_rc", "sp", [1, 4]], ["tile_ry", "sp", [3, 1]], ["tile_rx", "sp", [1, 3]], ["auto_unroll_max_step", "ot", 0], ["unroll_explicit", "ot", 1], ["fuse_yx", "ot", 1]]}], "r": [[1.4915306581059392e-05], 0, 7.06926703453064, 1573958567.17633], "v": 0.1}
{"i": ["cuda -model=unknown", "topi_nn_conv2d", [["TENSOR", [1, 128, 55, 55], "float32"], ["TENSOR", [256, 128, 1, 1], "float32"], [1, 1], [0, 0], [1, 1], "NCHW", "float32"], {}, ["conv2d", [1, 128, 55, 55, "float32"], [256, 128, 1, 1, "float32"], [1, 1], [0, 0], [1, 1], "NCHW", "float32"], {"i": 739420, "t": "direct", "c": null, "e": [["tile_f", "sp", [16, 4, 2, 2]], ["tile_y", "sp", [11, 5, 1, 1]], ["tile_x", "sp", [1, 1, 55, 1]], ["tile_rc", "sp", [64, 2]], ["tile_ry", "sp", [1, 1]], ["tile_rx", "sp", [1, 1]], ["auto_unroll_max_step", "ot", 1500], ["unroll_explicit", "ot", 0]]}], "r": [[6.257330440927078e-05], 0, 10.038073539733887, 1573973887.4170735], "v": 0.1}
{"i": ["cuda -model=unknown", "topi_nn_conv2d", [["TENSOR", [1, 256, 55, 55], "float32"], ["TENSOR", [256, 256, 1, 1], "float32"], [1, 1], [0, 0], [1, 1], "NCHW", "float32"], {}, ["conv2d", [1, 256, 55, 55, "float32"], [256, 256, 1, 1, "float32"], [1, 1], [0, 0], [1, 1], "NCHW", "float32"], {"i": 1585497, "t": "direct", "c": null, "e": [["tile_f", "sp", [16, 8, 2, 1]], ["tile_y", "sp", [11, 1, 1, 5]], ["tile_x", "sp", [1, 1, 55, 1]], ["tile_rc", "sp", [128, 2]], ["tile_ry", "sp", [1, 1]], ["tile_rx", "sp", [1, 1]], ["auto_unroll_max_step", "ot", 512], ["unroll_explicit", "ot", 1]]}], "r": [[0.00011077360918888258], 0, 10.219779968261719, 1573985380.253083], "v": 0.1}
{"i": ["cuda -model=unknown", "topi_nn_group_conv2d_nchw", [["TENSOR", [1, 256, 55, 55], "float32"], ["TENSOR", [256, 8, 3, 3], "float32"], [2, 2], [1, 1], [1, 1], 32, "float32"], {}, ["group_conv2d_nchw", [1, 256, 55, 55, "float32"], [256, 8, 3, 3, "float32"], [2, 2], [1, 1], [1, 1], 32, "float32"], {"i": 33140484, "t": "direct", "c": null, "e": [["tile_n", "sp", [1, 1, 1, 1]], ["tile_g", "sp", [32, 1]], ["tile_f", "sp", [1, 2, 2, 2]], ["tile_y", "sp", [7, 1, 4, 1]], ["tile_x", "sp", [2, 1, 7, 2]], ["tile_rc", "sp", [8, 1]], ["tile_ry", "sp", [1, 3]], ["tile_rx", "sp", [1, 3]], ["auto_unroll_max_step", "ot", 512], ["unroll_explicit", "ot", 1], ["fuse_yx", "ot", 1]]}], "r": [[3.2059559566787e-05], 0, 6.8657941818237305, 1573999618.1849592], "v": 0.1}
{"i": ["cuda -model=unknown", "topi_nn_conv2d", [["TENSOR", [1, 256, 55, 55], "float32"], ["TENSOR", [512, 256, 1, 1], "float32"], [2, 2], [0, 0], [1, 1], "NCHW", "float32"], {}, ["conv2d", [1, 256, 55, 55, "float32"], [512, 256, 1, 1, "float32"], [2, 2], [0, 0], [1, 1], "NCHW", "float32"], {"i": 7536851, "t": "direct", "c": null, "e": [["tile_f", "sp", [4, 2, 32, 2]], ["tile_y", "sp", [14, 1, 1, 2]], ["tile_x", "sp", [1, 2, 14, 1]], ["tile_rc", "sp", [32, 8]], ["tile_ry", "sp", [1, 1]], ["tile_rx", "sp", [1, 1]], ["auto_unroll_max_step", "ot", 1500], ["unroll_explicit", "ot", 0]]}], "r": [[6.612127426390404e-05], 0, 7.117464303970337, 1574025355.5617294], "v": 0.1}
{"i": ["cuda -model=unknown", "topi_nn_conv2d", [["TENSOR", [1, 256, 28, 28], "float32"], ["TENSOR", [512, 256, 1, 1], "float32"], [1, 1], [0, 0], [1, 1], "NCHW", "float32"], {}, ["conv2d", [1, 256, 28, 28, "float32"], [512, 256, 1, 1, "float32"], [1, 1], [0, 0], [1, 1], "NCHW", "float32"], {"i": 1154246, "t": "direct", "c": null, "e": [["tile_f", "sp", [8, 1, 16, 4]], ["tile_y", "sp", [14, 1, 2, 1]], ["tile_x", "sp", [1, 7, 4, 1]], ["tile_rc", "sp", [32, 8]], ["tile_ry", "sp", [1, 1]], ["tile_rx", "sp", [1, 1]], ["auto_unroll_max_step", "ot", 0], ["unroll_explicit", "ot", 0]]}], "r": [[5.190895399305556e-05], 0, 6.706566572189331, 1574031884.3066905], "v": 0.1}
{"i": ["cuda -model=unknown", "topi_nn_conv2d", [["TENSOR", [1, 512, 28, 28], "float32"], ["TENSOR", [512, 512, 1, 1], "float32"], [1, 1], [0, 0], [1, 1], "NCHW", "float32"], {}, ["conv2d", [1, 512, 28, 28, "float32"], [512, 512, 1, 1, "float32"], [1, 1], [0, 0], [1, 1], "NCHW", "float32"], {"i": 1205850, "t": "direct", "c": null, "e": [["tile_f", "sp", [8, 8, 8, 1]], ["tile_y", "sp", [14, 2, 1, 1]], ["tile_x", "sp", [1, 1, 28, 1]], ["tile_rc", "sp", [64, 8]], ["tile_ry", "sp", [1, 1]], ["tile_rx", "sp", [1, 1]], ["auto_unroll_max_step", "ot", 0], ["unroll_explicit", "ot", 0]]}], "r": [[9.280022867803837e-05], 0, 6.640348672866821, 1574048621.4979584], "v": 0.1}
{"i": ["cuda -model=unknown", "topi_nn_group_conv2d_nchw", [["TENSOR", [1, 512, 28, 28], "float32"], ["TENSOR", [512, 16, 3, 3], "float32"], [2, 2], [1, 1], [1, 1], 32, "float32"], {}, ["group_conv2d_nchw", [1, 512, 28, 28, "float32"], [512, 16, 3, 3, "float32"], [2, 2], [1, 1], [1, 1], 32, "float32"], {"i": 5198208, "t": "direct", "c": null, "e": [["tile_n", "sp", [1, 1, 1, 1]], ["tile_g", "sp", [32, 1]], ["tile_f", "sp", [1, 2, 8, 1]], ["tile_y", "sp", [7, 2, 1, 1]], ["tile_x", "sp", [1, 1, 7, 2]], ["tile_rc", "sp", [8, 2]], ["tile_ry", "sp", [1, 3]], ["tile_rx", "sp", [1, 3]], ["auto_unroll_max_step", "ot", 512], ["unroll_explicit", "ot", 1], ["fuse_yx", "ot", 0]]}], "r": [[1.3884471260926835e-05], 0, 9.918406009674072, 1574068131.0074804], "v": 0.1}
{"i": ["cuda -model=unknown", "topi_nn_conv2d", [["TENSOR", [1, 512, 28, 28], "float32"], ["TENSOR", [1024, 512, 1, 1], "float32"], [2, 2], [0, 0], [1, 1], "NCHW", "float32"], {}, ["conv2d", [1, 512, 28, 28, "float32"], [1024, 512, 1, 1, "float32"], [2, 2], [0, 0], [1, 1], "NCHW", "float32"], {"i": 3260726, "t": "direct", "c": null, "e": [["tile_f", "sp", [16, 4, 16, 1]], ["tile_y", "sp", [7, 1, 1, 2]], ["tile_x", "sp", [1, 1, 14, 1]], ["tile_rc", "sp", [32, 16]], ["tile_ry", "sp", [1, 1]], ["tile_rx", "sp", [1, 1]], ["auto_unroll_max_step", "ot", 512], ["unroll_explicit", "ot", 1]]}], "r": [[6.91609691679049e-05], 0, 7.08815860748291, 1574081567.2161987], "v": 0.1}
{"i": ["cuda -model=unknown", "topi_nn_conv2d", [["TENSOR", [1, 1024, 14, 14], "float32"], ["TENSOR", [512, 1024, 1, 1], "float32"], [1, 1], [0, 0], [1, 1], "NCHW", "float32"], {}, ["conv2d", [1, 1024, 14, 14, "float32"], [512, 1024, 1, 1, "float32"], [1, 1], [0, 0], [1, 1], "NCHW", "float32"], {"i": 2732421, "t": "direct", "c": null, "e": [["tile_f", "sp", [32, 4, 4, 1]], ["tile_y", "sp", [7, 1, 2, 1]], ["tile_x", "sp", [1, 1, 14, 1]], ["tile_rc", "sp", [64, 16]], ["tile_ry", "sp", [1, 1]], ["tile_rx", "sp", [1, 1]], ["auto_unroll_max_step", "ot", 512], ["unroll_explicit", "ot", 1]]}], "r": [[8.957158973055414e-05], 0, 6.640005350112915, 1574096486.0628154], "v": 0.1}
{"i": ["cuda -model=unknown", "topi_nn_group_conv2d_nchw", [["TENSOR", [1, 512, 14, 14], "float32"], ["TENSOR", [512, 16, 3, 3], "float32"], [1, 1], [1, 1], [1, 1], 32, "float32"], {}, ["group_conv2d_nchw", [1, 512, 14, 14, "float32"], [512, 16, 3, 3, "float32"], [1, 1], [1, 1], [1, 1], 32, "float32"], {"i": 8198790, "t": "direct", "c": null, "e": [["tile_n", "sp", [1, 1, 1, 1]], ["tile_g", "sp", [32, 1]], ["tile_f", "sp", [1, 1, 4, 4]], ["tile_y", "sp", [7, 2, 1, 1]], ["tile_x", "sp", [1, 1, 14, 1]], ["tile_rc", "sp", [4, 4]], ["tile_ry", "sp", [3, 1]], ["tile_rx", "sp", [1, 3]], ["auto_unroll_max_step", "ot", 512], ["unroll_explicit", "ot", 0], ["fuse_yx", "ot", 1]]}], "r": [[1.2975129166666666e-05], 0, 6.821576356887817, 1574108698.8346357], "v": 0.1}
{"i": ["cuda -model=unknown", "topi_nn_conv2d", [["TENSOR", [1, 512, 14, 14], "float32"], ["TENSOR", [1024, 512, 1, 1], "float32"], [1, 1], [0, 0], [1, 1], "NCHW", "float32"], {}, ["conv2d", [1, 512, 14, 14, "float32"], [1024, 512, 1, 1, "float32"], [1, 1], [0, 0], [1, 1], "NCHW", "float32"], {"i": 2453109, "t": "direct", "c": null, "e": [["tile_f", "sp", [32, 4, 4, 2]], ["tile_y", "sp", [7, 2, 1, 1]], ["tile_x", "sp", [1, 1, 14, 1]], ["tile_rc", "sp", [64, 8]], ["tile_ry", "sp", [1, 1]], ["tile_rx", "sp", [1, 1]], ["auto_unroll_max_step", "ot", 0], ["unroll_explicit", "ot", 1]]}], "r": [[6.489757043879907e-05], 0, 8.02766489982605, 1574123344.1145794], "v": 0.1}
{"i": ["cuda -model=unknown", "topi_nn_conv2d", [["TENSOR", [1, 1024, 14, 14], "float32"], ["TENSOR", [1024, 1024, 1, 1], "float32"], [1, 1], [0, 0], [1, 1], "NCHW", "float32"], {}, ["conv2d", [1, 1024, 14, 14, "float32"], [1024, 1024, 1, 1, "float32"], [1, 1], [0, 0], [1, 1], "NCHW", "float32"], {"i": 1863662, "t": "direct", "c": null, "e": [["tile_f", "sp", [64, 2, 4, 2]], ["tile_y", "sp", [7, 1, 2, 1]], ["tile_x", "sp", [1, 2, 7, 1]], ["tile_rc", "sp", [128, 8]], ["tile_ry", "sp", [1, 1]], ["tile_rx", "sp", [1, 1]], ["auto_unroll_max_step", "ot", 1500], ["unroll_explicit", "ot", 0]]}], "r": [[0.00013704472009764035], 0, 9.601491928100586, 1574134281.6130686], "v": 0.1}
{"i": ["cuda -model=unknown", "topi_nn_group_conv2d_nchw", [["TENSOR", [1, 1024, 14, 14], "float32"], ["TENSOR", [1024, 32, 3, 3], "float32"], [2, 2], [1, 1], [1, 1], 32, "float32"], {}, ["group_conv2d_nchw", [1, 1024, 14, 14, "float32"], [1024, 32, 3, 3, "float32"], [2, 2], [1, 1], [1, 1], 32, "float32"], {"i": 1388472, "t": "direct", "c": null, "e": [["tile_n", "sp", [1, 1, 1, 1]], ["tile_g", "sp", [32, 1]], ["tile_f", "sp", [1, 1, 32, 1]], ["tile_y", "sp", [7, 1, 1, 1]], ["tile_x", "sp", [1, 7, 1, 1]], ["tile_rc", "sp", [32, 1]], ["tile_ry", "sp", [1, 3]], ["tile_rx", "sp", [1, 3]], ["auto_unroll_max_step", "ot", 512], ["unroll_explicit", "ot", 1], ["fuse_yx", "ot", 1]]}], "r": [[2.4652954745780933e-05], 0, 8.98454761505127, 1574148194.766565], "v": 0.1}
{"i": ["cuda -model=unknown", "topi_nn_conv2d", [["TENSOR", [1, 1024, 14, 14], "float32"], ["TENSOR", [2048, 1024, 1, 1], "float32"], [2, 2], [0, 0], [1, 1], "NCHW", "float32"], {}, ["conv2d", [1, 1024, 14, 14, "float32"], [2048, 1024, 1, 1, "float32"], [2, 2], [0, 0], [1, 1], "NCHW", "float32"], {"i": 148635, "t": "direct", "c": null, "e": [["tile_f", "sp", [32, 1, 32, 2]], ["tile_y", "sp", [7, 1, 1, 1]], ["tile_x", "sp", [1, 1, 7, 1]], ["tile_rc", "sp", [128, 8]], ["tile_ry", "sp", [1, 1]], ["tile_rx", "sp", [1, 1]], ["auto_unroll_max_step", "ot", 1500], ["unroll_explicit", "ot", 0]]}], "r": [[0.0001866506875], 0, 5.2632737159729, 1574159603.2466702], "v": 0.1}
{"i": ["cuda -model=unknown", "topi_nn_conv2d", [["TENSOR", [1, 2048, 7, 7], "float32"], ["TENSOR", [1024, 2048, 1, 1], "float32"], [1, 1], [0, 0], [1, 1], "NCHW", "float32"], {}, ["conv2d", [1, 2048, 7, 7, "float32"], [1024, 2048, 1, 1, "float32"], [1, 1], [0, 0], [1, 1], "NCHW", "float32"], {"i": 25878, "t": "direct", "c": null, "e": [["tile_f", "sp", [64, 1, 4, 4]], ["tile_y", "sp", [1, 1, 7, 1]], ["tile_x", "sp", [1, 1, 7, 1]], ["tile_rc", "sp", [64, 32]], ["tile_ry", "sp", [1, 1]], ["tile_rx", "sp", [1, 1]], ["auto_unroll_max_step", "ot", 0], ["unroll_explicit", "ot", 0]]}], "r": [[0.00020030179982206405], 0, 6.088423013687134, 1574168874.9715226], "v": 0.1}
{"i": ["cuda -model=unknown", "topi_nn_group_conv2d_nchw", [["TENSOR", [1, 1024, 7, 7], "float32"], ["TENSOR", [1024, 32, 3, 3], "float32"], [1, 1], [1, 1], [1, 1], 32, "float32"], {}, ["group_conv2d_nchw", [1, 1024, 7, 7, "float32"], [1024, 32, 3, 3, "float32"], [1, 1], [1, 1], [1, 1], 32, "float32"], {"i": 1018200, "t": "direct", "c": null, "e": [["tile_n", "sp", [1, 1, 1, 1]], ["tile_g", "sp", [32, 1]], ["tile_f", "sp", [1, 1, 32, 1]], ["tile_y", "sp", [1, 1, 7, 1]], ["tile_x", "sp", [1, 7, 1, 1]], ["tile_rc", "sp", [4, 8]], ["tile_ry", "sp", [1, 3]], ["tile_rx", "sp", [1, 3]], ["auto_unroll_max_step", "ot", 512], ["unroll_explicit", "ot", 0], ["fuse_yx", "ot", 1]]}], "r": [[2.0897330444203684e-05], 0, 8.735088348388672, 1574177962.7853763], "v": 0.1}
{"i": ["cuda -model=unknown", "topi_nn_conv2d", [["TENSOR", [1, 1024, 7, 7], "float32"], ["TENSOR", [2048, 1024, 1, 1], "float32"], [1, 1], [0, 0], [1, 1], "NCHW", "float32"], {}, ["conv2d", [1, 1024, 7, 7, "float32"], [2048, 1024, 1, 1, "float32"], [1, 1], [0, 0], [1, 1], "NCHW", "float32"], {"i": 283400, "t": "direct", "c": null, "e": [["tile_f", "sp", [128, 1, 2, 8]], ["tile_y", "sp", [1, 1, 7, 1]], ["tile_x", "sp", [1, 1, 7, 1]], ["tile_rc", "sp", [64, 16]], ["tile_ry", "sp", [1, 1]], ["tile_rx", "sp", [1, 1]], ["auto_unroll_max_step", "ot", 512], ["unroll_explicit", "ot", 1]]}], "r": [[0.0001286573644200627], 0, 7.764569044113159, 1574189027.625855], "v": 0.1}
{"i": ["cuda -model=unknown", "topi_nn_conv2d", [["TENSOR", [1, 2048, 7, 7], "float32"], ["TENSOR", [256, 2048, 1, 1], "float32"], [1, 1], [0, 0], [1, 1], "NCHW", "float32"], {}, ["conv2d", [1, 2048, 7, 7, "float32"], [256, 2048, 1, 1, "float32"], [1, 1], [0, 0], [1, 1], "NCHW", "float32"], {"i": 11910, "t": "direct", "c": null, "e": [["tile_f", "sp", [16, 1, 16, 1]], ["tile_y", "sp", [7, 1, 1, 1]], ["tile_x", "sp", [1, 1, 7, 1]], ["tile_rc", "sp", [128, 16]], ["tile_ry", "sp", [1, 1]], ["tile_rx", "sp", [1, 1]], ["auto_unroll_max_step", "ot", 0], ["unroll_explicit", "ot", 0]]}], "r": [[8.775259614260666e-05], 0, 7.815835952758789, 1574194271.110065], "v": 0.1}
{"i": ["cuda -model=unknown", "topi_nn_conv2d", [["TENSOR", [1, 1024, 14, 14], "float32"], ["TENSOR", [256, 1024, 1, 1], "float32"], [1, 1], [0, 0], [1, 1], "NCHW", "float32"], {}, ["conv2d", [1, 1024, 14, 14, "float32"], [256, 1024, 1, 1, "float32"], [1, 1], [0, 0], [1, 1], "NCHW", "float32"], {"i": 645499, "t": "direct", "c": null, "e": [["tile_f", "sp", [16, 4, 4, 1]], ["tile_y", "sp", [1, 1, 14, 1]], ["tile_x", "sp", [7, 1, 2, 1]], ["tile_rc", "sp", [64, 16]], ["tile_ry", "sp", [1, 1]], ["tile_rx", "sp", [1, 1]], ["auto_unroll_max_step", "ot", 512], ["unroll_explicit", "ot", 0]]}], "r": [[5.885656766642283e-05], 0, 6.318606376647949, 1574200544.2414534], "v": 0.1}
{"i": ["cuda -model=unknown", "topi_nn_conv2d", [["TENSOR", [1, 512, 28, 28], "float32"], ["TENSOR", [256, 512, 1, 1], "float32"], [1, 1], [0, 0], [1, 1], "NCHW", "float32"], {}, ["conv2d", [1, 512, 28, 28, "float32"], [256, 512, 1, 1, "float32"], [1, 1], [0, 0], [1, 1], "NCHW", "float32"], {"i": 6120371, "t": "direct", "c": null, "e": [["tile_f", "sp", [8, 4, 8, 1]], ["tile_y", "sp", [2, 2, 7, 1]], ["tile_x", "sp", [7, 2, 2, 1]], ["tile_rc", "sp", [64, 8]], ["tile_ry", "sp", [1, 1]], ["tile_rx", "sp", [1, 1]], ["auto_unroll_max_step", "ot", 1500], ["unroll_explicit", "ot", 0]]}], "r": [[6.251636966088533e-05], 0, 7.239479303359985, 1574219009.990471], "v": 0.1}
{"i": ["cuda -model=unknown", "topi_nn_group_conv2d_nchw", [["TENSOR", [1, 256, 28, 28], "float32"], ["TENSOR", [256, 8, 3, 3], "float32"], [1, 1], [1, 1], [1, 1], 32, "float32"], {}, ["group_conv2d_nchw", [1, 256, 28, 28, "float32"], [256, 8, 3, 3, "float32"], [1, 1], [1, 1], [1, 1], 32, "float32"], {"i": 2003970, "t": "direct", "c": null, "e": [["tile_n", "sp", [1, 1, 1, 1]], ["tile_g", "sp", [32, 1]], ["tile_f", "sp", [1, 1, 4, 2]], ["tile_y", "sp", [7, 2, 1, 2]], ["tile_x", "sp", [1, 1, 28, 1]], ["tile_rc", "sp", [2, 4]], ["tile_ry", "sp", [3, 1]], ["tile_rx", "sp", [1, 3]], ["auto_unroll_max_step", "ot", 0], ["unroll_explicit", "ot", 0], ["fuse_yx", "ot", 0]]}], "r": [[1.035111562203229e-05], 0, 6.431726455688477, 1574232716.5500002], "v": 0.1}
{"i": ["cuda -model=unknown", "topi_nn_group_conv2d_nchw", [["TENSOR", [1, 256, 28, 28], "float32"], ["TENSOR", [256, 8, 1, 1], "float32"], [1, 1], [0, 0], [1, 1], 32, "float32"], {}, ["group_conv2d_nchw", [1, 256, 28, 28, "float32"], [256, 8, 1, 1, "float32"], [1, 1], [0, 0], [1, 1], 32, "float32"], {"i": 7570884, "t": "direct", "c": null, "e": [["tile_n", "sp", [1, 1, 1, 1]], ["tile_g", "sp", [32, 1]], ["tile_f", "sp", [1, 2, 2, 2]], ["tile_y", "sp", [7, 1, 4, 1]], ["tile_x", "sp", [1, 1, 28, 1]], ["tile_rc", "sp", [1, 8]], ["tile_ry", "sp", [1, 1]], ["tile_rx", "sp", [1, 1]], ["auto_unroll_max_step", "ot", 0], ["unroll_explicit", "ot", 1], ["fuse_yx", "ot", 1]]}], "r": [[3.678144077542303e-06], 0, 6.9778265953063965, 1574248148.0581188], "v": 0.1}
{"i": ["cuda -model=unknown", "topi_nn_conv2d", [["TENSOR", [1, 256, 1, 1], "float32"], ["TENSOR", [128, 256, 1, 1], "float32"], [1, 1], [0, 0], [1, 1], "NCHW", "float32"], {}, ["conv2d", [1, 256, 1, 1, "float32"], [128, 256, 1, 1, "float32"], [1, 1], [0, 0], [1, 1], "NCHW", "float32"], {"i": 4208, "t": "direct", "c": null, "e": [["tile_f", "sp", [64, 1, 2, 1]], ["tile_y", "sp", [1, 1, 1, 1]], ["tile_x", "sp", [1, 1, 1, 1]], ["tile_rc", "sp", [1, 256]], ["tile_ry", "sp", [1, 1]], ["tile_rx", "sp", [1, 1]], ["auto_unroll_max_step", "ot", 0], ["unroll_explicit", "ot", 1]]}], "r": [[9.029537459283389e-06], 0, 6.02771520614624, 1574257278.3647773], "v": 0.1}
{"i": ["cuda -model=unknown", "topi_nn_dense", [["TENSOR", [1, 2048], "float32"], ["TENSOR", [128, 2048], "float32"], null, "float32"], {}, ["dense", [1, 2048, "float32"], [128, 2048, "float32"], 0, "float32"], {"i": 6, "t": "direct", "c": null, "e": [["tile_k", "sp", [-1, 64]]]}], "r": [[5.5413e-06, 5.5473e-06, 5.55e-06, 5.5521e-06, 5.5707e-06, 5.7044e-06, 5.9777e-06, 6.149500000000001e-06], 0, 2.414106845855713, 1574857841.4397752], "v": 0.1}
{"i": ["cuda -model=unknown", "topi_nn_group_conv2d_nchw", [["TENSOR", [1, 512, 28, 28], "float32"], ["TENSOR", [256, 16, 1, 1], "float32"], [1, 1], [0, 0], [1, 1], 32, "float32"], {}, ["group_conv2d_nchw", [1, 512, 28, 28, "float32"], [256, 16, 1, 1, "float32"], [1, 1], [0, 0], [1, 1], 32, "float32"], {"i": 11012005, "t": "direct", "c": null, "e": [["tile_n", "sp", [-1, 1, 1, 1]], ["tile_g", "sp", [-1, 2]], ["tile_f", "sp", [-1, 2, 2, 2]], ["tile_y", "sp", [-1, 1, 2, 1]], ["tile_x", "sp", [-1, 4, 7, 1]], ["tile_rc", "sp", [-1, 4]], ["tile_ry", "sp", [-1, 1]], ["tile_rx", "sp", [-1, 1]], ["auto_unroll_max_step", "ot", 1500], ["unroll_explicit", "ot", 1], ["fuse_yx", "ot", 1]]}], "r": [[1.1739049999999999e-05, 1.175655e-05, 1.177705e-05, 1.18496e-05, 1.18502e-05, 1.20271e-05, 1.20581e-05, 1.2528800000000001e-05], 0, 1.834155559539795, 1574857865.1674657], "v": 0.1}
{"i": ["cuda -model=unknown", "topi_nn_dense", [["TENSOR", [1, 256], "float32"], ["TENSOR", [128, 256], "float32"], null, "float32"], {}, ["dense", [1, 256, "float32"], [128, 256, "float32"], 0, "float32"], {"i": 7, "t": "direct", "c": null, "e": [["tile_k", "sp", [-1, 128]]]}], "r": [[3.66835e-06, 3.6884e-06, 3.822e-06, 3.8338e-06, 3.8451e-06, 3.8921e-06, 4.15175e-06, 4.85405e-06], 0, 1.8813958168029785, 1574857869.0389106], "v": 0.1}
{"i": ["cuda -model=unknown", "topi_nn_group_conv2d_nchw", [["TENSOR", [1, 512, 28, 28], "float32"], ["TENSOR", [512, 16, 3, 3], "float32"], [2, 2], [1, 1], [1, 1], 32, "float32"], {}, ["group_conv2d_nchw", [1, 512, 28, 28, "float32"], [512, 16, 3, 3, "float32"], [2, 2], [1, 1], [1, 1], 32, "float32"], {"i": 7606758, "t": "direct", "c": null, "e": [["tile_n", "sp", [-1, 1, 1, 1]], ["tile_g", "sp", [-1, 1]], ["tile_f", "sp", [-1, 2, 4, 2]], ["tile_y", "sp", [-1, 1, 2, 7]], ["tile_x", "sp", [-1, 2, 7, 1]], ["tile_rc", "sp", [-1, 2]], ["tile_ry", "sp", [-1, 1]], ["tile_rx", "sp", [-1, 1]], ["auto_unroll_max_step", "ot", 512], ["unroll_explicit", "ot", 0], ["fuse_yx", "ot", 1]]}], "r": [[0.00036273698066783834, 0.000362737755711775, 0.0003627458189806678, 0.00036275030931458697, 0.00036275584710017574, 0.0003627558769771529, 0.00036275758172231985, 0.00036393075571177505], 0, 4.2930920124053955, 1574857712.9514697], "v": 0.1}
{"i": ["cuda -model=unknown", "topi_nn_group_conv2d_nchw", [["TENSOR", [1, 512, 14, 14], "float32"], ["TENSOR", [512, 16, 3, 3], "float32"], [1, 1], [1, 1], [1, 1], 32, "float32"], {}, ["group_conv2d_nchw", [1, 512, 14, 14, "float32"], [512, 16, 3, 3, "float32"], [1, 1], [1, 1], [1, 1], 32, "float32"], {"i": 10393878, "t": "direct", "c": null, "e": [["tile_n", "sp", [-1, 1, 1, 1]], ["tile_g", "sp", [-1, 1]], ["tile_f", "sp", [-1, 2, 4, 2]], ["tile_y", "sp", [-1, 1, 7, 1]], ["tile_x", "sp", [-1, 7, 2, 1]], ["tile_rc", "sp", [-1, 8]], ["tile_ry", "sp", [-1, 1]], ["tile_rx", "sp", [-1, 3]], ["auto_unroll_max_step", "ot", 0], ["unroll_explicit", "ot", 1], ["fuse_yx", "ot", 1]]}], "r": [[2.9161525599568847e-05, 4.958258542171921e-05, 6.104159471840475e-05, 6.202925922931824e-05, 6.208235233090811e-05, 6.214719199676637e-05, 7.804212193478847e-05, 7.971016181622204e-05], 0, 5.406991004943848, 1574857563.3209715], "v": 0.1}
{"i": ["cuda -model=unknown", "topi_nn_group_conv2d_nchw", [["TENSOR", [1, 512, 14, 14], "float32"], ["TENSOR", [256, 16, 1, 1], "float32"], [1, 1], [0, 0], [1, 1], 32, "float32"], {}, ["group_conv2d_nchw", [1, 512, 14, 14, "float32"], [256, 16, 1, 1, "float32"], [1, 1], [0, 0], [1, 1], 32, "float32"], {"i": 1828580, "t": "direct", "c": null, "e": [["tile_n", "sp", [-1, 1, 1, 1]], ["tile_g", "sp", [-1, 4]], ["tile_f", "sp", [-1, 8, 1, 1]], ["tile_y", "sp", [-1, 1, 7, 1]], ["tile_x", "sp", [-1, 1, 14, 1]], ["tile_rc", "sp", [-1, 16]], ["tile_ry", "sp", [-1, 1]], ["tile_rx", "sp", [-1, 1]], ["auto_unroll_max_step", "ot", 1500], ["unroll_explicit", "ot", 1], ["fuse_yx", "ot", 1]]}], "r": [[4.431817697863974e-06], 0, 2.214712381362915, 1574855857.5842857], "v": 0.1}
