mytophub/20191227/vgg16_bs_1.log
{"i": ["cuda -model=unknown", "topi_nn_conv2d", [["TENSOR", [1, 3, 224, 224], "float32"], ["TENSOR", [64, 3, 3, 3], "float32"], [1, 1], [1, 1], [1, 1], "NCHW", "float32"], {}, ["conv2d", [1, 3, 224, 224, "float32"], [64, 3, 3, 3, "float32"], [1, 1], [1, 1], [1, 1], "NCHW", "float32"], {"i": 110545142, "t": "direct", "c": null, "e": [["tile_f", "sp", [-1, 2, 1, 4]], ["tile_y", "sp", [-1, 2, 2, 1]], ["tile_x", "sp", [-1, 1, 28, 1]], ["tile_rc", "sp", [-1, 1]], ["tile_ry", "sp", [-1, 3]], ["tile_rx", "sp", [-1, 1]], ["auto_unroll_max_step", "ot", 0], ["unroll_explicit", "ot", 1]]}], "r": [[6.0289909044844186e-05, 6.030973853559665e-05, 6.033552039523689e-05, 6.0351307068659744e-05, 6.035974740309095e-05, 6.0368374714973394e-05, 6.038294476817837e-05, 6.046449657968077e-05], 0, 6.081462383270264, 1576639639.1194658], "v": 0.1}
{"i": ["cuda -model=unknown", "topi_nn_conv2d", [["TENSOR", [1, 64, 224, 224], "float32"], ["TENSOR", [64, 64, 3, 3], "float32"], [1, 1], [1, 1], [1, 1], "NCHW", "float32"], {}, ["conv2d", [1, 64, 224, 224, "float32"], [64, 64, 3, 3, "float32"], [1, 1], [1, 1], [1, 1], "NCHW", "float32"], {"i": 219649, "t": "winograd", "c": null, "e": [["tile_b", "sp", [-1, 1, 1, 1]], ["tile_y", "sp", [-1, 1, 8, 8]], ["tile_x", "sp", [-1, 4, 16, 1]], ["tile_rc", "sp", [-1, 8]], ["auto_unroll_max_step", "ot", 0], ["unroll_explicit", "ot", 0]]}], "r": [[0.0006486326379310344, 0.0006487552025862069, 0.0006487734396551725, 0.0006488455, 0.0006488479181034483, 0.0006488770474137931, 0.0006489530775862068, 0.0006489756034482758], 0, 4.759263515472412, 1576641806.1470792], "v": 0.1}
{"i": ["cuda -model=unknown", "topi_nn_conv2d", [["TENSOR", [1, 64, 112, 112], "float32"], ["TENSOR", [128, 64, 3, 3], "float32"], [1, 1], [1, 1], [1, 1], "NCHW", "float32"], {}, ["conv2d", [1, 64, 112, 112, "float32"], [128, 64, 3, 3, "float32"], [1, 1], [1, 1], [1, 1], "NCHW", "float32"], {"i": 427400, "t": "winograd", "c": null, "e": [["tile_b", "sp", [-1, 1, 1, 1]], ["tile_y", "sp", [-1, 2, 8, 4]], ["tile_x", "sp", [-1, 7, 16, 1]], ["tile_rc", "sp", [-1, 8]], ["auto_unroll_max_step", "ot", 128], ["unroll_explicit", "ot", 0]]}], "r": [[0.00026877778747203576, 0.0002687925212527964, 0.000268806870246085, 0.00026880836241610737, 0.0002688106029082774, 0.0002689192125279642, 0.000268941615212528, 0.00026932233668903804], 0, 6.267563581466675, 1576644767.460554], "v": 0.1}
{"i": ["cuda -model=unknown", "topi_nn_conv2d", [["TENSOR", [1, 128, 112, 112], "float32"], ["TENSOR", [128, 128, 3, 3], "float32"], [1, 1], [1, 1], [1, 1], "NCHW", "float32"], {}, ["conv2d", [1, 128, 112, 112, "float32"], [128, 128, 3, 3, "float32"], [1, 1], [1, 1], [1, 1], "NCHW", "float32"], {"i": 1141417, "t": "winograd", "c": null, "e": [["tile_b", "sp", [-1, 1, 1, 1]], ["tile_y", "sp", [-1, 1, 8, 8]], ["tile_x", "sp", [-1, 7, 16, 1]], ["tile_rc", "sp", [-1, 8]], ["auto_unroll_max_step", "ot", 0], ["unroll_explicit", "ot", 1]]}], "r": [[0.0003633437602905569, 0.0003634449031476998, 0.0003634681016949152, 0.000363498598062954, 0.00036350954479418885, 0.00036362252300242134, 0.0003636384043583535, 0.0003637305544794189], 0, 7.891664743423462, 1576647452.214853], "v": 0.1}
{"i": ["cuda -model=unknown", "topi_nn_conv2d", [["TENSOR", [1, 128, 56, 56], "float32"], ["TENSOR", [256, 128, 3, 3], "float32"], [1, 1], [1, 1], [1, 1], "NCHW", "float32"], {}, ["conv2d", [1, 128, 56, 56, "float32"], [256, 128, 3, 3, "float32"], [1, 1], [1, 1], [1, 1], "NCHW", "float32"], {"i": 318380, "t": "winograd", "c": null, "e": [["tile_b", "sp", [-1, 1, 1, 1]], ["tile_y", "sp", [-1, 2, 4, 4]], ["tile_x", "sp", [-1, 7, 28, 1]], ["tile_rc", "sp", [-1, 8]], ["auto_unroll_max_step", "ot", 1500], ["unroll_explicit", "ot", 0]]}], "r": [[0.0001731678460987831, 0.00017317816320687186, 0.00017323992197566213, 0.00017326432641374373, 0.00017327575232641373, 0.00017328797136721547, 0.00017329106800286327, 0.0001732960365068003], 0, 21.01165533065796, 1576650634.9818578], "v": 0.1}
{"i": ["cuda -model=unknown", "topi_nn_conv2d", [["TENSOR", [1, 256, 56, 56], "float32"], ["TENSOR", [256, 256, 3, 3], "float32"], [1, 1], [1, 1], [1, 1], "NCHW", "float32"], {}, ["conv2d", [1, 256, 56, 56, "float32"], [256, 256, 3, 3, "float32"], [1, 1], [1, 1], [1, 1], "NCHW", "float32"], {"i": 351380, "t": "winograd", "c": null, "e": [["tile_b", "sp", [-1, 1, 1, 1]], ["tile_y", "sp", [-1, 2, 4, 4]], ["tile_x", "sp", [-1, 7, 28, 1]], ["tile_rc", "sp", [-1, 8]], ["auto_unroll_max_step", "ot", 1500], ["unroll_explicit", "ot", 0]]}], "r": [[0.00026320864526659414, 0.0002632155527747552, 0.00026323465070729056, 0.00026325022959738844, 0.00026325169967355823, 0.0002633182208922742, 0.0002633227769314472, 0.0002633241109902068], 0, 34.0358304977417, 1576653622.5075867], "v": 0.1}
{"i": ["cuda -model=unknown", "topi_nn_conv2d", [["TENSOR", [1, 256, 28, 28], "float32"], ["TENSOR", [512, 256, 3, 3], "float32"], [1, 1], [1, 1], [1, 1], "NCHW", "float32"], {}, ["conv2d", [1, 256, 28, 28, "float32"], [512, 256, 3, 3, "float32"], [1, 1], [1, 1], [1, 1], "NCHW", "float32"], {"i": 468529, "t": "winograd", "c": null, "e": [["tile_b", "sp", [-1, 1, 1, 1]], ["tile_y", "sp", [-1, 1, 4, 8]], ["tile_x", "sp", [-1, 7, 28, 1]], ["tile_rc", "sp", [-1, 8]], ["auto_unroll_max_step", "ot", 1500], ["unroll_explicit", "ot", 0]]}], "r": [[0.00018472845107033638, 0.00018478204204892967, 0.0001847839373088685, 0.00018481514678899083, 0.0001848305359327217, 0.00018489081651376147, 0.00018489247171253823, 0.00018495724082568806], 0, 9.295566320419312, 1576656137.8889992], "v": 0.1}
{"i": ["cuda -model=unknown", "topi_nn_conv2d", [["TENSOR", [1, 512, 28, 28], "float32"], ["TENSOR", [512, 512, 3, 3], "float32"], [1, 1], [1, 1], [1, 1], "NCHW", "float32"], {}, ["conv2d", [1, 512, 28, 28, "float32"], [512, 512, 3, 3, "float32"], [1, 1], [1, 1], [1, 1], "NCHW", "float32"], {"i": 1172529, "t": "winograd", "c": null, "e": [["tile_b", "sp", [-1, 1, 1, 1]], ["tile_y", "sp", [-1, 1, 4, 8]], ["tile_x", "sp", [-1, 7, 28, 1]], ["tile_rc", "sp", [-1, 8]], ["auto_unroll_max_step", "ot", 1500], ["unroll_explicit", "ot", 1]]}], "r": [[0.0003213928288288288, 0.00032142876126126124, 0.00032144187087087086, 0.00032147865615615614, 0.0003215641951951952, 0.0003216147882882883, 0.0003216725465465465, 0.00032167922822822826], 0, 4.207469701766968, 1576658581.2087324], "v": 0.1}
{"i": ["cuda -model=unknown", "topi_nn_conv2d", [["TENSOR", [1, 512, 14, 14], "float32"], ["TENSOR", [512, 512, 3, 3], "float32"], [1, 1], [1, 1], [1, 1], "NCHW", "float32"], {}, ["conv2d", [1, 512, 14, 14, "float32"], [512, 512, 3, 3, "float32"], [1, 1], [1, 1], [1, 1], "NCHW", "float32"], {"i": 31806, "t": "winograd", "c": null, "e": [["tile_b", "sp", [-1, 1, 1, 1]], ["tile_y", "sp", [-1, 1, 16, 4]], ["tile_x", "sp", [-1, 7, 7, 1]], ["tile_rc", "sp", [-1, 16]], ["auto_unroll_max_step", "ot", 128], ["unroll_explicit", "ot", 0]]}], "r": [[0.00012261084089750128, 0.00012261468179500256, 0.0001226194385517593, 0.0001226484033656298, 0.00012265550178480367, 0.00012267854207037224, 0.00012268475063742987, 0.00012270045283018868], 0, 8.118497133255005, 1576660636.3987286], "v": 0.1}
{"i": ["cuda -model=unknown", "topi_nn_dense", [["TENSOR", [1, 25088], "float32"], ["TENSOR", [4096, 25088], "float32"], null, "float32"], {}, ["dense", [1, 25088, "float32"], [4096, 25088, "float32"], 0, "float32"], {"i": 20, "t": "direct", "c": null, "e": [["tile_k", "sp", [-1, 512]]]}], "r": [[0.0017204462500000001, 0.0017206680227272728, 0.0017207383863636363, 0.0017208100568181818, 0.0017209053977272728, 0.0017209912159090908, 0.0017212201136363634, 0.001721318909090909], 0, 3.1095077991485596, 1576661831.3531494], "v": 0.1}
{"i": ["cuda -model=unknown", "topi_nn_dense", [["TENSOR", [1, 4096], "float32"], ["TENSOR", [4096, 4096], "float32"], null, "float32"], {}, ["dense", [1, 4096, "float32"], [4096, 4096, "float32"], 0, "float32"], {"i": 10, "t": "direct", "c": null, "e": [["tile_k", "sp", [-1, 1024]]]}], "r": [[0.0002654189538807649, 0.0002654267705286839, 0.0002654766062992126, 0.0002654796209223847, 0.00026549371766029247, 0.00026550077615298086, 0.00026550680877390325, 0.00027823597975253094], 0, 4.076004505157471, 1576661847.877501], "v": 0.1}
{"i": ["cuda -model=unknown", "topi_nn_dense", [["TENSOR", [1, 4096], "float32"], ["TENSOR", [1000, 4096], "float32"], null, "float32"], {}, ["dense", [1, 4096, "float32"], [1000, 4096, "float32"], 0, "float32"], {"i": 8, "t": "direct", "c": null, "e": [["tile_k", "sp", [-1, 256]]]}], "r": [[6.899598885395827e-05, 6.899706201771935e-05, 6.902277507859388e-05, 6.903307116318948e-05, 6.903308116604745e-05, 6.905720777364962e-05, 6.906179079737068e-05, 6.906601571877679e-05], 0, 4.010441780090332, 1576661867.8294497], "v": 0.1}
