mytophub/20191227/vgg16_bs_8.log
{"i": ["cuda -model=unknown", "topi_nn_conv2d", [["TENSOR", [8, 3, 224, 224], "float32"], ["TENSOR", [64, 3, 3, 3], "float32"], [1, 1], [1, 1], [1, 1], "NCHW", "float32"], {}, ["conv2d", [8, 3, 224, 224, "float32"], [64, 3, 3, 3, "float32"], [1, 1], [1, 1], [1, 1], "NCHW", "float32"], {"i": 123169609, "t": "direct", "c": null, "e": [["tile_f", "sp", [-1, 1, 8, 8]], ["tile_y", "sp", [-1, 1, 1, 1]], ["tile_x", "sp", [-1, 14, 16, 1]], ["tile_rc", "sp", [-1, 3]], ["tile_ry", "sp", [-1, 1]], ["tile_rx", "sp", [-1, 3]], ["auto_unroll_max_step", "ot", 0], ["unroll_explicit", "ot", 1]]}], "r": [[0.00043884453801169593, 0.0004389303333333333, 0.0004389471783625731, 0.00043897208479532163, 0.00043899851461988307, 0.0004390054532163743, 0.0004390314356725146, 0.0004391633771929825], 0, 31.968744039535522, 1576756800.1847723], "v": 0.1}
{"i": ["cuda -model=unknown", "topi_nn_conv2d", [["TENSOR", [8, 64, 224, 224], "float32"], ["TENSOR", [64, 64, 3, 3], "float32"], [1, 1], [1, 1], [1, 1], "NCHW", "float32"], {}, ["conv2d", [8, 64, 224, 224, "float32"], [64, 64, 3, 3, "float32"], [1, 1], [1, 1], [1, 1], "NCHW", "float32"], {"i": 6849591, "t": "winograd", "c": null, "e": [["tile_b", "sp", [-1, 1, 1, 1]], ["tile_y", "sp", [-1, 1, 16, 4]], ["tile_x", "sp", [-1, 4, 16, 1]], ["tile_rc", "sp", [-1, 4]], ["auto_unroll_max_step", "ot", 1500], ["unroll_explicit", "ot", 1]]}], "r": [[0.0051756865, 0.005176650233333333, 0.005176739033333333, 0.005176748266666667, 0.0051773150333333335, 0.0051774181, 0.005178210966666667, 0.005178377299999999], 0, 13.34377384185791, 1576760985.4057124], "v": 0.1}
{"i": ["cuda -model=unknown", "topi_nn_conv2d", [["TENSOR", [8, 64, 112, 112], "float32"], ["TENSOR", [128, 64, 3, 3], "float32"], [1, 1], [1, 1], [1, 1], "NCHW", "float32"], {}, ["conv2d", [8, 64, 112, 112, "float32"], [128, 64, 3, 3, "float32"], [1, 1], [1, 1], [1, 1], "NCHW", "float32"], {"i": 5485309, "t": "winograd", "c": null, "e": [["tile_b", "sp", [-1, 1, 1, 1]], ["tile_y", "sp", [-1, 1, 8, 16]], ["tile_x", "sp", [-1, 4, 16, 1]], ["tile_rc", "sp", [-1, 8]], ["auto_unroll_max_step", "ot", 1500], ["unroll_explicit", "ot", 1]]}], "r": [[0.00201113948, 0.0020111664, 0.0020113777866666667, 0.0020113957466666665, 0.0020118043733333337, 0.0020118242666666668, 0.00201183216, 0.0020119977066666668], 0, 27.35636830329895, 1576765599.6230526], "v": 0.1}
{"i": ["cuda -model=unknown", "topi_nn_conv2d", [["TENSOR", [8, 128, 112, 112], "float32"], ["TENSOR", [128, 128, 3, 3], "float32"], [1, 1], [1, 1], [1, 1], "NCHW", "float32"], {}, ["conv2d", [8, 128, 112, 112, "float32"], [128, 128, 3, 3, "float32"], [1, 1], [1, 1], [1, 1], "NCHW", "float32"], {"i": 2749281, "t": "winograd", "c": null, "e": [["tile_b", "sp", [-1, 1, 1, 1]], ["tile_y", "sp", [-1, 4, 8, 4]], ["tile_x", "sp", [-1, 4, 16, 1]], ["tile_rc", "sp", [-1, 8]], ["auto_unroll_max_step", "ot", 1500], ["unroll_explicit", "ot", 0]]}], "r": [[0.0026774523859649122, 0.002678032736842105, 0.002678074543859649, 0.0026782198947368423, 0.0026784177543859645, 0.0026787226315789473, 0.002678738631578947, 0.0026790771578947365], 0, 25.030742168426514, 1576769260.3778613], "v": 0.1}
{"i": ["cuda -model=unknown", "topi_nn_conv2d", [["TENSOR", [8, 128, 56, 56], "float32"], ["TENSOR", [256, 128, 3, 3], "float32"], [1, 1], [1, 1], [1, 1], "NCHW", "float32"], {}, ["conv2d", [8, 128, 56, 56, "float32"], [256, 128, 3, 3, "float32"], [1, 1], [1, 1], [1, 1], "NCHW", "float32"], {"i": 3262689, "t": "winograd", "c": null, "e": [["tile_b", "sp", [-1, 1, 1, 1]], ["tile_y", "sp", [-1, 1, 16, 16]], ["tile_x", "sp", [-1, 2, 8, 2]], ["tile_rc", "sp", [-1, 8]], ["auto_unroll_max_step", "ot", 128], ["unroll_explicit", "ot", 1]]}], "r": [[0.0011918108015873015, 0.0011918624761904763, 0.0011919034126984126, 0.0011919254523809523, 0.0011919315476190478, 0.0011919345952380953, 0.0011920441587301588, 0.0011921915317460318], 0, 32.866421699523926, 1576775616.8286216], "v": 0.1}
{"i": ["cuda -model=unknown", "topi_nn_conv2d", [["TENSOR", [8, 256, 56, 56], "float32"], ["TENSOR", [256, 256, 3, 3], "float32"], [1, 1], [1, 1], [1, 1], "NCHW", "float32"], {}, ["conv2d", [8, 256, 56, 56, "float32"], [256, 256, 3, 3, "float32"], [1, 1], [1, 1], [1, 1], "NCHW", "float32"], {"i": 3632289, "t": "winograd", "c": null, "e": [["tile_b", "sp", [-1, 1, 1, 1]], ["tile_y", "sp", [-1, 1, 16, 16]], ["tile_x", "sp", [-1, 2, 8, 2]], ["tile_rc", "sp", [-1, 8]], ["auto_unroll_max_step", "ot", 128], ["unroll_explicit", "ot", 1]]}], "r": [[0.0017913505952380953, 0.0017916381785714286, 0.001791678892857143, 0.0017921378095238096, 0.0017922411904761903, 0.0017922746785714286, 0.001792527857142857, 0.0017926656785714288], 0, 48.27368664741516, 1576781325.8835814], "v": 0.1}
{"i": ["cuda -model=unknown", "topi_nn_conv2d", [["TENSOR", [8, 256, 28, 28], "float32"], ["TENSOR", [512, 256, 3, 3], "float32"], [1, 1], [1, 1], [1, 1], "NCHW", "float32"], {}, ["conv2d", [8, 256, 28, 28, "float32"], [512, 256, 3, 3, "float32"], [1, 1], [1, 1], [1, 1], "NCHW", "float32"], {"i": 531014, "t": "winograd", "c": null, "e": [["tile_b", "sp", [-1, 1, 1, 1]], ["tile_y", "sp", [-1, 1, 8, 8]], ["tile_x", "sp", [-1, 2, 8, 2]], ["tile_rc", "sp", [-1, 16]], ["auto_unroll_max_step", "ot", 0], ["unroll_explicit", "ot", 0]]}], "r": [[0.001271321462184874, 0.0012713655210084033, 0.0012714528235294117, 0.0012714854957983194, 0.001271555848739496, 0.0012715957899159666, 0.001271636025210084, 0.0012725462689075632], 0, 6.772793531417847, 1576785302.1855698], "v": 0.1}
{"i": ["cuda -model=unknown", "topi_nn_conv2d", [["TENSOR", [8, 512, 28, 28], "float32"], ["TENSOR", [512, 512, 3, 3], "float32"], [1, 1], [1, 1], [1, 1], "NCHW", "float32"], {}, ["conv2d", [8, 512, 28, 28, "float32"], [512, 512, 3, 3, "float32"], [1, 1], [1, 1], [1, 1], "NCHW", "float32"], {"i": 1763018, "t": "winograd", "c": null, "e": [["tile_b", "sp", [-1, 1, 1, 1]], ["tile_y", "sp", [-1, 1, 16, 8]], ["tile_x", "sp", [-1, 2, 8, 2]], ["tile_rc", "sp", [-1, 16]], ["auto_unroll_max_step", "ot", 128], ["unroll_explicit", "ot", 0]]}], "r": [[0.0021595973428571425, 0.002159768957142857, 0.0021598224285714284, 0.0021598359428571428, 0.0021598460142857145, 0.0021604248714285714, 0.002161826742857143, 0.002163405814285714], 0, 6.428175449371338, 1576789309.7965672], "v": 0.1}
{"i": ["cuda -model=unknown", "topi_nn_conv2d", [["TENSOR", [8, 512, 14, 14], "float32"], ["TENSOR", [512, 512, 3, 3], "float32"], [1, 1], [1, 1], [1, 1], "NCHW", "float32"], {}, ["conv2d", [8, 512, 14, 14, "float32"], [512, 512, 3, 3, "float32"], [1, 1], [1, 1], [1, 1], "NCHW", "float32"], {"i": 2340042, "t": "winograd", "c": null, "e": [["tile_b", "sp", [-1, 1, 1, 1]], ["tile_y", "sp", [-1, 2, 8, 4]], ["tile_x", "sp", [-1, 7, 8, 1]], ["tile_rc", "sp", [-1, 8]], ["auto_unroll_max_step", "ot", 1500], ["unroll_explicit", "ot", 1]]}], "r": [[0.0005950515256916996, 0.0005951132292490118, 0.0005951994664031621, 0.0005952432411067194, 0.000595274442687747, 0.0005952786007905139, 0.0005952991739130435, 0.00059571485770751], 0, 19.57026195526123, 1576792761.9634597], "v": 0.1}
{"i": ["cuda -model=unknown", "topi_nn_dense", [["TENSOR", [8, 25088], "float32"], ["TENSOR", [4096, 25088], "float32"], null, "float32"], {}, ["dense", [8, 25088, "float32"], [4096, 25088, "float32"], 0, "float32"], {"i": 20, "t": "direct", "c": null, "e": [["tile_k", "sp", [-1, 512]]]}], "r": [[0.013735978133333333, 0.013737530266666666, 0.0137389568, 0.013739324, 0.013739936866666667, 0.0137405719, 0.013741592666666667, 0.013742133600000001], 0, 5.85648512840271, 1576796347.5640316], "v": 0.1}
{"i": ["cuda -model=unknown", "topi_nn_dense", [["TENSOR", [8, 4096], "float32"], ["TENSOR", [4096, 4096], "float32"], null, "float32"], {}, ["dense", [8, 4096, "float32"], [4096, 4096, "float32"], 0, "float32"], {"i": 10, "t": "direct", "c": null, "e": [["tile_k", "sp", [-1, 1024]]]}], "r": [[0.0020749986315789473, 0.002075076184210526, 0.0020751295175438595, 0.0020752010263157894, 0.002075247114035088, 0.002075259842105263, 0.0020753068859649124, 0.002075465684210526], 0, 3.755605697631836, 1576796424.9416084], "v": 0.1}
{"i": ["cuda -model=unknown", "topi_nn_dense", [["TENSOR", [8, 4096], "float32"], ["TENSOR", [1000, 4096], "float32"], null, "float32"], {}, ["dense", [8, 4096, "float32"], [1000, 4096, "float32"], 0, "float32"], {"i": 10, "t": "direct", "c": null, "e": [["tile_k", "sp", [-1, 1024]]]}], "r": [[0.0005117982194092827, 0.0005118024556962026, 0.000511832552742616, 0.0005119014367088607, 0.000511920835443038, 0.0005119257658227848, 0.0005119599385665529, 0.0005120105632911392], 0, 3.3364245891571045, 1576796444.9151719], "v": 0.1}
