mytophub/20191227/vgg16_bs_128.log
{"i": ["cuda -model=unknown", "topi_nn_conv2d", [["TENSOR", [128, 3, 224, 224], "float32"], ["TENSOR", [64, 3, 3, 3], "float32"], [1, 1], [1, 1], [1, 1], "NCHW", "float32"], {}, ["conv2d", [128, 3, 224, 224, "float32"], [64, 3, 3, 3, "float32"], [1, 1], [1, 1], [1, 1], "NCHW", "float32"], {"i": 68546767, "t": "direct", "c": null, "e": [["tile_f", "sp", [-1, 1, 4, 16]], ["tile_y", "sp", [-1, 1, 1, 1]], ["tile_x", "sp", [-1, 4, 56, 1]], ["tile_rc", "sp", [-1, 1]], ["tile_ry", "sp", [-1, 1]], ["tile_rx", "sp", [-1, 1]], ["auto_unroll_max_step", "ot", 1500], ["unroll_explicit", "ot", 0]]}], "r": [[0.0067756335, 0.006775662866666667, 0.0067762048666666665, 0.006777074466666667, 0.0067775465666666665, 0.006777862433333334, 0.006778341166666666, 0.006779208033333334], 0, 8.05925464630127, 1577084106.3366344], "v": 0.1}
{"i": ["cuda -model=unknown", "topi_nn_conv2d", [["TENSOR", [128, 64, 224, 224], "float32"], ["TENSOR", [64, 64, 3, 3], "float32"], [1, 1], [1, 1], [1, 1], "NCHW", "float32"], {}, ["conv2d", [128, 64, 224, 224, "float32"], [64, 64, 3, 3, "float32"], [1, 1], [1, 1], [1, 1], "NCHW", "float32"], {"i": 12247764, "t": "winograd", "c": null, "e": [["tile_b", "sp", [-1, 1, 1, 1]], ["tile_y", "sp", [-1, 4, 4, 4]], ["tile_x", "sp", [-1, 4, 16, 1]], ["tile_rc", "sp", [-1, 32]], ["auto_unroll_max_step", "ot", 0], ["unroll_explicit", "ot", 1]]}], "r": [[0.0806969979, 0.08069946880000001, 0.08070511206666667, 0.08070760733333333, 0.0807098196, 0.08071011046666668, 0.08071752313333333, 0.08071768186666667], 0, 66.33862924575806, 1577092677.258777], "v": 0.1}
{"i": ["cuda -model=unknown", "topi_nn_conv2d", [["TENSOR", [128, 64, 112, 112], "float32"], ["TENSOR", [128, 64, 3, 3], "float32"], [1, 1], [1, 1], [1, 1], "NCHW", "float32"], {}, ["conv2d", [128, 64, 112, 112, "float32"], [128, 64, 3, 3, "float32"], [1, 1], [1, 1], [1, 1], "NCHW", "float32"], {"i": 14435333, "t": "winograd", "c": null, "e": [["tile_b", "sp", [-1, 1, 1, 1]], ["tile_y", "sp", [-1, 16, 4, 2]], ["tile_x", "sp", [-1, 4, 16, 1]], ["tile_rc", "sp", [-1, 32]], ["auto_unroll_max_step", "ot", 128], ["unroll_explicit", "ot", 1]]}], "r": [[0.032299483766666665, 0.03230264333333333, 0.03231041233333334, 0.032312964933333334, 0.0323159521, 0.03231791446666667, 0.03232048813333333, 0.0323223204], 0, 63.83933424949646, 1577099581.9539115], "v": 0.1}
{"i": ["cuda -model=unknown", "topi_nn_conv2d", [["TENSOR", [128, 128, 112, 112], "float32"], ["TENSOR", [128, 128, 3, 3], "float32"], [1, 1], [1, 1], [1, 1], "NCHW", "float32"], {}, ["conv2d", [128, 128, 112, 112, "float32"], [128, 128, 3, 3, "float32"], [1, 1], [1, 1], [1, 1], "NCHW", "float32"], {"i": 15398697, "t": "winograd", "c": null, "e": [["tile_b", "sp", [-1, 1, 1, 1]], ["tile_y", "sp", [-1, 8, 8, 2]], ["tile_x", "sp", [-1, 2, 4, 4]], ["tile_rc", "sp", [-1, 8]], ["auto_unroll_max_step", "ot", 128], ["unroll_explicit", "ot", 1]]}], "r": [[0.0486389951, 0.048642012166666665, 0.048642853933333334, 0.048643071366666665, 0.0486454236, 0.04864591186666667, 0.04865160723333333, 0.04865232966666667], 0, 119.94365000724792, 1577112890.8096297], "v": 0.1}
{"i": ["cuda -model=unknown", "topi_nn_conv2d", [["TENSOR", [128, 128, 56, 56], "float32"], ["TENSOR", [256, 128, 3, 3], "float32"], [1, 1], [1, 1], [1, 1], "NCHW", "float32"], {}, ["conv2d", [128, 128, 56, 56, "float32"], [256, 128, 3, 3, "float32"], [1, 1], [1, 1], [1, 1], "NCHW", "float32"], {"i": 13454535, "t": "winograd", "c": null, "e": [["tile_b", "sp", [-1, 1, 1, 1]], ["tile_y", "sp", [-1, 4, 16, 4]], ["tile_x", "sp", [-1, 4, 16, 1]], ["tile_rc", "sp", [-1, 32]], ["auto_unroll_max_step", "ot", 128], ["unroll_explicit", "ot", 1]]}], "r": [[0.018519757600000002, 0.018520261033333332, 0.018522302966666668, 0.01852448563333333, 0.018527181533333333, 0.018528770966666667, 0.018530687866666666, 0.018535437], 0, 46.35883831977844, 1577126759.9553223], "v": 0.1}
{"i": ["cuda -model=unknown", "topi_nn_conv2d", [["TENSOR", [128, 256, 56, 56], "float32"], ["TENSOR", [256, 256, 3, 3], "float32"], [1, 1], [1, 1], [1, 1], "NCHW", "float32"], {}, ["conv2d", [128, 256, 56, 56, "float32"], [256, 256, 3, 3, "float32"], [1, 1], [1, 1], [1, 1], "NCHW", "float32"], {"i": 17447555, "t": "winograd", "c": null, "e": [["tile_b", "sp", [-1, 1, 1, 1]], ["tile_y", "sp", [-1, 2, 8, 8]], ["tile_x", "sp", [-1, 4, 16, 1]], ["tile_rc", "sp", [-1, 8]], ["auto_unroll_max_step", "ot", 1500], ["unroll_explicit", "ot", 1]]}], "r": [[0.027734048233333333, 0.027735653533333335, 0.0277368192, 0.027737061266666665, 0.027737964966666664, 0.027741680300000002, 0.027743143966666665, 0.027746712266666664], 0, 115.22682452201843, 1577141152.0336742], "v": 0.1}
{"i": ["cuda -model=unknown", "topi_nn_conv2d", [["TENSOR", [128, 256, 28, 28], "float32"], ["TENSOR", [512, 256, 3, 3], "float32"], [1, 1], [1, 1], [1, 1], "NCHW", "float32"], {}, ["conv2d", [128, 256, 28, 28, "float32"], [512, 256, 3, 3, "float32"], [1, 1], [1, 1], [1, 1], "NCHW", "float32"], {"i": 24231422, "t": "winograd", "c": null, "e": [["tile_b", "sp", [-1, 1, 1, 1]], ["tile_y", "sp", [-1, 1, 16, 16]], ["tile_x", "sp", [-1, 4, 16, 1]], ["tile_rc", "sp", [-1, 32]], ["auto_unroll_max_step", "ot", 1500], ["unroll_explicit", "ot", 1]]}], "r": [[0.019290107100000002, 0.019290146866666667, 0.019290160100000002, 0.019290439766666667, 0.019290458833333336, 0.01929097546666667, 0.0192913101, 0.019291328], 0, 21.033047199249268, 1577150648.347193], "v": 0.1}
{"i": ["cuda -model=unknown", "topi_nn_conv2d", [["TENSOR", [128, 512, 28, 28], "float32"], ["TENSOR", [512, 512, 3, 3], "float32"], [1, 1], [1, 1], [1, 1], "NCHW", "float32"], {}, ["conv2d", [128, 512, 28, 28, "float32"], [512, 512, 3, 3, "float32"], [1, 1], [1, 1], [1, 1], "NCHW", "float32"], {"i": 25683395, "t": "winograd", "c": null, "e": [["tile_b", "sp", [-1, 1, 1, 1]], ["tile_y", "sp", [-1, 2, 8, 8]], ["tile_x", "sp", [-1, 4, 16, 1]], ["tile_rc", "sp", [-1, 8]], ["auto_unroll_max_step", "ot", 1500], ["unroll_explicit", "ot", 1]]}], "r": [[0.033039312566666666, 0.0330393956, 0.0330400433, 0.033040511433333336, 0.0330418653, 0.033042196466666666, 0.03304370053333334, 0.03304389433333334], 0, 68.99351716041565, 1577161518.120259], "v": 0.1}
{"i": ["cuda -model=unknown", "topi_nn_conv2d", [["TENSOR", [128, 512, 14, 14], "float32"], ["TENSOR", [512, 512, 3, 3], "float32"], [1, 1], [1, 1], [1, 1], "NCHW", "float32"], {}, ["conv2d", [128, 512, 14, 14, "float32"], [512, 512, 3, 3, "float32"], [1, 1], [1, 1], [1, 1], "NCHW", "float32"], {"i": 6624328, "t": "winograd", "c": null, "e": [["tile_b", "sp", [-1, 1, 1, 1]], ["tile_y", "sp", [-1, 4, 16, 4]], ["tile_x", "sp", [-1, 4, 16, 1]], ["tile_rc", "sp", [-1, 32]], ["auto_unroll_max_step", "ot", 1500], ["unroll_explicit", "ot", 0]]}], "r": [[0.0084244303, 0.008424947666666667, 0.008425014966666667, 0.008425178866666666, 0.0084256713, 0.008425792900000001, 0.0084277559, 0.008427820499999999], 0, 21.29027485847473, 1577172345.6539006], "v": 0.1}
{"i": ["cuda -model=unknown", "topi_nn_dense", [["TENSOR", [128, 25088], "float32"], ["TENSOR", [4096, 25088], "float32"], null, "float32"], {}, ["dense", [128, 25088, "float32"], [4096, 25088, "float32"], 0, "float32"], {"i": 516298, "t": "direct", "c": null, "e": [["tile_x", "sp", [-1, 1, 16, 2]], ["tile_y", "sp", [-1, 1, 16, 4]], ["tile_k", "sp", [-1, 49, 1]]]}], "r": [[0.0100990975, 0.010099897166666667, 0.0101001379, 0.0101002811, 0.010100448666666668, 0.0101010431, 0.010101399533333333, 0.0101016677], 0, 58.480523109436035, 1577177656.6776683], "v": 0.1}
{"i": ["cuda -model=unknown", "topi_nn_dense", [["TENSOR", [128, 4096], "float32"], ["TENSOR", [4096, 4096], "float32"], null, "float32"], {}, ["dense", [128, 4096, "float32"], [4096, 4096, "float32"], 0, "float32"], {"i": 1981828, "t": "direct", "c": null, "e": [["tile_x", "sp", [-1, 4, 16, 1]], ["tile_y", "sp", [-1, 4, 16, 2]], ["tile_k", "sp", [-1, 1, 8]]]}], "r": [[0.0023489219555555556, 0.002352316322222222, 0.0023525885444444445, 0.0023527369333333336, 0.002353442922222222, 0.002353896488888889, 0.0023555189444444445, 0.0023664568], 0, 3.5413146018981934, 1577181748.0170348], "v": 0.1}
{"i": ["cuda -model=unknown", "topi_nn_dense", [["TENSOR", [128, 4096], "float32"], ["TENSOR", [1000, 4096], "float32"], null, "float32"], {}, ["dense", [128, 4096, "float32"], [1000, 4096, "float32"], 0, "float32"], {"i": 149902, "t": "direct", "c": null, "e": [["tile_x", "sp", [-1, 2, 8, 1]], ["tile_y", "sp", [-1, 5, 8, 1]], ["tile_k", "sp", [-1, 8, 1]]]}], "r": [[0.0006632385418502203, 0.0006632589207048458, 0.00066326459030837, 0.0006636647444933921, 0.0006639716167400881, 0.0006640934713656387, 0.0006641958414096916, 0.0006642457268722467], 0, 9.101941585540771, 1577183463.872119], "v": 0.1}
